"source", "destination", "startingTime", "finishingTime", "score", "size", "message", "thread", "href", "parent"
"Power_Drain","piponwa","2015-08-25 04:01:29","2015-08-25 04:01:29","1","51","Isn't what he's saying a bit backwards? The camera is free floating in space traveling at the same speed as the ship. When the burn starts the camera isn't moving towards us, we're moving towards the camera. The camera isn't attached to ship no acceleration is acting on the camera. Edit: 's","cue4i5u","cue4i5u","3i6pii"
"nexx84","piponwa","2015-08-24 23:52:07","2015-08-24 23:52:07","1","11","saw him floating up instantly thought of that jamiroquai video https://www.youtube.com/watch?v=4JkIs37a2JE","cudvekb","cudvekb","3i6pii"
"Maxion","bonestamp","2015-08-25 02:31:33","2015-08-25 02:31:33","12","42","Lens coatings are much more durable than you may believe. A ""protective"" UV filter doesn't really help and doesn't make much sense unless you're shooting a lens that needs one to be water resistant (looking at you EF 16-35mm f/2.8 L II)","cudsdal","cue102i","cudzf9r"
"piponwa","HaveJoystick","2015-08-25 06:24:25","2015-08-25 06:24:25","3","35","&gt;Also good job there, making yourself sound really smart by resulting to bad language. Good job in the first place making everybody that doesn't know physics dumb. That's not how you encourage people to learn it.","cue8jtr","cuea6cn","cuea1tj"
"haabilo","DrHotchocolate","2015-08-25 04:03:32","2015-08-25 04:03:32","2","35","I think /u/White_Heart meant that if the ISS couldn't be supplied with additional propellant to keep it in orbit, it would be because people on Earth's surface would be facing nothing short of an apocalypse...","cudtq1w","cue4l3q","cue1l7i"
"supafly_","__rosebud__","2015-08-25 02:11:33","2015-08-25 02:11:33","12","33","Technically it would move away from the (filming) camera, and when the engines fired, the space station (that the (filming) camera is mounted to) would accelerate toward &amp; overtake the floating camera.","cudv3gu","cue08bj","cudyv49"
"KristnSchaalisahorse","IMakeBadPlays","2015-08-25 02:14:28","2015-08-25 02:14:28","2","7","HTV doesn't provide boosts, unfortunately. Edit: spelling","cudvgr6","cue0caf","cudws4v"
"Namco51","piponwa","2015-08-25 00:43:00","2015-08-25 00:43:00","-1","18","That's 'minute', not 'finite', dumbass!!! (Just wanted to grammar nazi an astronaut who is undoubetedly 1000% smarter than I am)","cudx0um","cudx0um","3i6pii"
"Qwirk","piponwa","2015-08-25 02:00:12","2015-08-25 02:00:12","5","18","Ah man, now I really need more details. Why the telescopic lens if it's for on board experiments?","cudw7yi","cudzszu","cudwgzs"
"naaml00s246","Lolmoqz","2015-08-25 03:05:32","2015-08-25 03:05:32","1","46","No, if you throw a ball in space, let's say, with a relative speed of 10 m/s, and then move in the same direction with a speed of 15 m/s, it'll look like the ball is moving the opposite direction with a speed of 5 m/s. It's all relative.","cudv3gu","cue2bew","cue0c7k"
"smallshinyant","clothes_are_optional","2015-09-02 07:01:33","2015-09-02 07:01:33","1","66","Oh, i used the audio book(Its an addiction i seem to have). It makes stories like this really enjoyable. Its a bit like ""Ready Player One"", so many lists and and tiny bits of off story information, but when these stories are being narrated it makes it seems to make it much more enjoyable and help me read a great story i would normally of missed.","cudtq1w","cunfrt5","cue5dsm"
"MrRandomSuperhero","Gnoem","2015-08-25 01:06:01","2015-08-25 01:06:01","3","32","Terminal velocity is an effect of the air equalising the upward pressure/resistance with the pull of gravity. At that point you are again at 1G. Before that it depends on height etc.","cudtf0o","cudxtfu","cudwywg"
"yetanothercfcgrunt","babuchas","2015-08-25 02:55:58","2015-08-25 02:55:58","4","13","The camera that's filming is accelerating towards him, not the other way around.","cuduquh","cue1xxk","cudvgj4"
"Frexxia","Nimitz14","2015-08-26 15:35:17","2015-08-26 15:35:17","1","33","The acceleration is the derivative of the velocity with respect to time, and both are vector quantities. That means that if the velocity is changing (this includes turning) then there is nonzero acceleration.","cudtf0o","cufz9rl","cuew3u8"
"B4nK5y","5w44e634643","2015-08-25 01:23:14","2015-08-25 01:23:14","6","12","well on the ISS they're still using the IBM ones I think","cudvmy3","cudyfk6","cudwy89"
"HydroCabron","Mamamia520","2015-08-25 04:44:41","2015-08-25 04:44:41","1","142","&gt; are there notable differences when walking or doing activity on different parts of the globe due to this? You are slightly heavier at the poles - remember that at the equator, you're travelling east at over 1000 mph just standing there, which lightens you up a bit compared to being at higher latitudes. Rotational effects are more pronounced, if still not noticeable in everyday life. Toilets may still flush clockwise or counterclockwise, depending on design, and not whether you're in Australia or Stockholm, but artillery sighting and snipers take into account the earth's rotation as manifested in coriolis forces (see [this youtube video](https://www.google.com/url?sa=t&amp;rct=j&amp;q=&amp;esrc=s&amp;source=web&amp;cd=1&amp;cad=rja&amp;uact=8&amp;ved=0CB4QtwIwAGoVChMIwqmPta_CxwIVCFiSCh24EwE2&amp;url=http%3A%2F%2Fwww.youtube.com%2Fwatch%3Fv%3DjX7dcl_ERNs&amp;ei=T2XbVYLGLIiwyQS4p4SwAw&amp;usg=AFQjCNFZqXx8NU6H7CWjNZoZX-VxHhWMtA&amp;sig2=9SAikJeGR4Sjc8iAIblOOg)). I once saw a test bed for 3d gyroscopes suitable for satellites. I asked the technician about what looked like excessive digital noise in two of the coordinates, and he replied: ""Remember that this room is spinning along with the ground underneath us.""","cudtmxi","cue674d","cudwkww"
"OrginalCanadian","DrHotchocolate","2015-08-25 04:38:37","2015-08-25 04:38:37","1","10","\&gt;implying that NASA is the only contributor to the ISS","cudtq1w","cue5yen","cue1l7i"
"shibby3000","piponwa","2015-08-25 06:45:00","2015-08-25 06:45:00","1","17","I love how the inside looks like they just taped a bunch of laptops to the walls.","cueb0d1","cueb0d1","3i6pii"
"trippynumbers","crowjr","2015-08-25 04:01:50","2015-08-25 04:01:50","1","28","You know, I saw a recent KFC commercial and thought ""Man, this new Colonel sounds a lot like Norm, but there's no way that's him."" It was him.","cudt5jt","cue4ins","cudt5jt"
"lbmouse","Rob-E27","2015-08-25 06:30:36","2015-08-25 06:30:36","2","8","Imagine the sexual positions. Karma Sutra be damned.","cudtjwp","cueafdo","cudtjwp"
"yanomami","sunfishtommy","2015-08-25 15:31:51","2015-08-25 15:31:51","0","28","&gt; Actually skydiving is not quite the same No way, I was saying they are exactly the same thing, because I've both flown rockets in space and gone skydiving.","cudtf0o","cuesnci","cuehdnt"
"Princeofspeed","DorkSidedStuff","2015-08-25 10:55:28","2015-08-25 10:55:28","2","9","Had to scroll far to find a resounding sentiment","cudxcf9","cuek1bk","cudxcf9"
"jayme0227","SirButcher","2015-08-25 05:34:45","2015-08-25 05:34:45","1","54","505 people have been to space. 18 people have been killed in space flights, and another 11 died while training to go to space. In the US every year, fewer than 15 drivers die for every hundred thousand population. Call me crazy but those numbers would suggest that space flight is considerably more dangerous than driving a car.","cudsdal","cue86lu","cue7pmm"
"EffingTheIneffable","[deleted]","2015-08-25 06:38:18","2015-08-25 06:38:18","1","12","Haha, same here. ""ISS system not working?Try power cycling the whole thing!""","cudtq1w","cueaqj8","cudw56a"
"jama211","ConsummateK","2015-08-25 03:31:51","2015-08-25 03:31:51","0","21","His velocity with respect to the ship *is* changing, as his speed and the ships speed differ by an increasing amount.","cuduquh","cue3cgu","cue1htp"
"piponwa","aArem","2015-08-25 01:24:51","2015-08-25 01:24:51","2","13","How do you think he survives if there is no air in space?","cudyg40","cudyhml","cudyg40"
"Denziloe","BlowByDoze","2015-08-25 03:38:33","2015-08-25 03:38:33","1","24","Huh? Who is ""we""? For those of us not in freefall, no, we are not accelerating at 9.8m/s2 towards the centre of the Earth.","cudtmxi","cue3lxk","cudvq5b"
"Redblud","King_Joffreys_Tits","2015-08-25 11:19:44","2015-08-25 11:19:44","1","6","No, it totally ruins your posture.","cudtjwp","cuekxrc","cudzzjj"
"HaveJoystick","piponwa","2015-08-25 05:43:47","2015-08-25 05:43:47","-6","22","Not that space/ISS stuff isn't cool, but anybody who is amazed by acceleration must have never sat in any sort of vehicle.","cue8jtr","cue8jtr","3i6pii"
"InfanticideAquifer","jrhii","2015-08-25 22:55:52","2015-08-25 22:55:52","2","24","I have no idea. I exhausted my knowledge of telecommunications when I left my last comment :/ . But it's a good point you bring up.","cudvmy3","cuf01mu","cueuc77"
"temo89","WWIflyingace62","2015-08-25 15:02:51","2015-08-25 15:02:51","4","186","Not true. The definition of Delta V is just that a Delta ( change ) in velocity .Usually when we talk about Delta V we dont talk about negative or positive changes in Velocity we only consider its magnitude because that's what really matters (the higher the Delta V magnitude the more fuel we have to burn ). This applies to whether you are increasing your velocity from an initial slower velocity or vice versa. The basic equation for Delta V is Delta V = |V1-V0| Where V0 is your initial Velocity and V1 is the velocity you wish to be at this can be higher than V0(speeding up) or lower than (slowing down) . It's the magnitude that matters since this is directly related to Isp and this directly related to the mass that you burn per Delta V manuaver I.e the higher the magnitude of Delta V, no matter whether you speed up or slow down still burns fuel ! Source : I'am an Aerospace Graduate student finishing up my masters thesis. I concentrated in astro and have taken several undergraduate and advanced graduate level classes in Orbital Mechanics and Control.","cuelwqa","cuerzuy","cuelwqa"
"Craigy100","aedeos","2015-08-25 01:43:58","2015-08-25 01:43:58","1","19","Do you mean to say that a molecule of CO2 has the same mass as, say, an O2 molecule?","cudtjwp","cudz6xj","cudydne"
"MrRandomSuperhero","yanomami","2015-08-25 00:33:06","2015-08-25 00:33:06","3","18","When skydiving you do have some amount of gravity still in effect, especially once you reach terminal velocity.","cudtf0o","cudwowm","cudwbie"
"64bitllama","jeffmolby","2015-08-25 00:53:57","2015-08-25 00:53:57","2","42","That would be my thought too; my understanding is that they would need to burn at apoapsis, to lift the periapsis, then burn again at the previous point of apoapsis to circularize. Could anybody with more than a Kerbal understanding chime in?","cudwgdp","cudxe3d","cudwgdp"
"Spike2k187","piponwa","2015-08-24 22:36:14","2015-08-24 22:36:14","319","40","Man. Having zero gravity has to be one of the strangest things to live with. I can't imagine what it would be like to just let go of my laptop and be like ""here no gravity, hold this for me""","cudtf0o","cudtf0o","3i6pii"
"rvncto","piponwa","2015-08-25 02:44:45","2015-08-25 02:44:45","1","23","hahah its also interesting how his shirt doesnt sit on him and jsut sort of floats around him. and his arms float awkardly.","cue1i5m","cue1i5m","3i6pii"
"TyrannoFan","sticklebat","2015-08-25 04:44:09","2015-08-25 04:44:09","0","60","If you were really high above Earth and naturally started falling towards it, could you tell that you were accelerating towards Earth due to gravity? If all you could see was you and Earth itself, how would you know that you are the one accelerating? Similarly, from Earth's perspective, how could you tell that Earth is not accelerating towards you?","cuduquh","cue66bs","cudzqzq"
"michiness","Mare1000","2015-08-25 02:00:10","2015-08-25 02:00:10","119","20","Doesn't matter that it's staged. When he realizes he lost the pen and he looks *up* rather than down... hilarious.","cudtf0o","cudzsyf","cudu0ai"
"ForceBlade","Mare1000","2015-08-25 00:57:32","2015-08-25 00:57:32","154","13","Super staged... but it gets the image we all had in mind, across","cudtf0o","cudxile","cudu0ai"
"Mamamia520","Arnox","2015-08-25 01:34:17","2015-08-25 01:34:17","1","14","Gotcha. What about running times on same altitude with poles vs equator, for instance?","cudtmxi","cudytyp","cudyea6"
"chrisman01","UltraSpecial","2015-08-24 23:14:18","2015-08-24 23:14:18","22","13","Which is estimated at $20k per bottle but allows them to defy gravity.","cudsdal","cuduc16","cudtx7v"
"Mattho","Rob-E27","2015-08-25 00:09:55","2015-08-25 00:09:55","6","17","I think it's possible for people to pay for a ride on vomit comet. No sleep though...","cudtjwp","cudvy3u","cudtjwp"
"[deleted]","---___--","2015-08-25 00:29:39","2015-08-25 00:29:39","2","54","Oh shoot I really didn't mean for it to be like that! I used (I no longer shoot professionally, lost that drive) it for work and got it ridiculously cheap from a family member. I have so much envy for some of the gear I see photographers shooting with around me though...those sweet D4s.","cudsdal","cudwks5","cudwg13"
"HaveJoystick","piponwa","2015-08-25 06:21:11","2015-08-25 06:21:11","-3","28","Yeah, I do. It's a cool demonstration video, but just, you know... pretty physics 101. Also good job there, making yourself sound really smart by resulting to bad language.","cue8jtr","cuea1tj","cue9m8d"
"Jonathan_DB","Steve_the_Stevedore","2015-08-25 07:51:01","2015-08-25 07:51:01","0","16","But it is constantly a vector. And it is constantly towards the center of the earth.","cudtmxi","cuedl3j","cuec3ak"
"Rob-E27","iclimbnaked","2015-08-24 23:04:57","2015-08-24 23:04:57","3","32","Never thought about that. I have this weird thing when I sit in the back of a bus I get motion sickness. So I might be in trouble in zero G lol","cudtjwp","cudu3gw","cudtyil"
"Mindbruiser","piponwa","2015-08-25 00:09:05","2015-08-25 00:09:05","2","17","I can't believe they use IBM ThinkPads in space... PS: these guys must have the craziest parties.","cudvx6g","cudvx6g","3i6pii"
"rddman","piponwa","2015-08-25 00:27:39","2015-08-25 00:27:39","3","40","&gt; The reboosts increase the delta v of the station, which then lifts it up into a higher orbit because physics. That's an increase in orbital velocity. Delta-v is the difference between the previous velocity and the new velocity.","cudttdm","cudwidv","cudtxr8"
"MisterNetHead","120inna55","2015-08-25 12:24:07","2015-08-25 12:24:07","1","31","This kind of thing is what makes a good astronaut these days. They figure they can teach the science, engineering, and aviation easier than the softer skills, assuming you're smart enough.","cuejo37","cuenai4","cuejo37"
"TheBishopsBane","jama211","2015-08-25 03:14:46","2015-08-25 03:14:46","1","79","That is 100% incorrect. He and the camera are in an intertial frame of reference, but the ISS is in a non-intertial frame of reference - it has a force applied to it by its engines. This is causing the ISS to accelerate *(acceleration = force/mass)*. Since there is no force being applied to the camera or the astronaut when he lets go, there is no acceleration. Defining a frame of reference does not change this, so both statements are *not* correct.","cuduquh","cue2o9u","cue0z9a"
"butthead22","AgDrumma07","2015-08-25 13:30:48","2015-08-25 13:30:48","3","41","They can squirt water on their bodies (limited) from a nozzle in an enclosed plastic area and use a vacuum to suck it up off their body for filtering after they rub it around and whatnot. They also have no-rinse shampoo.","cudtjwp","cuephvm","cuem5kw"
"ElectroFlannelGore","labialcrown","2015-08-25 05:38:38","2015-08-25 05:38:38","1","6","*ISS: Reboosted 2: the rereboosting electric boogaloo*","cudtq1w","cue8c7s","cudx6na"
"DansBeerBelly","piponwa","2015-08-25 01:02:44","2015-08-25 01:02:44","1","10","Astronaut Norm Macdonald was very informative and an excellent demonstrator","cudxp6k","cudxp6k","3i6pii"
"miker95","Anna_Fylaxis","2015-08-25 09:44:52","2015-08-25 09:44:52","1","11","But they could find something that is closer to that amount.","cudsdal","cuehjr4","cued8vl"
"Forever_Awkward","Spike2k187","2015-08-25 06:02:46","2015-08-25 06:02:46","1","13","I feel like it would be so much more normal. Having gravity is weird.","cudtf0o","cue9bkv","cudtf0o"
"Reyer","hyperCubeSquared","2015-08-25 01:59:41","2015-08-25 01:59:41","14","18","Yup, and that acceleration towards a mass with an inertial frame of reference is indeterminable from zero gravity.","cudtmxi","cudzsao","cudtrpv"
"Denziloe","ProfessorPickaxe","2015-08-25 03:36:46","2015-08-25 03:36:46","1","10","Not exactly static; diffusion doesn't need gravity. But almost static.","cudtjwp","cue3jgb","cudyeao"
"runereader","TheRugAteMyShoe","2015-08-26 09:08:31","2015-08-26 09:08:31","1","16","The remainders of their *quality* ended when it turned out they're bundling malware with the laptops.","cudvmy3","cufn1fq","cueohaz"
"Narmotur","DeutschlandFickJa","2015-08-25 03:22:19","2015-08-25 03:22:19","1","21","If it makes you feel any better, it isn't actually floating; it's falling really really fast, and shooting sideways even faster!","cudyy0z","cue2yxl","cudyy0z"
"Druggedhippo","piponwa","2015-08-25 12:24:42","2015-08-25 12:24:42","1","8","[Here is another](https://www.youtube.com/watch?v=u4ggQdkTcLo) showing the same effect from 2011","cuenb8g","cuenb8g","3i6pii"
"beanmosheen","__rosebud__","2015-08-25 02:11:16","2015-08-25 02:11:16","54","70","As long as you pushed it away less than the change in station velocity yes. It's all relative velocity. Station is at 100 and needs to accelerate to 105. You push the camera forward 3 right when the engines ignite. Once the station hits 103 the camera will stop and then travel backwards relative to the change in velocity. When the station hits 105, the camera will be traveling back at 2. (Made up units for clarity.)","cudv3gu","cue07y7","cudyv49"
"aedeos","jaseworthing","2015-08-25 01:21:45","2015-08-25 01:21:45","1","20","Because gasses aren't heavier or lighter than one another so you exhale and nothing replaces the CO2 you breathe out.","cudtjwp","cudydne","cudxyqo"
"marvk","thecomicalside","2015-08-25 01:06:40","2015-08-25 01:06:40","2","8","[Rome with an 800mm photographed from the ISS.](http://spaceflight.nasa.gov/gallery/images/station/crew-7/hires/iss007e13126.jpg) [Source](http://spaceflight.nasa.gov/station/crew/exp7/luletters/lu_letter10.html)","cudxgpu","cudxua5","cudxgpu"
"OllieMarmot","ray_kats","2015-08-25 06:48:51","2015-08-25 06:48:51","2","11","2-3 years. You can see graphs showing the orbital decay/boost cycles [here](https://www.google.com/search?q=ISS+boost+graph&amp;biw=1680&amp;bih=913&amp;source=lnms&amp;tbm=isch&amp;sa=X&amp;ved=0CAcQ_AUoAmoVChMIq_q7uMvCxwIVlC2ICh3QGwJn#imgrc=e2fhOhj84Vdi9M%3A).","cue6zju","cueb5xt","cue6zju"
"Mega_Dunsparce","FrozenLava","2015-08-25 03:21:37","2015-08-25 03:21:37","1","13","Ah, Adams. If only flying was as simple as forgetting you are falling.","cudtf0o","cue2xvs","cudxv4c"
"BlowByDoze","Mamamia520","2015-08-25 02:06:44","2015-08-25 02:06:44","2","8","Not that we would notice in daily activities.","cudtmxi","cue01rv","cudwkww"
"jewsus83","Spike2k187","2015-08-25 01:20:48","2015-08-25 01:20:48","-1","52","I've read it's actually not 0 gravity, but the weightlessness that occurs during free fall. It's about 0.9g, and they're being pulled into earth, but when traveling at 17,000 it's like you're a projectile that just never lands because your speed keeps you afloat over earth (plus a reboost every once I a while)","cudtf0o","cudycep","cudtf0o"
"ebopnostop","piponwa","2015-08-25 04:34:33","2015-08-25 04:34:33","1","41","If the object had zero velocity (in the ship) AND a reboost never occured, when the astronaut placed the object in the air, would it eventually hit the ceiling or fall with the ISS? My coworker and I disagree on the outcome.","cue5skx","cue5skx","3i6pii"
"Phaedrus0230","askthespaceman","2015-08-25 08:29:12","2015-08-25 08:29:12","35","11","They tried it in Chernobyl... it didn't work out so well.","cudtq1w","cueey7i","cue8szn"
"clickclick-boom","zq6","2015-08-25 05:53:11","2015-08-25 05:53:11","2","25","If you do sudden spin movements do you feel your insides moving about? Also, any issues with stomach acid or general body fluids moving around?","cudtf0o","cue8xtu","cudy2dj"
"JonasBrosSuck","crowjr","2015-08-25 05:07:05","2015-08-25 05:07:05","1","22","that's why he sounded so familiar! thanks for pointing it out, on the second watch everything he says seems so much funnier","cudt5jt","cue72k1","cudt5jt"
"jama211","yetanothercfcgrunt","2015-08-25 04:06:36","2015-08-25 04:06:36","0","44","You're being an ass. This quote ""Read what I said instead of ignoring it and restating your misconception."" explains nothing, and your initial explanation was clearly insufficient. Get off your high horse. If you reply in any way disrespectfully from here, expect no reply.","cuduquh","cue4p9y","cue4f78"
"Dewy_Wanna_Go_There","autodidact89","2015-08-25 01:48:32","2015-08-25 01:48:32","1","10","We should get their skype name and DDoS them. /s","cudvmy3","cudzd2r","cudvmy3"
"Hello-Universe","syringistic","2015-08-25 10:12:21","2015-08-25 10:12:21","1","50","Makes sense. I guess a tennis ball is accelerating with your hand so when you throw it upwards it already has forward momentum.... I thought about a helium balloon floating around, it would almost certainly move...or, you know, somebody getting sucked into the seat during the quarter mile drag.","cueci1v","cueihjz","cuei6aq"
"calyco81","piponwa","2015-08-25 11:03:12","2015-08-25 11:03:12","1","22","You know you are a gearhead when you watch a video in space and go - Oh cool, they use Nikons and Thinkpads","cuekbbt","cuekbbt","3i6pii"
"polkadel","funkybassmannick","2015-08-24 23:55:16","2015-08-24 23:55:16","10","6","he reminded me of Tom Hanks","cudt5jt","cudvhxz","cuduo4v"
"ash_eve","jaseworthing","2015-08-25 01:16:37","2015-08-25 01:16:37","0","5","Because you breathe out CO2.","cudtjwp","cudy6yo","cudxyqo"
"LoungeFlyZ","yanomami","2015-08-25 00:54:04","2015-08-25 00:54:04","59","52","Technically you are falling while in orbit. There is gravity, but you get the sensation that there isn't because everything is relative. Technically they are falling towards earth, but because they are going so fast horizontally they fall ""around"" the earth instead of hitting it. At least that's the explanation commander Hadfield gives.","cudtf0o","cudxe85","cudwbie"
"paranoiainc","piponwa","2015-08-25 03:11:07","2015-08-25 03:11:07","8","25","It just dawned to me that difference in what I consider common knowledge and what astronauts consider common knowledge is haven and earth. Astronauts are awesome.","cue2j41","cue2j41","3i6pii"
"dadougler","Spike2k187","2015-08-25 08:40:02","2015-08-25 08:40:02","1","17","i bet it sucks if you forget and try to float out of bed in the morning","cudtf0o","cuefbx8","cudtmpj"
"Jowitness","InadequateUsername","2015-08-25 15:10:48","2015-08-25 15:10:48","1","7","Someone who wants to capture something closer.","cudsdal","cues6f1","cudytl8"
"cdqmcp","__rosebud__","2015-08-25 02:54:00","2015-08-25 02:54:00","6","30","Yes that's what would happen. Think about tossing a ball up in the air. It's the same principle but on the relative horizontal plane as opposed to the vertical plane.","cudv3gu","cue1vb6","cudyv49"
"ItsLSD","Mare1000","2015-08-25 04:33:51","2015-08-25 04:33:51","0","6","&gt;staged ^^^^yeah ^^^just ^^like ^the MOON LANDING","cudtf0o","cue5rlr","cudu0ai"
"CaptainOberynCrunch","Rob-E27","2015-08-25 06:32:09","2015-08-25 06:32:09","1","19","You can pay $5000 to ride the [G Force One](http://www.gozerog.com/) airplane which lets you feel like you're in zero gravity.","cudtjwp","cueahod","cudtjwp"
"__DocHopper__","tommytimbertoes","2015-08-25 04:54:26","2015-08-25 04:54:26","1","12","I'm not sure I follow. Is this an attempt to be funny?","cue30zv","cue6kvf","cue56er"
"BEST_USERNAME_EVA","nofuckingwaydude","2015-08-25 03:27:10","2015-08-25 03:27:10","1","25","Please stop, you're just making yourself look ignorant and stupid. That's correct but it doesn't apply. The stronger force in this case is the acceleration.","cudw34j","cue35sk","cue2uzk"
"Senno_Ecto_Gammat","saganfan162","2015-08-25 02:31:41","2015-08-25 02:31:41","1","60","He had a lot of strangely wrong statements. Like saying the station wasn't under acceleration when it is in orbit. Orbit is a constant acceleration toward the center of the parent body. And saying he they were going to add 2.7 m/s to the station's delta-v. He should have said they were going to apply 2.7 m/s of delta-v to the station.","cuduquh","cue1098","cuduquh"
"alrivera423","piponwa","2015-08-25 02:46:15","2015-08-25 02:46:15","0","19","Is it just me or do the two men in the video look very similar? The movie ""Moon"" anyone?","cue1k8t","cue1k8t","3i6pii"
"DietCherrySoda","hyperCubeSquared","2015-08-25 03:34:21","2015-08-25 03:34:21","1","18","If you own an orbital mechanics textbook, you didn't really need my help to figure this out lol.","cudttdm","cue3fzz","cue3156"
"sunfishtommy","yanomami","2015-08-25 09:39:59","2015-08-25 09:39:59","1","45","Actually skydiving is not quite the same, because during skydiving except for the initial bit, you reach terminal velocity, which means forces are in balance. When you are at this terminal velocity stage, you are actually experiencing the same ""gravity"" you would on the ground.","cudtf0o","cuehdnt","cudwbie"
"tobydanger","miker95","2015-08-25 07:04:43","2015-08-25 07:04:43","1","17","Actually, they don't have water bottles. You can't get the water out of the bottle without gravity.","cudsdal","cuebthd","cudte0y"
