"source", "destination", "startingTime", "finishingTime", "score", "size", "message", "thread", "href", "parent"
"Rob-E27","piponwa","2015-08-24 22:42:12","2015-08-24 22:42:12","199","14","I have always wanted to know what zero gravity felt like. Best sleep ever?","cudtjwp","cudtjwp","3i6pii"
"MorgaDiPuppoDelNacho","faithle55","2015-08-25 15:31:02","2015-08-25 15:31:02","1","21","In those days we still went to the moon. Nowadays we humans don't go further then a couple hundred of KM's.","cue2c3h","cuesmoa","cue2c3h"
"teagonia","Nevermind04","2015-08-25 12:14:17","2015-08-25 12:14:17","1","15","under? if they float around one, they would constantly be under and ontop of it","cudtjwp","cuemxxe","cue206e"
"armrha","[deleted]","2015-08-25 01:36:26","2015-08-25 01:36:26","2","45","Why would you expect that? Does the ISS look like it could handle intense acceleration? Why would we design the system to accelerate so fast it'd be uncomfortable for out astronauts when we could just burn slower and longer with no efficiency loss in space?","cudtq1w","cudywuz","cudtq1w"
"piponwa","piponwa","2015-08-24 20:22:29","2015-08-24 20:22:29","7477","0","","3i6pii","3i6pii","3i6pii"
"DrHotchocolate","potatoesarenotcool","2015-08-25 02:46:56","2015-08-25 02:46:56","61","78","and ya know scientific research in space will take a huge blow, a big investment by NASA will be lost, space programs around the world might lose support/funding due to the dangers associated with the crash, and it's probably going to land in the ocean so some fish will have a shitty day. Edit: other investors like the ESA, JAXA, CSA, and Roskosmos are invested into the ISS. And not to mention the astronauts on board and their families.","cudtq1w","cue1l7i","cue0sgm"
"Sojoez","That_one_drunk_dude","2015-08-25 01:26:57","2015-08-25 01:26:57","1","26","I've been in one of those in 2003. It was horrible. Then tried it again in 2012. Now I know I never want to go in again. Ever!","cudtjwp","cudykdt","cudvl4g"
"Mayor_of_Browntown","5w44e634643","2015-08-25 00:51:56","2015-08-25 00:51:56","30","22","Yeah tell me about it, i fall out of bed while drunkenly masturbating once! and boom! Now I need a new motherboard.","cudvmy3","cudxbns","cudwy89"
"miker95","Poltras","2015-08-25 03:49:07","2015-08-25 03:49:07","1","5","They recycle urine into water.","cudsdal","cue40uf","cue3m2v"
"King_Joffreys_Tits","FullNuclearBreakfast","2015-08-25 02:05:06","2015-08-25 02:05:06","27","7","Is 4G LTE good for your back?","cudtjwp","cudzzjj","cuduql2"
"Bromskloss","aryeh95","2015-08-25 07:56:11","2015-08-25 07:56:11","2","8","All of the inertia; none of the weight!","cudyehp","cuedryu","cudyehp"
"DoneSomeHam","BiigBadaBoom","2015-08-25 03:46:18","2015-08-25 03:46:18","1","10","This is one of the fundamental concepts behind general relativity.","cudtmxi","cue3wt7","cudtmxi"
"-tightbutthole","Slothies","2015-08-25 01:23:07","2015-08-25 01:23:07","42","9","He was touching the hood bro, not the glass.","cudsdal","cudyff1","cudy8rz"
"BEST_USERNAME_EVA","[deleted]","2015-08-25 01:28:53","2015-08-25 01:28:53","7","33","&gt; Does Microsoft let other people modify Windows? Yes. Education Queensland, the department that runs the schools in QLD Australia (duh) for example, has their own special copy that is pretty heavily modified underneath.","cudvmy3","cudymxa","cudxkzh"
"Spike2k187","green_meklar","2015-08-25 21:38:30","2015-08-25 21:38:30","1","51","I was thinking SSD's could solve this problem too but I would be wrong because you still have motors for the fan. Upon googling it and looking at pictures... I haven't learned anything except that they live in a sweet lab. Also duct tape gets used to hold things in place","cudtf0o","cueyd36","cueq2if"
"DuckyFreeman","gnat_outta_hell","2015-08-25 11:11:43","2015-08-25 11:11:43","1","18","Right, that's why I said that the change in speed is 0. But gravity and acceleration are interchangeable. http://ocw.mit.edu/courses/science-technology-and-society/sts-003-the-rise-of-modern-science-fall-2010/lecture-notes/MITSTS_003F10_lec20.pdf","cudtf0o","cuekn3a","cuekhac"
"radoinc","[deleted]","2015-08-25 01:09:13","2015-08-25 01:09:13","247","14","-Houston, we've had a problem. -Ugh... have you tried turning it off and on again?","cudtq1w","cudxxj4","cudw56a"
"ConsummateK","jama211","2015-08-25 03:41:25","2015-08-25 03:41:25","2","84","Weird. My brain struggles to comprehend this. Okay. Would it be fair to say that in the majority of conversations about acceleration we talk about it relative to Earth? I guess I was trying to translate that to the station. It feels weird to view it the other way, but I can see what you're saying. EDIT: I take it back, no force was applied to the camera/dude, so proper acceleration never occurred except with with the station. Hooray for being technically right :P","cuduquh","cue3pv9","cue3cqg"
"InadequateUsername","Diodon","2015-08-25 01:33:58","2015-08-25 01:33:58","17","8","Who needs a camera when you got Hubble?","cudsdal","cudytl8","cudyqv0"
"jeffmolby","green_meklar","2015-08-26 02:22:01","2015-08-26 02:22:01","1","20","That's what I was expecting. I was surprised that he made it sound like it would just be one burn.","cudwgdp","cuf7541","cueq57n"
"JustGreg","---___--","2015-08-25 11:43:15","2015-08-25 11:43:15","1","19","$18k is nothing, ISS cost 150 billion... I'm sure it cost more than $18k to get the lens in orbit.","cudsdal","cuelszs","cudshpq"
"chrisman01","miker95","2015-08-24 22:51:36","2015-08-24 22:51:36","87","6","Nope, they only drink angel tears!","cudsdal","cudtrlw","cudte0y"
"imakuni1995","piponwa","2015-08-25 02:54:33","2015-08-25 02:54:33","1","16","Wow, some of the comments on this video (on youtobe.com) are really damn stupid and ignorant!","cue1w0x","cue1w0x","3i6pii"
"-Badger2-","FearTheCron","2015-08-25 00:57:06","2015-08-25 00:57:06","1","5","I'd probably do it for $10.","cudtjwp","cudxi1t","cudx6pa"
"EllennPao","doppelbach","2015-08-25 03:19:00","2015-08-25 03:19:00","1","51","Um. You seem like someone who is knowledgeable. I'd like to ask if you know how much a reboost extends the ISS' orbit? He said in the end that it makes them in orbit for much while longer. Also, is the ISS going to reentry? I read before it will eventually.","cudvgr6","cue2u79","cudxyum"
"Craigy100","jaseworthing","2015-08-25 01:40:15","2015-08-25 01:40:15","91","39","That would be molecular diffusion that you're talking about. It's always present, just very slow, hence the need for the forced convection to remove the co2 faster. Gravity aids mixing through buoyancy effects, but zero G means no buoyancy.","cudtjwp","cudz1um","cudyiz0"
"WissNX01","zeugenie","2015-08-25 13:35:51","2015-08-25 13:35:51","1","3","So....seven seconds, right?","cudtf0o","cuepnin","cudz5nw"
"---___--","Judster19","2015-08-24 21:50:27","2015-08-24 21:50:27","658","35","""I'm just gonna let this $18,000 lens float about to show you the effects of acceleration on the ISS. No biggie."" I don't think it can ever be said enough, astronauts have the best fucking job ever.","cudsdal","cudshpq","cudsdal"
"ProfessorPickaxe","EllennPao","2015-08-25 13:15:11","2015-08-25 13:15:11","1","58","&gt; I'd like to ask if you know how much a reboost extends the ISS' orbit I didn't but that's a great question. [I found an answer for you here](http://space.stackexchange.com/questions/9087/how-often-does-iss-require-re-boosting-to-higher-orbit) on space.stackexchange, which refers to some excellent graphs produced by space site [Heavens Above](http://www.heavens-above.com/IssHeight.aspx). Apparently they do it about once a month; I had no idea it was so frequent!","cudtjwp","cuep08j","cue2shi"
"XxJTHMxX","Down_The_Rabbithole","2015-08-25 10:07:23","2015-08-25 10:07:23","1","9","I'm going to guess a little bit of both","cue63r6","cueibby","cue63r6"
"dpkimsecks","piponwa","2015-08-24 22:51:02","2015-08-24 22:51:02","2","36","That was an interesting tidbit of both info and demo. I'm glad we can condense this kind of information even more and understanding can reach new heights much more quickly. If we had the funds.. lol","cudtr54","cudtr54","3i6pii"
"LordSwine","DrHotchocolate","2015-09-27 05:39:36","2015-09-27 05:39:36","1","11","Thats when the dolphins leave and thank us for the fish.","cudtq1w","cvf2nyh","cue1l7i"
"rabel","Rob-E27","2015-08-25 06:43:09","2015-08-25 06:43:09","1","109","Pretty much any plane can give you zero G. The pilots who fly skydiving planes are mostly bored and will give you a zero G flight sometimes. I've probably done it a dozen times, it's very fun, but I think it's a waste of fuel so they don't do it regularly. I'll never forget my first time. We're all sitting in the jump plane going to altitude and the pilot yells back at us, ""hey, you guys wanna do zero g?"" and everyone yells ""hell yeah!"" So I turn to my buddy and say, ""what's a zero g?"" and with a grin all he says is, ""put on your helmet.""","cudtjwp","cueaxoe","cudtjwp"
"736f6c","tommytimbertoes","2015-08-25 05:24:01","2015-08-25 05:24:01","3","11","Probably a flat Earth conspiracy theorist who thinks this is fake.","cue30zv","cue7qzq","cue56er"
"rico_of_borg","crowjr","2015-08-25 01:37:01","2015-08-25 01:37:01","1","7","damn now i want some space chicken.","cudt5jt","cudyxlb","cudt5jt"
"HowBoutCondor","kri8","2015-08-25 07:19:14","2015-08-25 07:19:14","1","78","You don't want to burn straight down in most cases. In the case of the ISS, it's unlikely the engines are powerful enough to cause rentry before the additional velocity causes you to actually go into a much higher orbit on the other side of the world. The only reasons I can think to put an engine on top would be for very small positional adjustments (docking, etc), or to increase orbital speed beyond what Earth's gravity provides.","cudtq1w","cuecdnn","cue3mqr"
"potatoesarenotcool","White_Heart","2015-08-25 02:26:05","2015-08-25 02:26:05","36","14","Probably not. Like maybe some farmer in China will lose a crop or two.","cudtq1w","cue0sgm","cue03gf"
"[deleted]","[deleted]","2015-08-25 03:39:13","2015-08-25 03:39:13","1","31","I read it as reboot as well. However, I was expecting the astronauts to attempt to eat a bowl of cereal while watching the mid 90's cgi Saturday morning cartoon ""Reboot""","cudtq1w","cue3mul","cudw56a"
"lowrads","piponwa","2015-08-25 09:14:24","2015-08-25 09:14:24","1","63","It would pretty awesome if the next station is equipped with a small plasma ion thruster. Even better if is so adaptable for fuel, the residents could even use all the waste packaging material in which everything is shipped. It would be ironic if, ionizing plastics, we could use an ion thruster which ran on hydrocarbons. Perhaps aluminium packaging might be more practical.","cuegi8l","cuegi8l","3i6pii"
"Maroefen","HALL9000ish","2015-08-25 19:33:34","2015-08-25 19:33:34","1","33","I sleep under an open window because i like a draft. Rain did wake me this night though. And the sound of a fan can't be worse that the sounds of cars in a city.","cudtjwp","cuewhxb","cudyeb9"
"BadGoyWithAGun","pm_me_your_kindwords","2015-08-25 01:43:57","2015-08-25 01:43:57","5","25","Most of the equipment that requires carrying around has a velcro strap, and the walls are covered in velcro. Simple to keep things in place.","cudxb1j","cudz6wd","cudxb1j"
"---___--","gelinrefira","2015-08-25 02:15:43","2015-08-25 02:15:43","3","8","Exactly! I can only live vicariously through them.","cudsdal","cue0e0n","cudz97r"
"Alphaetus_Prime","iclimbnaked","2015-08-25 03:11:19","2015-08-25 03:11:19","2","17","And apparently you constantly see flashes of light when your eyes are closed, because of cosmic rays.","cudtjwp","cue2jeu","cudtyil"
"marvk","Mare1000","2015-08-25 01:01:26","2015-08-25 01:01:26","11","12","Doesn't matter if it's staged really, I think it's pretty hilarious nonetheless.","cudtf0o","cudxnk7","cudu0ai"
"PM_ME_YOUR_HOPES_","Mare1000","2015-08-25 00:57:58","2015-08-25 00:57:58","24","20","Yeah this one was staged but I'd believe they'd probably do it a couple times when they first get back.","cudtf0o","cudxj5a","cudu0ai"
"CakeDayisaLie","piponwa","2015-08-25 08:12:03","2015-08-25 08:12:03","1","19","The important question no one at NASA has been willing to answer....what happens when you jizz in zero g?","cueecgf","cueecgf","3i6pii"
"ConsummateK","jama211","2015-08-25 02:44:31","2015-08-25 02:44:31","2","76","I thought acceleration denoted a change in velocity? His velocity isn't changing, which is why he appears to be moving at a different rate (because the station IS accelerating?) *Acceleration, in physics, is the rate of change of velocity of an object. An object's acceleration is the net result of any and all forces acting on the object, as described by Newton's Second Law. The SI unit for acceleration is the metre per second squared (m/s2).* https://en.wikipedia.org/wiki/Acceleration","cuduquh","cue1htp","cue0wtq"
"LazLoe","starchybunker","2015-08-25 10:31:38","2015-08-25 10:31:38","2","19","I imagine you would feel it in the amount of force you need to apply to move an object.","cuee98x","cuej63z","cuee98x"
"Pharisaeus","superOOk","2015-08-25 04:18:35","2015-08-25 04:18:35","2","152","In reality it would need to get to ~1800 km for the atmospheric drag to drop to the level of lunar gravity perturbations. But even if we assume 1000 km it would already make it impossible for any of current visiting spacecrafts to reach the ISS. Transfer from initial LEO to circular 1000km orbit would be ~400 m/s (as opposed to 100 m/s currently for 400 km orbit). And we're talking one way, they would still need to burn at least another 300 to make a re-entry from there. So around 700 m/s to make round-trip. Space Shuttle had less than 400 m/s, Soyuz and Progress have ~400 m/s, although Progress can carry more fuel as part of payload but it would barely make it. I believe only the modified Progress M1 or ESA ATV would have enough fuel to reach the ISS at 1000km altitude and come back from there, but both were designed for refuelling the station and for reboosting it.","cue0s8m","cue565o","cue0s8m"
"sticklebat","newfor2015","2015-08-25 01:47:55","2015-08-25 01:47:55","14","69","Not really. The space shuttle was primarily used to bring astronauts and new modules to the ISS. Supply was often done by unmanned spacecraft, just like today, because it was substantially cheaper. The shuttle was one of very many vessels to resupply the ISS, and was by far the most expensive - and so was only used for this purpose when there was another reason to bring the shuttle anyway.","cudsdal","cudzc8d","cudyp9a"
"rlbigfish","piponwa","2015-08-25 06:37:02","2015-08-25 06:37:02","1","27","Was that other guy at the end of the video his twin, or what? I was so confused when there was talking but his lips weren't moving.","cueaoop","cueaoop","3i6pii"
"HairyPorter","VelvetJ0nez","2015-08-25 01:31:33","2015-08-25 01:31:33","6","44","It's O2 split up by radiation into single O atoms. Highly reactive and very nasty stuff, which is responsible for most of the material degradation seen in LEO esp. concerning solar panels and space suits. You do not want to be anywhere near it.","cudx252","cudyqgy","cudx252"
"rspeed","piponwa","2015-08-25 02:18:42","2015-08-25 02:18:42","-1","57","He keeps saying that the camera is accelerating, but that's only true with the station as the reference point. That bugs me. During a reboost the important reference point is Earth, and in that context the camera is *not* accelerating. ^(Technically it accelerates a little bit due to air friction, but that wouldn't be visible in the video.)","cue0i3n","cue0i3n","3i6pii"
"Generic_Pete","LoungeFlyZ","2015-08-25 07:29:09","2015-08-25 07:29:09","1","64","Exactly! It always gets me when people misunderstand the zero g in the ISS is the equivalent of free fall in a plane. Using speed to simulate the effect, Not true zero g since earth exerts gravity at least to the moon. And the ISS is way closer, but certain people see stuff floating in an enclosed space and come away with the wrong idea","cudtf0o","cuecrdo","cudxe85"
"doppelbach","someguyx0","2015-08-25 03:34:11","2015-08-25 03:34:11","2","128","It was really a team effort, haha. u/Dravyy and u/pbostley pointed out that the specific impulse was quite a bit lower than 450 s. Basically, the engines they used for this maneuver were probably using [this](https://en.wikipedia.org/wiki/Unsymmetrical_dimethylhydrazine) and [this](https://en.wikipedia.org/wiki/Dinitrogen_tetroxide), which makes them less efficient than an engine using liquid H2 and liquid O2 (therefore they need to burn more fuel to accomplish the same maneuver). But this mixture is advantageous because it is hypergolic, which means the two components will react upon mixing. If you are designing an engine that will be repeatedly started and stopped (e.g. for orbital corrections), it's much more reliable to have a fuel mixture that ignites on its own. (In hindsight, I should have realized that they wouldn't use H2 and O2 for something like this.)","cudvgr6","cue3frv","cudyj9w"
"doppelbach","Reyer","2015-08-25 02:15:11","2015-08-25 02:15:11","3","36","Sort of. But using a mass of 450 000 kg is already an approximation, so adding in other 400 kg of unused fuel doesn't necessary make the answer more accurate. (And doing so only changes the answer by 370 g.)","cudvgr6","cue0dap","cue004p"
"sunfishtommy","ill_shit_on_ur_tits","2015-08-25 09:26:33","2015-08-25 09:26:33","1","23","Drifting away is not a huge deal, and the CO2 thing is fixed pretty easily by just having a vent blowing on you.","cudtjwp","cuegx7h","cudvpyg"
"jama211","Mamamia520","2015-08-25 02:26:20","2015-08-25 02:26:20","2","13","Notable? Nah. You wouldn't feel the difference really, the effect is too small.","cudtmxi","cue0st5","cudwkww"
"DisproveRainbowDash","[deleted]","2015-08-26 00:06:39","2015-08-26 00:06:39","1","69","Me to. But then I again, this is /r/space. What i and many others on this sub consider common knowledge is, the earth is 6371 km in radius, the acceleration of earth gravity is 9.8 ms^2, f= ma, root(ge / r + ap), spectroscopy can be used to determine the composition of a substance, etc. what common people may consider common knowledge is the earth is round, the sun gives earth energy, etc.","cue2j41","cuf24tp","cuefs3n"
"Vox_R","EightsOfClubs","2015-08-25 05:50:11","2015-08-25 05:50:11","1","65","&gt; In fact, there's talk of repurposing many of the modules into the next generation of deep space vehicles. Wasn't there also talk along the lines of boosting the ISS into a parking orbit where it would no longer decay, until they came up with a better idea? At least, I seem to remember that one the last time they were thinking of retiring the station.","cudtq1w","cue8tfu","cue21lh"
"humblepotatopeeler","[deleted]","2015-08-25 04:17:48","2015-08-25 04:17:48","1","6","you should watch the movie gravity!","cudtq1w","cue551y","cudtq1w"
"OllieMarmot","[deleted]","2015-08-25 06:20:13","2015-08-25 06:20:13","1","10","True, but NASA's share is more than 2/3 of the total.","cudtq1w","cuea0gf","cue40zv"
"erikpurne","Il_Gigante_Buono","2015-08-25 09:52:47","2015-08-25 09:52:47","4","32","It would slow down regardless, but what rosebud was saying is that it would have been cool the see it change direction, which would only happen under the conditions described by bean.","cudv3gu","cuehth1","cuegs6l"
"iclimbnaked","Rob-E27","2015-08-24 23:08:11","2015-08-24 23:08:11","1","27","Yah I dont think id have a huge issue while awake but trying to sleep with no feeling of up or down would probably mess with me.","cudtjwp","cudu6d9","cudu3gw"
"doppelbach","[deleted]","2015-08-25 02:05:17","2015-08-25 02:05:17","2","32","4410 is 450 times 9.8. I was skipping ahead a little (mostly because I wanted to cancel the units). Sorry about that. But a specific impulse of 450 s is too high anyway, so I've changed it.","cudvgr6","cudzzsq","cudznc6"
"Denziloe","Arkell_V_Pressdram","2015-08-25 03:40:10","2015-08-25 03:40:10","1","23","I was thinking it would also have been cool to see a weight on a string or something. Ooh, and a bottle of water.","cudv3gu","cue3o5p","cudv3gu"
"ZachPhrost","Reyer","2015-08-25 07:29:45","2015-08-25 07:29:45","3","5","Can you please explain this?","cudtmxi","cuecs7e","cudzsao"
"SodaAnt","brainchildpro","2015-08-25 07:07:53","2015-08-25 07:07:53","1","7","Except for ones in the TDRSS: https://en.wikipedia.org/wiki/Tracking_and_Data_Relay_Satellite_System","cudvmy3","cuebxwo","cue8vms"
"BenDiesel87","jaseworthing","2015-08-25 01:20:10","2015-08-25 01:20:10","1","32","If there is no or poor ventilation the CO2 you exhale basically forms a bubble around your head in zero gravity. Without proper airflow you could end up suffocating in your sleep.","cudtjwp","cudybkm","cudxyqo"
"Qwirk","piponwa","2015-08-25 00:18:35","2015-08-25 00:18:35","4","33","They appear to have a fairly wide range of photography equipment aboard, is there a specific reason why this is needed? Random shots of the Earth or other things outside for specific purposes?","cudw7yi","cudw7yi","3i6pii"
"Fermats_Last_Wank","---___--","2015-08-25 06:31:15","2015-08-25 06:31:15","0","9","Oh you know, The $18,000 lens inside the $150,000,000,000 space station","cudsdal","cueagc7","cudshpq"
"DietCherrySoda","hyperCubeSquared","2015-08-24 23:53:44","2015-08-24 23:53:44","16","89","Ignore anybody who says ""increases"" or ""decreases"". You can't do either thing to a ""Delta-V"". You can increase or decrease your orbital velocity with respect to the Earth, and this burn increased that velocity in order to raise their orbit. If they simply pointed the thrusters a different direction, the same action would decrease their orbital velocity and lowered their orbit, which is what the Soyuz does when the astronauts are coming home. A Delta-V (ΔV) is simply a change (delta) to velocity (V). It can happen in any direction.","cudttdm","cudvg9e","cudttdm"
"BEST_USERNAME_EVA","nateyo","2015-08-25 01:32:07","2015-08-25 01:32:07","65","14","Hey Kerbal player, it's OK to call them apogee and perigee, they're around Earth.","cudwgdp","cudyr8g","cudxwtx"
"superOOk","piponwa","2015-08-25 02:25:54","2015-08-25 02:25:54","1","61","In case anyone cares, I believe the ISS would need to get to about 1000km in order to avoid having to do these reboosts more than once every 20 years or so. But then it would take a lot more propellant (and thus less cargo capability) for the Soyuz, Progress, Falcon 9, and others, to get to the ISS in the first place.","cue0s8m","cue0s8m","3i6pii"
"Senno_Ecto_Gammat","emergency_poncho","2015-08-26 01:15:23","2015-08-26 01:15:23","1","37","Yes and yes. Astronauts report that it's like having a head cold, burping in space always includes a little puke, eyeballs deform, back and abdomen pain are common, and feet can get quite tender. [More info here](https://en.wikipedia.org/wiki/Effect_of_spaceflight_on_the_human_body).","cuevuyk","cuf4jtz","cuevuyk"
"TheRedKIller","SwordFlight6216","2015-08-25 01:31:14","2015-08-25 01:31:14","1","11","Then the burn would last for 90 minutes, not a few seconds.","cudwgdp","cudyq2y","cudxejj"
"thisisalili","ProfessorPickaxe","2015-08-25 04:12:42","2015-08-25 04:12:42","0","10","so they don't have artificial air flow on the ISS?","cudtjwp","cue4xw4","cudyeao"
"fannypacks4ever","ill_shit_on_ur_tits","2015-08-25 12:28:55","2015-08-25 12:28:55","1","15","Which makes me wonder if they found this out because someone suffocated in their sleep..","cudtjwp","cuengcq","cudvpyg"
"Greatc0mment","[deleted]","2015-08-25 01:48:36","2015-08-25 01:48:36","9","25","so you have family members who can casually sell you a lens like that at a huge loss? *Cough cough* Humble brag. Ok I'm just envious...","cudsdal","cudzd69","cudwks5"
"An0k","__DocHopper__","2015-08-25 06:20:18","2015-08-25 06:20:18","1","14","Why would he need something to help him breath? He has air all around.","cue30zv","cuea0ke","cue30zv"
"Vassago81","Essjay-C","2015-08-25 08:43:33","2015-08-25 08:43:33","1","7","What's the mass of an average fart?","cudtq1w","cuefgbk","cue04uz"
"Senno_Ecto_Gammat","ffngg","2015-08-25 02:37:19","2015-08-25 02:37:19","1","10","It's going to come crashing down in a decade anyway.","cudyika","cue17xo","cudyika"
"dslybrowse","ConsummateK","2015-08-25 00:10:39","2015-08-25 00:10:39","7","39","Right by I think the point is those are the same. You can't say ""but really, X is moving towards Y"" because the two are indistinguishable. We're simply holding onto a (differing) frame of reference when making our statements.","cuduquh","cudvyxo","cudvngb"
"BaronPumpky","babuchas","2015-08-25 03:40:40","2015-08-25 03:40:40","1","67","The thing accelerating here is the ISS, and anything attached to it. The floating camera is NOT accelerating, and neither is he when he lets go. By definition, his acceleration is zero because his speed remains the same as the speed of the ISS at the instant he let go (until he catches himself again, at which point he accelerates to match the speed of the ISS).","cuduquh","cue3oud","cudvgj4"
"75_15_10","thereds306","2015-08-25 07:24:45","2015-08-25 07:24:45","1","13","There are special.space pens, you can buy them online. Just need some google-fu","cudsdal","cueclau","cuecg8f"
"SirButcher","jayme0227","2015-08-25 15:16:57","2015-08-25 15:16:57","1","23","Yet I still risk my life - sitting a top of a rocket just make this risk a little higher. It totally worth it.","cudsdal","cuesbhm","cue86lu"
"tussilladra","ill_shit_on_ur_tits","2015-08-25 14:49:36","2015-08-25 14:49:36","1","7","Does this apply to farts as well?!?","cudtjwp","cuerofa","cudvpyg"
"thereds306","newfor2015","2015-08-25 07:21:05","2015-08-25 07:21:05","1","17","I know that most pens rely on gravity to function, so do gel pens work in space?","cudsdal","cuecg8f","cudynw2"
