"source", "destination", "startingTime", "finishingTime", "score", "size", "message", "thread", "href", "parent"
"beartheminus","ill_shit_on_ur_tits","2015-08-25 09:08:17","2015-08-25 09:08:17","1","5","It's like reverse fan death","cudtjwp","cuegan8","cudvpyg"
"Hotblack_Desiato_","alomjahajmola","2015-08-26 08:10:26","2015-08-26 08:10:26","1","35","The guy driving is John Young, who has probably flown in more different kinds of spacecraft than almost anyone. Two Mercury missions, two trips to the moon, and two shuttle missions, including the maiden voyage.","cue2c3h","cufkyf3","cuehldf"
"CydeWeys","crooks4hire","2015-08-25 00:37:29","2015-08-25 00:37:29","0","36","You just get used to it. We're surprisingly adaptable creatures. Long term you'll have bone density problems, and we really don't know how pregnancy would work in space, but otherwise you adapt and life goes on.","cudtf0o","cudwu3g","cudvuyx"
"lalop","[deleted]","2015-08-25 04:44:01","2015-08-25 04:44:01","1","13","I was expecting him to pull a mighty lever to initiate the boost.","cudtq1w","cue664w","cudtq1w"
"Anna_Fylaxis","miker95","2015-08-25 07:41:57","2015-08-25 07:41:57","2","32","More like water bags. Also, considering it costs around 20,000$ to deliver 1 POUND of cargo to the ISS, it would've practically been impossible to find anything worth less than 10k in his vicinity.","cudsdal","cued8vl","cudte0y"
"newfor2015","This_Name_Defines_Me","2015-08-25 01:29:35","2015-08-25 01:29:35","10","16","Doubt they use actual pencils due to the graphite dust produced by pencils. Probably gel pens only.","cudsdal","cudynw2","cudwo2n"
"Nimitz14","Frexxia","2015-08-25 19:04:01","2015-08-25 19:04:01","1","16","I would have thought if the magnitude stays the same the acceleration will always be zero.","cudtf0o","cuew3u8","cue3mok"
"blublublues","someguyx0","2015-08-25 00:53:34","2015-08-25 00:53:34","2","36","The ISS needs about 7000 kg fuel to keep the altitude and they use about six Progress spaceships per year for the thrust. So I think it should be about 1100 to 1200 kg each time on average. source: https://en.wikipedia.org/wiki/ISS_Propulsion_Module","cudvgr6","cudxdme","cudvgr6"
"doppelbach","Dravyy","2015-08-25 01:55:22","2015-08-25 01:55:22","5","94","Thanks for pointing that out. He says they used ""the engines of the aft end of the space station"" (right at the beginning), so I assumed he was talking about the engines on the Zvezda module. But I suppose he could have meant the engines on a docked spacecraft and was just simplifying for our benefit. In any case, I found more info on the Zvezda engine. They are older versions of the main engines in the KTDU-80 system (S5.79, if you are curious). So either way, the Isp is somewhere aroudn 300 s, not 450 s.","cudvgr6","cudzmc0","cudyiei"
"hyperCubeSquared","DietCherrySoda","2015-08-25 02:29:20","2015-08-25 02:29:20","1","36","Actually that's exactly what I was thinking all along. He just said the burn would increase the ships delta V and I thought maybe my idea of delta V was wrong. Turns out he just misspoke.","cudttdm","cue0wxb","cudzj9b"
"pm_me_your_kindwords","piponwa","2015-08-25 00:51:24","2015-08-25 00:51:24","5","20","I'm impressed more stuff doesn't go (slowly) flying when that happens. They must run a tight (space) ship up there.","cudxb1j","cudxb1j","3i6pii"
"im-a-koala","metrion","2015-08-25 21:33:03","2015-08-25 21:33:03","1","13","Fine. 10 lbm. (Although I think it's pretty easy to infer in this context.)","cudsdal","cuey9i9","cue2kwo"
"theCroc","ProfessorPickaxe","2015-08-25 23:34:52","2015-08-25 23:34:52","2","10","The big question then is if there are Korean astronauts.","cudtjwp","cuf14xd","cudyeao"
"FieelChannel","InadequateUsername","2015-08-25 03:47:13","2015-08-25 03:47:13","2","14","Whoever wants to snap pictures of nearby objects, or, you know, earth from space","cudsdal","cue3y2c","cudytl8"
"goldmountain","piponwa","2015-08-25 12:53:54","2015-08-25 12:53:54","1","17","If you look behind him, you can see that the paper is also showing signs of acceleration","cueoaf4","cueoaf4","3i6pii"
"mrsammercer","crowjr","2015-08-25 02:00:00","2015-08-25 02:00:00","1","16","I closed my eyes and it was like Norm MacDonald was talking to me from space.","cudt5jt","cudzsqo","cudt5jt"
"Gnonthgol","autodidact89","2015-08-25 02:29:44","2015-08-25 02:29:44","12","100","They do modify them a bit to make them safer. They change out the battery and charging system to be compatible with the space station power and not blow up. Other then that it would be a bit crazy even for NASA to design a new type of computer that is light weight, durable and easy to use when anyone can buy such a device. They also do not design their own bolts, wires, pens, food, camera, etc. They do a lot of testing on them though to make sure they are fit for the environment they put it in.","cudvmy3","cue0xgw","cudvmy3"
"ConsummateK","BEST_USERNAME_EVA","2015-08-25 02:47:55","2015-08-25 02:47:55","1","82","Feelin' a little salty this morning? From my perspective (lol) it's easiest to talk about things that are accelerating (experiencing a chance in velocity) as ""moving towards"" something. In this example the station is accelerating toward the astronaut and his floating camera, so it makes the most sense to talk about it in those terms? He isn't accelerating at all, his velocity is remaining the same, which is why he appears to move toward the camera that is being used to film.","cuduquh","cue1mmj","cudyono"
"jaseworthing","ill_shit_on_ur_tits","2015-08-25 01:10:10","2015-08-25 01:10:10","71","5","Why the cloud of co2?","cudtjwp","cudxyqo","cudvpyg"
"dungdigger","---___--","2015-08-25 00:44:02","2015-08-25 00:44:02","0","16","He keeps touching the front of that lens to boot. That is gonna leave a smudges.","cudsdal","cudx241","cudshpq"
"xorvious","manabu123","2015-08-25 01:06:15","2015-08-25 01:06:15","3","23","Same here, somewhat crazy coincidence! I thought this video was very timely considering I'm about 1/3 the way into the book. Really enjoying it!","cudtq1w","cudxtq3","cudvv68"
"Not_Quite_Normal","CookieOfFortune","2015-08-25 03:52:40","2015-08-25 03:52:40","17","63","The pedants don't know what they're talking about; the pound can be a unit of [mass](https://en.wikipedia.org/wiki/Pound_\(mass\)) or [force](https://en.wikipedia.org/wiki/Pound_\(force\)) (weight). One can specify 'pound-force' or 'pound-mass', but in most contexts it's apparent which unit is being used. In this context, it's obvious that you're using the pound-mass. (how's that for pedantry?) I'm not a fan of imperial units in general, but your usage was valid.","cudsdal","cue45rw","cudwrxf"
"newfor2015","thereds306","2015-08-25 07:27:47","2015-08-25 07:27:47","4","6","yeah, they were invented for space","cudsdal","cuecpj4","cuecg8f"
"Shunto","Rob-E27","2015-08-25 16:13:35","2015-08-25 16:13:35","1","43","I remember reading that not having the feeling of your head hitting the pillow makes it harder to drift asleep. You know when you're super tired and your pillow just feels so damn good and soft? Not having that apparently makes it harder","cudtjwp","cuetgwh","cudtjwp"
"mkroyo","Rancor_Emperor","2015-08-25 03:39:32","2015-08-25 03:39:32","3","7","The acceleration on sidonia is no joke.","cudtq1w","cue3naz","cudwhmt"
"someguyx0","doppelbach","2015-08-25 01:26:08","2015-08-25 01:26:08","9","9","This is why I love this sub. Thank you!","cudvgr6","cudyj9w","cudxyum"
"kri8","EightsOfClubs","2015-08-25 03:39:08","2015-08-25 03:39:08","-1","23","Why can't they put some sort of engine ""on top"" and slowly push pieces into the atmosphere so they don't get space junk?","cudtq1w","cue3mqr","cue21lh"
"gellis12","ill_shit_on_ur_tits","2015-08-25 11:15:58","2015-08-25 11:15:58","11","79","You don't have to be strapped in. [Sam Cristoforetti](https://en.wikipedia.org/wiki/Samantha_Cristoforetti) (an Italian astronaut who came home from the ISS a few months ago) even mentioned in one of her videos that she likes to float around in her bunk without being strapped in. And the CO2 is not an issue at all. They have an incredibly robust ventilation system to deal with that. Chris Hadfield has said several times before that sleeping in space is the most comfortable experience he's ever had.","cudtjwp","cueksp2","cudvpyg"
"Texasfitz","EightsOfClubs","2015-08-25 12:17:36","2015-08-25 12:17:36","1","34","The current plan is to de orbit the whole thing at one time. The Russians might undock one or two modules, but that's it. We don't have the spacecraft or funding to disassemble it.","cudtq1w","cuen24l","cue21lh"
"Hank-Grizzly","piponwa","2015-08-25 00:54:37","2015-08-25 00:54:37","1","13","They need to play darts next time they do this, but without throwing.","cudxevw","cudxevw","3i6pii"
"jeffmolby","cpxander","2015-08-26 02:21:18","2015-08-26 02:21:18","1","31","It doesn't take much to make an orbit elliptical. I assume they want to maintain a relatively circular orbit, so I imagine they're pretty particular about where they perform the burns.","cudwgdp","cuf741k","cuefg9s"
"iDroidManiac","ZippoS","2015-08-25 09:12:34","2015-08-25 09:12:34","1","8","Norton found its way somehow. It always does.","cudvmy3","cuegg0x","cudy4sx"
"Druggedhippo","affordb6969","2015-08-25 12:35:44","2015-08-25 12:35:44","2","219","&gt; Random shots of the Earth or other things outside for specific purposes? Both. Sensing Satellites are expensive and re-tasking them to take an image out of their path even more so, not counting the fact they point straight down most of the time. Now imagine the ISS as a satellite with a multitude of cameras that can be pointed in almost any direction to take a picture of any part of the earth once every 90 minutes. For example, it's pretty unlikely for a satellite to take an [image like this](http://cdn0.dailydot.com/uploaded/images/original/2015/8/18/red-sprite-1-small.JPG)^[source](http://www.dailydot.com/geek/international-space-station-red-sprite-lightning-storm-photo/) EDIT: Crew Earth Observations! It's also part of an offical ""Mission"" called ""Crew Earth Observations"" which basically focuses on using Astronaut Photography to document long term changes in various subjects like city growth. There is a heck of lot [more detail here](http://earthobservatory.nasa.gov/Features/AstronautPhotography/) and [here](http://www.nasa.gov/mission_pages/station/research/experiments/86.html) about Astronaut Photography and why it's so important. &gt;The International Space Station crew members use commercial and professional handheld cameras with a suite of lenses (from wide angle to an 800mm lens equivalent) to take Earth observation photographs that support research in a wide variety of Earth Science sub-disciplines. Scientists on the ground train the crew in basic areas of Earth system science and provide the crew a daily list of targets of the greatest scientific interest. Crew members take these photographs as time is available and during their leisure time.","cueb836","cuenoq1","cueb836"
"oranhunter","---___--","2015-08-25 00:09:06","2015-08-25 00:09:06","8","22","""It will also cost us another $10 million to get this sized object back onto the space station if I break this one.""","cudsdal","cudvx75","cudshpq"
"thessnake03","EightsOfClubs","2015-08-25 09:22:29","2015-08-25 09:22:29","1","11","Russia will keep their segments up there, even without the rest.","cudtq1w","cuegs4s","cue21lh"
"Subaca","VelvetJ0nez","2015-08-25 01:27:53","2015-08-25 01:27:53","16","35","Atomic oxygen is O, whereas molecular oxygen (which we breathe) is O2. I don't see why you would need atomic oxygen. It is very reactive and if you breathe it you will surely die.","cudx252","cudylly","cudx252"
"BEST_USERNAME_EVA","ConsummateK","2015-08-25 01:30:10","2015-08-25 01:30:10","-2","23","Depends on your frame of reference, now doesn't it? Smartass. ""When in reality everything is moving blisteringly fast compared to the CMB radiation, soooo...""","cuduquh","cudyono","cudvngb"
"ebopnostop","GKorgood","2015-08-25 09:30:56","2015-08-25 09:30:56","1","5","Great! Thanks for the explanation","cue5skx","cueh2lh","cueb2tw"
"[deleted]","---___--","2015-08-25 00:48:50","2015-08-25 00:48:50","6","1","[removed]","cudsdal","cudx7xg","cudshpq"
"green_meklar","piponwa","2015-08-25 13:39:29","2015-08-25 13:39:29","1","44","Huh. I'd never thought about that, but of course it's something that would happen. I'm a little disappointed the acceleration was so small, though. It would have been fun to see people floating, then standing around on one side of the room, then floating again.","cueprhq","cueprhq","3i6pii"
"InFec7","Mayor_of_Browntown","2015-08-25 04:40:15","2015-08-25 04:40:15","8","6","I hate it when that happens","cudvmy3","cue60rk","cudxbns"
"thejakenixon","hyperCubeSquared","2015-08-24 23:39:32","2015-08-24 23:39:32","33","11","Delta-V just means ""change in velocity."" That should explain both sides.","cudttdm","cudv14i","cudttdm"
"This_Name_Defines_Me","---___--","2015-08-25 00:32:25","2015-08-25 00:32:25","56","48","Up there everything's expensive. Even their pencils cost X amount of rocket fuel to get up there. Edit: I googled it and a random article quoted 60-80 grand per kilo. The average pencil is 6-10 grams. Splitting the difference to 70 grand and 8 grams gives us $560 to bring a pencil into orbit. /r/theydidtheshittymath","cudsdal","cudwo2n","cudshpq"
"whisp_r","piponwa","2015-08-25 01:24:35","2015-08-25 01:24:35","1","4","EVERYONE GO READ [SEVENEVES](https://en.wikipedia.org/wiki/Seveneves)","cudyhac","cudyhac","3i6pii"
"pm_me_your_kindwords","DaNiceguy","2015-08-25 00:50:46","2015-08-25 00:50:46","4","32","He's watching over us from above with expensive cameras... but sooner or later the Goa'uld are going to get us and he doesn't want to be on the surface when that happens.","cudwi7o","cudxaa5","cudwi7o"
"travyhaagyCO","Rob-E27","2015-08-25 02:20:25","2015-08-25 02:20:25","1","25","Yeah seems like it or it would be like the feeling of falling, can you imagine waking up from a falling nightmare to zero g?","cudtjwp","cue0kh9","cudtjwp"
"[deleted]","64bitllama","2015-08-25 04:52:12","2015-08-25 04:52:12","3","86","If they were trying to maintain circularity they would do 2 burns 45 minutes apart (I don't know why they would need to include both burns in a video like this though, the point was to show the acceleration). However, the astronaut said that the burn was partly to aid rendezvous with a Progress capsule, so this could have plausibly been a lone burn. (It strikes me as odd that they would maneuver the ISS at all during rendezvous, but I don't know the specifics of the situation.)","cudwgdp","cue6hnt","cudxe3d"
"-Hegemon-","[deleted]","2015-08-25 08:48:28","2015-08-25 08:48:28","1","19","Hahaha, me too, I was like ""Fuck, did they upgrade all the systems at once? Doesn't seem very smart"".","cudtq1w","cuefmh6","cudw56a"
"UltraSpecial","chrisman01","2015-08-24 22:57:56","2015-08-24 22:57:56","15","8","So then they use their angel tear bottle.","cudsdal","cudtx7v","cudtrlw"
"piponwa","[deleted]","2015-08-25 06:25:32","2015-08-25 06:25:32","1","3","Even somebody's life??!!!!","cudz4dh","cuea80k","cudz4dh"
"green_meklar","Spike2k187","2015-08-25 13:49:52","2015-08-25 13:49:52","2","29","I'm guessing your laptop would gradually start spinning in place from the action of its own hard drive and fan motors. (Maybe there's something to be said for SSDs...)","cudtf0o","cueq2if","cudtf0o"
"jama211","ConsummateK","2015-08-25 03:44:12","2015-08-25 03:44:12","1","44","Yeah, that's fair enough. It's common in normal speech to put down a *default* reference frame (such as the ground) and talk about everything relative to that, but in reality, your speed or acceleration can be spoken about with respect to any other object.","cuduquh","cue3tsu","cue3pv9"
"graverubber","piponwa","2015-08-25 01:41:52","2015-08-25 01:41:52","1","20","I've been reading SevenEves by Neal Stephenson nod it's given me a whole new understanding of the ISS. Highly recommended.","cudz41f","cudz41f","3i6pii"
"zq6","clickclick-boom","2015-08-25 06:30:23","2015-08-25 06:30:23","3","63","I only experienced zero-g for a very short time, not long enough for fluids to become very displaced (although the guy before me definitely displaced some fluids haha). No sudden spin either, though we did a couple of high-g moves and that was the opposite of the zero-g I described; you feel heavier in your seat and everything presses down a little more.","cudtf0o","cueaf1q","cue8xtu"
"jama211","TheBishopsBane","2015-08-25 03:58:38","2015-08-25 03:58:38","2","73","Thanks for your explanation, I respect your comment, I'm sorry I called you arrogant. So to summarize, it doesn't create proper acceleration, but saying that it has a change in velocity relative to the ship is still ok, so you could arguably say it was accelerating relative to the ship, with no force acting upon it, but it would be a stretch of the language. I'm ok with that compromise if you are!","cuduquh","cue4e5b","cue4ccz"
"[deleted]","crowjr","2015-08-25 01:30:59","2015-08-25 01:30:59","1","21","I wasn't looking at my screen at first and thought it was norm. Like how jimmy Fallon is in Jurassic park.","cudt5jt","cudyprn","cudt5jt"
"piponwa","pavonismonsbyballoon","2015-08-25 01:16:13","2015-08-25 01:16:13","1","7","You just read my other comment... Ha","cudwvi8","cudy6fp","cudwvi8"
"kRkthOr","EllennPao","2015-08-25 03:30:01","2015-08-25 03:30:01","2","117","I'm definitely no expert, but here's a chart of the ISS's orbit height in km over the past year and you can easily see the reebosts on it. http://i.stack.imgur.com/f8p3G.png &gt; This plot shows the orbital height of the ISS over the last year. Clearly visible are the re-boosts which suddenly increase the height, and the gradual decay in between. The height is averaged over one orbit, and the gradual decrease is caused by atmospheric drag. As can be seen from the plot, the rate of descent is not constant and this variation is caused by changes in the density of the tenuous outer atmosphere due mainly to solar activity. (Source and credit: [Heavens Above](http://www.heavens-above.com/IssHeight.aspx)) Hope that helps with your question.","cudtjwp","cue39wq","cue2shi"
"factoid_","HALL9000ish","2015-08-25 05:09:01","2015-08-25 05:09:01","47","35","Unfortunately? That sounds perfect to me. Chris Hadfield writes in his book that he found microgravity to be very comfortable. When you sleep you have no pressure points on your body to make you uncomfortable","cudtjwp","cue75d7","cudyeb9"
"Blacktagar_Boltagon","piponwa","2015-08-25 13:51:08","2015-08-25 13:51:08","2","22","Bloody hell. I work in photography and video and carrying heavy lenses like that with such ease is a dream come true.","cueq3vo","cueq3vo","3i6pii"
"[deleted]","TheSecretMe","2015-08-25 03:25:07","2015-08-25 03:25:07","0","227","the one thing I wonder most about, honestly, is what are they doing in the US military with the trillions of dollars they get every fucking year? Seriously, they are specifically dedicated to advancing the interests of the US and the western world, and hegemony and progress will require dominance in space. so just imagine what they are doing.. I would imagine that they are trying to fulfill their mandate. In my opinion a lot of those UFO sightings are probably the new generation of ship, maybe new generation of propulsion science and technology, maybe sometimes people happen to catch a glimpse of the secret space fleet or something.. so the whole 'aliens' story is great because it distracts people from the real deal. There have been plenty of instances of parallel cultures and parallel lines of development within civilizations in the past - there is precedent for it, for one group of people being much further advanced than all the rest - and keeping that knowledge a secret (or at least not sharing it openly with everyone else). It's totally possible that we have something like that going on right now between the 'open world of science and technological advancement' and 'the secret world' of defense and military programs. I mean - if this is the stuff that the authorities show to the public - just imagine what they don't show to the public.","cudsdal","cue32vt","cue2son"
"Spudd86","Job_man","2015-08-25 04:32:10","2015-08-25 04:32:10","8","25","But astronauts really do do that when they come home Chris Hadfield told a story about when he did it in at least one interview.","cudtf0o","cue5pat","cudxwz8"
"Rancor_Emperor","[deleted]","2015-08-25 00:27:02","2015-08-25 00:27:02","5","5","Ever watch Knights of Sidonia?","cudtq1w","cudwhmt","cudtq1w"
"Zuggible","DuckyFreeman","2015-08-25 03:49:03","2015-08-25 03:49:03","2","8","1G of g-force. Your net acceleration is zero.","cudtf0o","cue40r1","cudz78k"
"[deleted]","Slothies","2015-08-26 07:48:08","2015-08-26 07:48:08","2","62","You can't get a lens cap for such a huge lens. They usually have hoods or cases to keep dust away from them, but are seldom used. Also, the front lens element is recessed a bit, so he's not actually touching the glass. Either way despite the fact it's an expensive lens, they're easy to clean and are built to last. Source: Photographer.","cudsdal","cufk4t8","cudy8rz"
"iHateReddit_srsly","yanomami","2015-08-25 12:15:50","2015-08-25 12:15:50","1","19","How long does it take to reach terminal velocity? Because after that, the wind is supporting all your weight.","cudtf0o","cuemzvy","cudwbie"
"ConsummateK","babuchas","2015-08-25 00:00:14","2015-08-25 00:00:14","36","86","Actually, the camera (that is being used to film the video) is moving toward *him* because the station is accelerating around him. His inertia is keeping him moving but only at the established rate, when the station starts to move faster it's actually catching up to him, which makes it seem like he (and the floating camera, and anything else not attached to the station) is moving the opposite direction when in reality it's moving slower than everything else so it is being caught up to.","cuduquh","cudvngb","cudvgj4"
"[deleted]","salamatjalan","2015-08-25 01:37:43","2015-08-25 01:37:43","1","46","&gt;but there's plenty of people that would go ""meh"". It's hard to relate to that. I couldn't help but watch this with a huge fucking smile on my face. So fun to put yourself in that guy's spaceshoes. Actually, you don't really need shoes in space, huh?","cudsdal","cudyyhn","cudxjgt"
"White_Heart","haabilo","2015-08-25 04:39:00","2015-08-25 04:39:00","2","28","I think what I meant is obvious. Your explanation of course, and if for any other reason the ISS falls to the ground it means we're *all* screwed.","cudtq1w","cue5yzn","cue4l3q"
"DurtyKurty","---___--","2015-08-25 02:12:24","2015-08-25 02:12:24","1","17","To be fair, it probably cost a few million dollars to get that lens to the ISS.","cudsdal","cue09gx","cudshpq"
"pbostley","doppelbach","2015-08-25 01:59:15","2015-08-25 01:59:15","5","48","This was likely the Progress (They don't really use the Service Module engines much) that did this reboot. Either way, they are both are N2O4/UDMH with an Isp of closer to 280. (The 450 number you quote is for H2/LOX) For reference the Progress carries 880Kg of fuel for its engine..","cudvgr6","cudzrom","cudxyum"
"LegionofGloom","piponwa","2015-08-25 07:54:14","2015-08-25 07:54:14","1","21","If there is ever a biopic on this dude I already know [who'd they cast](http://www.imdb.com/name/nm0588777/?ref_=tt_cl_t4). Look and sound so damn similar.","cuedpcz","cuedpcz","3i6pii"
"Karriz","[deleted]","2015-08-24 23:21:30","2015-08-24 23:21:30","3","12","It increases the velocity of the station, but decreases the remaining delta-V.","cudttdm","cuduiyz","cuduc38"
"_IAmMike_","nofuckingwaydude","2015-08-25 20:33:57","2015-08-25 20:33:57","0","5","Do you even Physics man?","cudw34j","cuexbnu","cue2uzk"
"Senno_Ecto_Gammat","TwirlySocrates","2015-08-25 13:29:50","2015-08-25 13:29:50","1","10","It depends mostly on the altitude. [Here is a chart](http://www.spacefuture.com/archive/images/orbital_considerations_in_kankoh_maru_rendezvous_operations.2.gif).","cuennrp","cuepgvg","cuennrp"
"ToTouchAnEmu","MrRandomSuperhero","2015-08-25 00:40:55","2015-08-25 00:40:55","14","10","Gravity is always in effect when you are in freefall.","cudtf0o","cudwy93","cudwowm"
"ConsummateK","Rob-E27","2015-08-25 00:03:39","2015-08-25 00:03:39","0","13","They tie themselves down in floating sleeping bags. Kinda weird, but kinda cool.","cudtjwp","cudvr5w","cudtjwp"
"Suma2","trevize1138","2015-08-25 01:36:50","2015-08-25 01:36:50","1","8","You know you can use "" as air quotes?","cudt5jt","cudyxd2","cudv1d7"
"ConsummateK","loveleis","2015-08-25 01:03:53","2015-08-25 01:03:53","0","18","Right, but for the sake of discussion not being able to refer to anything is sort of difficult?","cuduquh","cudxqoq","cudx62v"
"Nj_all_day","piponwa","2015-08-25 03:58:45","2015-08-25 03:58:45","1","25","What a time to be alive. I can sit in my room and watch videos of astronauts aboard a fricken space station doing amazing things.","cue4eb1","cue4eb1","3i6pii"
"plane_and_simple","crooks4hire","2015-08-25 03:09:17","2015-08-25 03:09:17","1","38","It must feel weird at first. &gt; As with sea sickness and car sickness, space motion sickness symptoms can vary from mild nausea and disorientation, to vomiting and intense discomfort; headaches and nausea are often reported in varying degrees. https://en.wikipedia.org/wiki/Space_adaptation_syndrome","cudtf0o","cue2gn8","cudvuyx"
"Judster19","piponwa","2015-08-24 21:43:41","2015-08-24 21:43:41","446","15","It's so surreal watching him leave that huge camera just floating there.. thanks for sharing :)","cudsdal","cudsdal","3i6pii"
"wishiwascooltoo","[deleted]","2015-08-25 01:53:18","2015-08-25 01:53:18","2","5","IKR, 2.7 meters/sec? Whatever who cares?","cudtq1w","cudzjhy","cudtq1w"
