"source", "destination", "startingTime", "finishingTime", "score", "size", "message", "thread", "href", "parent"
"ProfessorPickaxe","jaseworthing","2015-08-25 01:22:14","2015-08-25 01:22:14","269","116","It's a hermetically sealed, zero-g environment. Without artificial airflow the air you breathe out will be static and just sit there around you. [Fortunately the astronauts actually sleep with airflow across their faces to prevent this exact scenario](http://www.esa.int/Our_Activities/Human_Spaceflight/Astronauts/Daily_life/). &gt; Sleep spots need to be carefully chosen - somewhere in line with an ventilator fan is essential. The airflow may make for a draughty night's sleep but warm air does not rise in space so astronauts in badly-ventilated sections end up surrounded by a bubble of their own exhaled carbon dioxide. The result is oxygen starvation: at best, they will wake up with a splitting headache, gasping for air... As an aside, apparently Korean Fan Death isn't a risk in space ;-)","cudtjwp","cudyeao","cudxyqo"
"zq6","yanomami","2015-08-25 01:13:01","2015-08-25 01:13:01","18","63","It does feel very strange - all your organs suddenly relieving pressure on your body that you didn't even realise was there. It's very much like the momentary ""leaving your stomach behind"" you feel driving over a hill, but for longer. I imagine you would get used to it though, I only had it for ~10 seconds a few times. Source: been on a parabolic flight","cudtf0o","cudy2dj","cudwbie"
"danielravennest","throw_up_n_away","2015-08-25 02:19:04","2015-08-25 02:19:04","115","167","You never shut off the whole station at one time. It has 4 main solar arrays, two power buses, and critical equipment is duplicated on both buses. Even the core data network is duplicated too, there's two sets of cables. The core computers (which are separate from the laptops you see all over the place) don't even have an OS. They load their software automatically from EEPROMs when powered on, and just start running. I used to work in the software test lab for these computers, and we tested the heck out of the code. Updates are rare, like every few years. What you do is update the backup computer of a pair (typically one or two pairs per module), then switch over to it. If something is wonky, you can just flip over to the primary, which still has the older version. Once they are comfortable with the update, they can then ""burn"" the update to the primary, and go back to running it as the default unit.","cudtq1w","cue0ilt","cudwc8c"
"nighthawke75","legolili","2015-08-25 22:22:38","2015-08-25 22:22:38","1","55","I had seen NASA footage from shuttle flights of crew members being jostled around when the larger RCS is being fired. And Bob Crippen reported that the shuttle felt like it was ""hit by a howitzer when the larger thrusters fired"". I went through YT looking for any clips of that film with little luck.","cudsdvm","cuez96v","cuervvn"
"64bitllama","piponwa","2015-08-25 00:58:54","2015-08-25 00:58:54","1","46","More accurately, delta-v was around 2m/s in the prograde (""forward"")direction, which has the effect of increasing orbital velocity. As other posters have said: if they burned in the opposite (retrograde/backwards/braking) direction they could have still had a delta-v of around 2m/s but with a different outcome.","cudttdm","cudxkbv","cudtxr8"
"Abominom","whereworm","2015-08-25 00:12:03","2015-08-25 00:12:03","45","5","The original or ISS: Reboosted","cudtq1w","cudw0h5","cudvrjx"
"yetanothercfcgrunt","jama211","2015-08-25 03:47:57","2015-08-25 03:47:57","0","12","Read what I said instead of ignoring it and restating your misconception.","cuduquh","cue3z5o","cue3kb1"
"yetanothercfcgrunt","Bromskloss","2015-08-25 02:45:38","2015-08-25 02:45:38","1","23","Except that it is. If the astronauts and station weren't accelerating, they'd travel in a straight line. Instead they travel in an orbit.","cuduquh","cue1jfm","cue02we"
"Poltras","miker95","2015-08-25 03:38:40","2015-08-25 03:38:40","1","12","Maybe water is a more valuable resource than 18000$ camera lenses up there?","cudsdal","cue3m2v","cudte0y"
"miami-fever","bonestamp","2015-08-25 07:21:41","2015-08-25 07:21:41","2","61","Semi-professional photographer here. I stopped using lens caps almost immediately after getting my first good camera. They are one more thing to keep you from getting a shot, and lens glass is pretty hard and scratch resistant. As a matter of fact, 99% of the time I see someone worrying about their lens cap it is to put it over their kit lens.","cudsdal","cuech12","cudzf9r"
"EightsOfClubs","yetanothercfcgrunt","2015-08-25 02:58:31","2015-08-25 02:58:31","33","75","They will not de-orbit the entire thing in one go. In fact, there's talk of [repurposing](http://www.space.com/9643-tation-disposal-plan-revealed.html) many of the modules into the next generation of deep space vehicles. After all, you've already paid to get the equipment up there once. No need to pay for it again if you can use it. That isn't to say they won't de-orbit _some_ of the ISS, but I would be VERY surprised if they end up decommissioning the whole thing.","cudtq1w","cue21lh","cue1qwb"
"Travis100","PM_ME_YOUR_HOPES_","2015-08-25 01:55:30","2015-08-25 01:55:30","25","17","I remember reading this was staged but made to show what happens, so more of a recreation/demonstration.","cudtf0o","cudzmhw","cudxj5a"
"[deleted]","piponwa","2015-08-25 10:07:49","2015-08-25 10:07:49","1","16","As long as it's their whole life. Would be some cruel shit taking all of it.","cudz4dh","cueibvi","cuea80k"
"ronin1066","crooks4hire","2015-08-25 03:48:32","2015-08-25 03:48:32","2","12","You generally feel like you're in free-fall b/c of your ears FWIK.","cudtf0o","cue4007","cudvuyx"
"Supermass0","yetanothercfcgrunt","2015-08-25 03:01:22","2015-08-25 03:01:22","1","48","So let's say a craft the size and weight of the ISS was traveling to another galaxy. With so much space in-between galaxies and with gravitational pull keeping most objects within a galaxy, particles and larger debris, could you reach a point where no additional boosts are required?","cue0v59","cue25oh","cue1m0k"
"megablast","BEST_USERNAME_EVA","2015-08-25 16:15:19","2015-08-25 16:15:19","1","42","Because it is a ridiculous assertion. Changing the wallpaper and the startup theme - is not heavily modifying windows or requires access to the source code. Nor does locking the system down, Windows is very mature and easy to lock down these days.","cudvmy3","cueti38","cuetdop"
"sirius4778","piponwa","2015-08-25 01:37:40","2015-08-25 01:37:40","1","11","This physics professor is extremely dedicated to giving a good demonstration.","cudyyfk","cudyyfk","3i6pii"
"jama211","ConsummateK","2015-08-25 03:32:03","2015-08-25 03:32:03","1","21","His velocity with respect to the ship *is* changing, as his speed and the ships speed differ by an increasing amount.","cuduquh","cue3cqg","cue1ofr"
"hyperCubeSquared","DietCherrySoda","2015-08-25 03:23:52","2015-08-25 03:23:52","1","22","Alright, that's what this whole thing is about then. He just misspoke and I don't have to reread my orbital mechanics textbook.","cudttdm","cue3156","cue1m4r"
"Lolmoqz","Arkell_V_Pressdram","2015-08-25 02:14:25","2015-08-25 02:14:25","1","39","Now I know nothing about space but I think the camera would have just kept floating backwards until it hit the wall at the back end. It would have been like just throwing something in a direction in space","cudv3gu","cue0c7k","cudv3gu"
"doppelbach","EllennPao","2015-08-25 04:17:16","2015-08-25 04:17:16","1","216","&gt; how much a reboost extends the ISS' orbit It's a little complicated. For example, increased solar activity can cause the upper atmosphere to 'swell' a bit, which increases drag on the ISS and causes its orbit to decay quicker. But based on the chart at the bottom of [this page](http://www.scibuff.com/2010/01/30/international-space-station-reboost/) it looks like the altitude decreases by ~2 km per month. The reboost from OP's video (24 Jan 2010) looks like it increased the altitude by ~6 km, so it extended the orbit by another few (3?) months. (Keep in mind that this doesn't mean the station would re-enter 3 months later, it just means it would probably decay to the starting altitude by that point.) ----- &gt; is the ISS going to reentry It will re-enter if it goes too long without a re-boost. I'm not sure how long it would take. You can see [here](https://en.wikipedia.org/wiki/International_Space_Station#/media/File:Internationale_Raumstation_Bahnh%C3%B6he_(dumb_version\).png) that it has gone many months straight with no reboost. But you can also see that the decay rate increases as the altitude decreases. So even if it's decaying by ~2 km / month at 400 km, it's going to decay a lot faster at 300 km. Of course no one is going to let that happen while the station still has funding. But eventually they will let it re-enter in a controlled manner so that it burns up over an ocean or someplace uninhabited.","cudvgr6","cue54bl","cue2u79"
"potsandpans","[deleted]","2015-08-25 05:08:07","2015-08-25 05:08:07","1","6","nah dude space is fuckin chill","cudtq1w","cue740l","cudtq1w"
"brodies","ProfessorPickaxe","2015-08-25 05:27:57","2015-08-25 05:27:57","2","56","Conveniently, I basically need a fan blowing on me to sleep. Where do I sign up? I'm sure my law degree qualifies me to do something on the ISS, like, I don't know, float in a corner being terrified of ~~meteorites~~ space stuff (see, I even caught the ""meteorite"" issue before hitting save. Space money please).","cudtjwp","cue7wnp","cudyeao"
"entotheenth","Compizfox","2015-08-25 04:38:03","2015-08-25 04:38:03","8","93","Heh, good to know, I would have guessed some sort of linux distro. Now you have me wondering how they go about things nowadays up there. Are they in humungous need of teraflops ? I imagine experiments would need grunt at times, obviously some high levels of automation, a good deal of redundancy and then perhaps offload to a bunch of individual processors for smaller tasks. googled it so I didn't look like a mug. so mission critical is now linux, was windows, (I remember that changeover now) and a bunch of windows lappys for general purpose. http://www.quora.com/What-are-computers-used-for-on-the-ISS","cudtq1w","cue5xld","cue2u80"
"trippynumbers","whereworm","2015-08-25 04:03:14","2015-08-25 04:03:14","1","23","No, that's just a repressed memory from when OP accidentally ate a corn dog before going on the Grav-i-tron at the state fair.","cudtq1w","cue4koc","cudvrjx"
"[deleted]","[deleted]","2015-08-25 00:16:11","2015-08-25 00:16:11","894","1","[removed]","cudtq1w","cudw56a","cudtq1w"
"doppelbach","yetanothercfcgrunt","2015-08-26 01:38:40","2015-08-26 01:38:40","2","114","You two are both right. In a Newtonian context, free fall obviously involves acceleration. But in the context of general relativity, an object in free fall does *not* undergo acceleration. You are absolutely right: if an object is not accelerating it will travel in a straight line. But an object in free fall *is* traveling on a straight line (geodesic) through space-time. Honestly, it's a little disappointing that u/Bromskloss is being downvoted for being correct. I'm not expecting r/space to understand the mathematics of GR (I'm don't!), but surely we've all seen the [pictures of curved spacetime](http://cse.ssl.berkeley.edu/bmendez/ay10/2002/notes/pics/bt2lfS314_a.jpg). It's not that hard to see that an orbit is actually a straight line in the context of GR.","cuduquh","cuf5fxo","cue1jfm"
"alomjahajmola","faithle55","2015-08-25 09:46:07","2015-08-25 09:46:07","30","23","There's a lot of high quality footage from the Apollo era. [This \(stabilized\) video of Apollo 16's Lunar Rover being driven is fantastic.](https://www.youtube.com/watch?v=5cKpzp358F4)","cue2c3h","cuehldf","cue2c3h"
"Ebriate","piponwa","2015-08-25 01:44:12","2015-08-25 01:44:12","1","25","I think it's cool how in order to check how ""heavy"" something is, they accelerate and decelerate it in their hands to feel the mass.","cudz78r","cudz78r","3i6pii"
"Eastern_Cyborg","GKnives","2015-08-25 04:48:53","2015-08-25 04:48:53","12","44","This video was uploaded 5 years ago, so the footage is at least that old. He also mentions that the shuttle is coming to dock, which stopped flying over 4 years ago. Lenovo bought the ThinkPad brand in 2005. So I would guess they have upgraded since.","cue2ywf","cue6d0l","cue2ywf"
"xiMbd03u1","jaseworthing","2015-08-25 01:36:10","2015-08-25 01:36:10","1","136","Astronauts in zero-g need to sleep in the air current from a fan, to move the CO2 away from their face. Zero-g removes convection currents from the equation, since convection currents are driven by density difference caused by temperature difference. What else could cause the exhaled air to mix with the room air? Brownian motion would eventually result in the gasses evenly distributing through the room, but it would take a long time. I think that you would need something like a fan to ""stir"" the air. Why don't people in the tropics have this problem? Maybe it is because even a very small temperature differential is enough to move the CO2 away from your face. So in gravity, you would need to be sleeping at ambient temperature very close to your body temperature. I don't know...","cudtjwp","cudywiu","cudyqmx"
"[deleted]","Gnonthgol","2015-08-25 07:13:16","2015-08-25 07:13:16","8","1","[removed]","cudvmy3","cuec5dr","cue0xgw"
"skydivingdutch","Gnoem","2015-08-25 01:01:07","2015-08-25 01:01:07","9","116","No it isn't. You are at terminal velocity, which means no acceleration, which means your body is experiences 1.0g as usual. But instead of the ground holding you up, it is the column of air you are rushing though. The only time skydiving is like weightlessness is when you jump from a hot air balloon, and then only the first 3 seconds or so. Then indeed you do get that falling feeling. Jumping out of an airplane you don't really get that, since you are moving forward at first, then the air reduces that forward speed while gravity increases your downward (until terminal velocity). So you are really travelling in a big arc those first few seconds.","cudtf0o","cudxn5d","cudwywg"
"GrinningPariah","crooks4hire","2015-08-25 11:17:59","2015-08-25 11:17:59","4","16","Apparently that only lasts a few minutes after making orbit then your body figures itself out.","cudtf0o","cuekvee","cudvuyx"
"piponwa","hyperCubeSquared","2015-08-24 23:03:58","2015-08-24 23:03:58","0","53","Right, but they just keep sending more fuel with every cargo ressuply, so it doesn't really work using the delta v for that. I think delta v is supposed to be used when speaking of spacecraft that have a limited amount of fuel. The delta v is basically the range of the spacecraft.","cudttdm","cudu2li","cudu0n4"
"[deleted]","Rancor_Emperor","2015-08-25 00:52:59","2015-08-25 00:52:59","5","1","[removed]","cudtq1w","cudxcxg","cudwhmt"
"An0k","harpowasright","2015-08-25 06:15:27","2015-08-25 06:15:27","1","26","They don't really navigate with those maps. It's mostly used to see radio stations and night/day cycles. They don't need it to be precise or anything.","cudxyv8","cue9tk0","cudxyv8"
"gruntmeister","[deleted]","2015-08-25 01:57:56","2015-08-25 01:57:56","5","23","same here. was half expecting him to drop to the floor until the system reboots and the anti-gravity system is turned back on.","cudy25y","cudzpum","cudy25y"
"doppelbach","PigBoyOhBoy","2015-08-25 00:53:27","2015-08-25 00:53:27","1","118","&gt; A positive delta V implies that you will increase the magnitude of your velocity (relative to the Earth). A negative delta V implies a decrease in velocity. What?? I have never seen it used that way. It doesn't make sense. For example, you can change your inclination such that your velocity changes by a non-zero amount, but your speed relative to Earth is unchanged (by burning perpendicular to the orbital plane). Your speed isn't increasing, so apparently the dV cannot be positive. But the speed isn't decreasing, so the dV cannot be negative either. But dV cannot be zero, since the velocity changed by a non-zero amount. Your explanation falls apart for any maneuvers which aren't purely prograde or retrograde.","cudttdm","cudxdht","cudw083"
"---___--","[deleted]","2015-08-25 00:25:40","2015-08-25 00:25:40","17","8","\*Cough cough\* Humble brag. ^Ok ^I'm ^just ^envious...","cudsdal","cudwg13","cudvtt5"
"yetanothercfcgrunt","jama211","2015-08-25 02:58:50","2015-08-25 02:58:50","2","69","&gt; True, but it's also true that he is accelerating towards the back of the ship relative to the ship. No it isn't. He isn't experiencing a force that changes his velocity. The station is. That's why the station is accelerating and he isn't. (They're both also accelerating towards the Earth but since the rate and direction of that acceleration is the same for both of those frames it doesn't matter).","cuduquh","cue2218","cue10dk"
"jama211","yetanothercfcgrunt","2015-08-25 03:52:00","2015-08-25 03:52:00","0","65","I did read it, I'm not being disrespectful, I honestly read it and realized that you might not have understood that I was stating acceleration is relative. If you understand what I'm saying and you still think it's wrong, you should probably state why rather than lashing out. Talking down to me isn't a valid way to debunk my statement, if that is your aim.","cuduquh","cue44t7","cue3z5o"
"Denziloe","BlowByDoze","2015-08-26 04:19:23","2015-08-26 04:19:23","1","32","Just because the gravitational field is 9.81m/s2, doesn't mean an object in that field is accelerating at 9.81m/s2. Maybe if you have some humility you'll realise you're getting downvoted for a reason.","cudtmxi","cufbwj1","cudvq5b"
"GKorgood","ebopnostop","2015-08-25 06:46:42","2015-08-25 06:46:42","1","99","It depends on how close the object is to the center of mass of the station, and ensuring the station had zero rotational motion. If the object is directly at the CoM and the station has absolutely no rotation, the two should stay in the same exact orbit forever (barring the station undergoing reentry). However both of those things are nearly impossible to ensure, especially over time. so at some point the object will drift further from the CoM, exacerbating its tendency to drift, so it drifts further, until it finally hits a surface (could be wall, floor or ceiling).","cue5skx","cueb2tw","cue5skx"
"jackson392","ZippoS","2015-08-25 02:33:19","2015-08-25 02:33:19","1","9","i honestly doubt it, they'd just use redundant systems.","cudvmy3","cue12i7","cudvwji"
"gyrinophilus","crowjr","2015-08-25 05:02:06","2015-08-25 05:02:06","1","33","Seriously. Norm's name came up in a thread I had open in another tab while listening to this. All of a sudden I can't unhear Norm talking to me about acceleration in space.","cudt5jt","cue6vmn","cudt5jt"
"gibberfish","Beli_Mawrr","2015-08-25 05:08:08","2015-08-25 05:08:08","1","82","But since velocity is a vector quantity, wouldn't the new orbit have a higher constant delta v due to an increased centripetal force? Like, during one second of orbit (say t to t+1) the change in direction means at t+1 they're going 2.7m/s slower in the direction they were going at t. You're probably right about him mixing things up though, but I guess you might be able to express what they're doing as increasing their delta v in earth's reference frame.","cudvpa6","cue740v","cudwvva"
"Nawara_Ven","aArem","2015-08-25 01:31:14","2015-08-25 01:31:14","3","5","He specifically mentions the ventilation....","cudyg40","cudyq35","cudyg40"
"Kirillb85","---___--","2015-08-25 00:29:50","2015-08-25 00:29:50","1","27","it's a lot more money when you consider it costs $10,000 to put a pound of payload in Earth orbit. (unless you already did the math for me)","cudsdal","cudwl03","cudshpq"
"askthespaceman","radoinc","2015-08-25 05:49:53","2015-08-25 05:49:53","59","7","This happens more often than you think...","cudtq1w","cue8szn","cudxxj4"
"jeffmolby","SwordFlight6216","2015-08-25 01:11:38","2015-08-25 01:11:38","3","24","That would require them to burn throughout the entire orbit, which is something like 90 minutes. I don't think their burn even lasted a minute.","cudwgdp","cudy0m3","cudxejj"
"Korsbaek","piponwa","2015-08-24 23:11:56","2015-08-24 23:11:56","2","34","&gt; The delta v is basically the range of the spacecraft. That is very simply put. It would be easier explained as the velocity a spacecraft could gain in a vacuum before running out of fuel.","cudttdm","cudu9tk","cudu2li"
"gelinrefira","---___--","2015-08-25 01:45:40","2015-08-25 01:45:40","2","30","They have to achieve a lot in their life before they even get the chance to qualify for astronaut training. I think people like these deserve a fucking awesome job.","cudsdal","cudz97r","cudshpq"
"oconnor663","[deleted]","2015-08-25 15:15:07","2015-08-25 15:15:07","0","18","I like to use the internal gyros in my laptop to rotate the keyboard directly into my fingers.","cudwgdp","cues9zp","cuec3ch"
"komali_2","manabu123","2015-08-25 11:46:10","2015-08-25 11:46:10","1","13","That's my favorite author. Man does his fucking research, for all his books.","cudtq1w","cuelwwf","cudvv68"
"CookieOfFortune","Varjohaltia","2015-08-25 07:14:59","2015-08-25 07:14:59","1","15","http://blog.iamnikon.com/en_GB/tag/the-international-space-station/ Maybe not the shipping but I bet they definitely cover all the repairs (and upgrades!).","cudsdal","cuec7qg","cuebltu"
"jayme0227","---___--","2015-08-25 00:23:53","2015-08-25 00:23:53","-1","14","It's too bad that you have to risk blowing up to be an astronaut.","cudsdal","cudwdwt","cudshpq"
"DrHotchocolate","potatoesarenotcool","2015-08-25 04:04:17","2015-08-25 04:04:17","4","23","It'd probably burn up in reentry quite a bit so if we ignore that we can pull a little humor out of it.","cudtq1w","cue4m36","cue2xsk"
"whereworm","[deleted]","2015-08-25 00:04:00","2015-08-25 00:04:00","58","8","That's the reboost scene from ""ISS: The Movie"".","cudtq1w","cudvrjx","cudtq1w"
"PhutureSuave","piponwa","2015-08-25 07:34:27","2015-08-25 07:34:27","4","20","I thought the title said reboot and expected the whole station to go dark and hear the Windows 95 boot sound","cuecyum","cuecyum","3i6pii"
"HawkinsonB","piponwa","2015-08-25 18:22:44","2015-08-25 18:22:44","1","19","ISS reppin Nikon, never been prouder to own one. Funny thing though. Testing acceleration and grabs a $10,000 camera/lens lol","cuevjcc","cuevjcc","3i6pii"
"clothes_are_optional","smallshinyant","2015-08-25 04:23:55","2015-08-25 04:23:55","2","41","i wish i was into it like you. i think he spends way too much time on pointless details and doesn't move on with the plot. hate that kind of writing. i've fallen asleep multiple times trying to get through it","cudtq1w","cue5dsm","cudx4wc"
"yetanothercfcgrunt","jama211","2015-08-25 03:59:24","2015-08-25 03:59:24","0","26","&gt; you might not have understood that I was stating acceleration is relative. Then you misread it, because I was telling you that it's not and why.","cuduquh","cue4f78","cue44t7"
"Nevermind04","ProfessorPickaxe","2015-08-25 02:57:34","2015-08-25 02:57:34","4","22","&gt;&gt;As an aside, apparently Korean Fan Death isn't a risk in space ;-) I sure hope they don't walk under any space ladders!","cudtjwp","cue206e","cudyeao"
"Tazzies","brainchildpro","2015-08-25 06:05:20","2015-08-25 06:05:20","4","13","Uh huh. That's exactly what they want you to believe. /adjusts tinfoil condom","cudvmy3","cue9f86","cue8vms"
"TheRugAteMyShoe","Slothies","2015-08-25 12:54:04","2015-08-25 12:54:04","1","37","That lens has an integrated lens hood that sticks out several inches from the glass. In order to touch the glass, you have to reach well inside the lens hood. He wasn't anywhere close to the glass.","cudsdal","cueoan1","cudy8rz"
"Slothies","bonestamp","2015-08-25 01:53:25","2015-08-25 01:53:25","2","42","Oft. There is no way I could ever get over that. I primarily shoot video so I know when I'm going be getting my shots. I could see the photographer's perspective having the need to leave it off though so good point.","cudsdal","cudzjnd","cudzf9r"
"manabu123","[deleted]","2015-08-25 00:07:18","2015-08-25 00:07:18","14","29","Very cool since i'm ready Seveneves right now by Neal Stephenson. Made me appreciate how much work he put into learning space terminology (e.g., Delta vee). Time to read.","cudtq1w","cudvv68","cudtq1w"
"TheRugAteMyShoe","NewNullObject","2015-08-25 12:49:37","2015-08-25 12:49:37","1","10","I wonder if astronauts have to take craptons of prevacid?","cudtjwp","cueo5a3","cudwhoj"
"Beli_Mawrr","piponwa","2015-08-25 00:01:55","2015-08-25 00:01:55","0","13","""We're going to have a 2.7 m/s increase in our Delta V."" No, you're not.","cudvpa6","cudvpa6","3i6pii"
"Darkben","throw_up_n_away","2015-08-25 02:22:46","2015-08-25 02:22:46","13","18","I like to think HAL going screwy was a result of Microsoft forcing it to patch without asking","cudtq1w","cue0nqg","cudwc8c"
"legolili","nighthawke75","2015-08-25 14:58:08","2015-08-25 14:58:08","2","5","From your extensive firsthand experience","cudsdvm","cuervvn","cudsdvm"
"potatoesarenotcool","danielravennest","2015-08-25 02:25:22","2015-08-25 02:25:22","50","12","But this doesn't sit well with our zero g horror movie theories.","cudtq1w","cue0rha","cue0ilt"
