"source", "destination", "startingTime", "finishingTime", "score", "size", "message", "thread", "href", "parent"
"AccioMotherfucker","FlipStik","2015-08-12 16:20:52","2015-08-12 16:20:52","3","64","I was thinking something without characters. Kind of like a paper about how we've discovered how these things work. Maybe we're planning on sending a ship there, I don't know. I guess almost like a Wikipedia article on how we now know that everything in the universe folds ib on itself and devolving into the story folding in on itself and becoming infinitely recursive. Just ideas.","ctzrgok","cu046kj","cu0453h"
"freeze123901","PatyxEU","2015-08-12 13:30:18","2015-08-12 13:30:18","-1","49","Why don't you guys just leave the giant ass cities your in if you complain about light pollution, I live in the least populated part of my county in the least populated county in the state, no a fucking chance of light pollution guys.. Not that hard to beat","ctzznjo","ctzznjo","3gn01b"
"alcontrast","alcontrast","2015-08-12 13:40:58","2015-08-12 13:40:58","1","89","the remnants of a comet that only circles the sun every few hundred (Earth) years or so fro example.. On a side note.. there must be a limit to the time-distance an object can travel away from our Sun before it entirely breaks the ""Sun's"" gravitational pull and is drawn to another, greater gravitational source.. Is that possible or are the current gravitational fields all slowly closing in on themselves? I'm just thinking outloud and fairly drunk here. . I should read more books instead but I would appreciate any insight.","ctzrgok","ctzzzvs","ctzzoex"
"[deleted]","mbcarl","2015-08-12 12:52:07","2015-08-12 12:52:07","2","12","Do you know which direction to look if i'm in North America?","ctzrgok","ctzyd97","ctzvdn3"
"onFilm","sheepinabowl","2015-08-13 01:27:39","2015-08-13 01:27:39","6","33","Everytime there was a Solar Eclipse back home in Peru, it was cloudy. I moved to Vancouver, and same shit happened twice in a row. Don't even get me started about Lunar Eclipses.","ctzp5h7","cu0g3q4","cu0c0lt"
"moeburn","SagebrushID","2015-08-12 13:43:46","2015-08-12 13:43:46","1","5","Yeah that sounds about right!","ctzx7ia","cu002z5","cu00273"
"AeliusHadrianus","dommu","2015-08-12 21:14:10","2015-08-12 21:14:10","1","8","I'm glad how many upvotes this has gotten.","ctzuwm7","cu08v5f","ctzuwm7"
"Nowin","0thatguy","2015-08-12 12:19:08","2015-08-12 12:19:08","2","11","That's 1/10th what OP's meteor shower was like, just for comparison.","ctzp5h7","ctzx7ak","ctzqemc"
"ParadoxicalJinx","quantumvote","2015-08-12 13:59:30","2015-08-12 13:59:30","1","10","Thanks, you should have gotten top vote... you have mine.","ctzpjc2","cu00kgz","ctzpjc2"
"SuperSMT","Brodins_Hammer","2015-08-12 14:35:54","2015-08-12 14:35:54","1","12","Yes, actually, at least one company is already working on it: http://www.space.com/29849-on-demand-meteror-showers-ale.html","ctzr0s0","cu01n4c","ctzufd5"
"t3hPoundcake","PatyxEU","2015-08-12 12:59:56","2015-08-12 12:59:56","1","119","I remember when I was younger, maybe 10 years ago or something, me and my mother watched the Leonid meteor shower and it was said to be the most spectacular in blah blah years, I didn't really think much of it even though I was and still am a huge space nerd. I still remember sitting outside freezing my ass off with a blanket and hot cocoa, staring up in absolute amazement as I saw white streaks of magic, about a hundred a minute or so was said, fading into green and blue and yellow streaks as the night faded into early morning during sunrise and the sunlight illuminated the trails of the meteors...it was a glorious thing to witness...","ctzymyq","ctzymyq","3gn01b"
"Richardmg9","thipp","2015-08-12 13:40:37","2015-08-12 13:40:37","1","5","religion could potentially remove fear","ctzoq88","ctzzzhi","ctzryql"
"mlodypatyk","PatyxEU","2015-08-12 21:49:37","2015-08-12 21:49:37","1","51","The reason for it is that because of the current use of light and electricity on Earth, we see a lot less blinking stuff, because the light kinda silences it. If you went to the middle of the Pacific Ocean, it would look waaaaaaaaay better than it looks in a city/anywhere.","cu09ike","cu09ike","3gn01b"
"0thatguy","7fw","2015-08-12 09:07:02","2015-08-12 09:07:02","845","58","I googled 'meteor shower 1940s' and it turns out there was a major meteor shower on October 9th, 1946. At its peak- which happened over North America- the rate reached thousands of meteors per hour (!). Just 100 meteors per hour is impressive for a meteor shower, so this was a once in a decade event. I think I found it :)","ctzp5h7","ctzqemc","ctzp5h7"
"Anjz","Lazukin","2015-08-12 22:07:56","2015-08-12 22:07:56","3","8","The guy said light population instead of pollution.","ctzmqud","cu09vxg","cu08oph"
"xisytenin","[deleted]","2015-08-12 11:44:59","2015-08-12 11:44:59","64","9","I understood several of those words, I completely agree.","ctzmqud","ctzvzzv","ctzvy8e"
"LycanicAlex","welding-_-guru","2015-08-13 04:59:19","2015-08-13 04:59:19","2","28","Yeah I always wondered how people could navigate using the stars when you can hardly see any. Until I went into a rural area for the first time.","ctzpjc2","cu0p0gp","cu0go1u"
"CjStaal","LSF604","2015-08-12 12:25:11","2015-08-12 12:25:11","1","25","It's not just the pressurized area that is vulnerable, it's just the most vulnerable. I believe most of the fuel cells on satellites are pressurized.","ctzr0s0","ctzxf37","ctzx5tz"
"enigmamonkey","ajaytech","2015-08-14 02:45:41","2015-08-14 02:45:41","1","23","Might want to edit your post (or post again would probably be better) so you get reminded since there was a typo there.","ctzp5h7","cu1qn3v","cu0woyd"
"ehkodiak","enigmamonkey","2015-08-12 19:16:37","2015-08-12 19:16:37","1","10","RemindMe! 11am on October 7th, 2015 ""Meteor Shower tonight azimuth 280 8pm""","ctzp5h7","cu074g8","ctzu7xl"
"kendirect","reynardthafox","2015-08-13 00:57:42","2015-08-13 00:57:42","1","21","It was probably breath taking for different reasons. 1833 wasn't a very discovered time still, most probably thought it was end times.","ctzmqud","cu0ey2x","ctzmqud"
"WazWaz","Dewy_Wanna_Go_There","2015-08-13 07:06:52","2015-08-13 07:06:52","1","26","They absolutely didn't. At that time even the ""best guess"" for the Sun was coal, and they certainly had no idea that stars were each suns.","ctzpjc2","cu0u9nb","cu0bah4"
"Dewy_Wanna_Go_There","jonnyfgm","2015-08-12 18:20:52","2015-08-12 18:20:52","1","25","You might be surprised at what they *knew* vs. what they chose to believe. People have known what meteors are for a long fucking time.","ctzpjc2","cu069ud","cu05voc"
"capt_clark","GODD_JACKSON","2015-08-12 19:21:43","2015-08-12 19:21:43","1","21","You can also search for ""dark sky parks"" - worth a visit if you're within a couple hours of any of them.","ctzpjc2","cu0774m","ctzzovk"
"FlowstateFluid","FellKnight","2015-08-12 17:02:41","2015-08-12 17:02:41","2","30","RemindMe! November 1, 2032 ""Heads up for a dope meteor shower this month. PS you better be successful and happy dumbass, because here in the past my waving has me in agony.""","ctzrgok","cu04zej","ctzrgok"
"Jeffffffffffs","enigmamonkey","2015-08-12 18:02:14","2015-08-12 18:02:14","1","10","RemindMe! 12pm on October 8th, 2015 ""Go watch the meteor shower""","ctzp5h7","cu05zf8","ctzu7xl"
"Vectoor","charlietoday","2015-08-12 12:44:31","2015-08-12 12:44:31","5","17","Photons are bosons and as such several can occupy the same exact space no problem. I think.","ctzmqud","ctzy3oj","ctzvps4"
"Ronnie_Soak","dar1n9","2015-08-12 13:27:17","2015-08-12 13:27:17","1","7","I coulda swore that was [White Mage](http://www.nuklearpower.com/2004/12/23/episode-495-the-answer-is-eight/)","ctzmqud","ctzzjz7","ctzyj65"
"ClintonHarvey","Viking_Lordbeast","2015-08-12 12:06:34","2015-08-12 12:06:34","101","14","""When you do things right, people won't be sure you've done anything at all.""","ctzpjc2","ctzwrfd","ctzun8m"
"WazWaz","Dewy_Wanna_Go_There","2015-08-12 22:59:21","2015-08-12 22:59:21","-1","36","Yes, I'm drawing back to the point: &gt; I'm pretty sure they knew meteors weren't actually falling stars in the 1880s. Knowing what a meteor is doesn't help you differentiate if you don't know what a star is.","ctzpjc2","cu0b3kv","cu0awwd"
"CatsAreGods","alecn","2015-08-13 09:13:51","2015-08-13 09:13:51","1","10","IIRC that happened when the soldiers came back from war.","ctzmqud","cu0yz6j","cu0186s"
"CynicalZebra","enigmamonkey","2015-08-12 23:18:17","2015-08-12 23:18:17","1","11","RemindMe! 8am on October 8, 2015 ""Meteor shower tonight! Go watch it fool!""","ctzp5h7","cu0bm3t","ctzu7xl"
"GhostRider22","biof3tus","2015-08-12 11:53:07","2015-08-12 11:53:07","9","9","We've had storms in modern times..99/2000 leonids for example","ctzs3yw","ctzwajg","ctzs3yw"
"paulmclaughlin","HelenKellersBhole","2015-08-12 17:56:33","2015-08-12 17:56:33","9","20","I know it's just a typo, but I was trying to work out how artillery would help with dark skies.","ctzpjc2","cu05w6f","cu009hz"
"mmmkunz","FatGecko5","2015-08-12 10:41:42","2015-08-12 10:41:42","131","8","Don't worry, there's always space for more photons.","ctzmqud","ctztqne","ctzpmzb"
"RecoveredAddictAMA","PhatNornangles","2015-08-12 23:39:36","2015-08-12 23:39:36","0","22","&gt; RemindMe! 9am on October 8th, 2015 ""Go outside tonight and look up."" RemindMe! 9am on October 8th, 2015 ""Go outside tonight and look up.""","ctzp5h7","cu0c8se","cu0831o"
"K3R3G3","FellKnight","2015-08-12 12:56:09","2015-08-12 12:56:09","2","35","I remember that! I looked forward to it for a long while, too. I don't think it was years, but damn when the snowstorm came it was so disappointing. Not a chance of seeing anything.","ctzrgok","ctzyi74","ctzrgok"
"Solidsnake104","PatyxEU","2015-08-12 21:14:15","2015-08-12 21:14:15","1","17","PS Battle? â˜ºï¸ Would be great to see how that would look like if it would happen now.","cu08v7r","cu08v7r","3gn01b"
"MrBester","MajorLazy","2015-08-12 16:14:47","2015-08-12 16:14:47","2","14","Before you know it, you're waking up blind and walking plants are killing people...","ctzoq88","cu041zl","ctzu5zb"
"godOmelet","Light_Horizon","2015-08-13 04:17:27","2015-08-13 04:17:27","2","92","Yeah it was totally surreal. I found a website that documents meteor events but no record of that one was there. I can't remember the exact date however, so I can't officially add to the site. You must spend a lot of time out under the stars to see several fireballs! I've seen some really great meteor showers (some of the big ones others have described) as well as a few horizon-stretching individual meteors, but nothing will ever compare to that brighter-than-the-sun fireball when I was a kid out on the golf-course.","ctzznsb","cu0n7ad","cu01z5e"
"WarningDerpAhead","PatyxEU","2015-08-12 13:08:37","2015-08-12 13:08:37","1","32","In the next 10 years, what and where will be the biggest meteor shower? I think it would be worth it to travel to a corner of the world to see constant meteors.","ctzyxko","ctzyxko","3gn01b"
"DreaMTime_Psychonaut","McMurphyCrazy","2015-08-12 15:24:41","2015-08-12 15:24:41","3","7","You'll fit right in here in Colorado.","ctzpjc2","cu02wy6","cu00nd6"
"splashyMcGee","Light_Horizon","2015-08-12 18:19:14","2015-08-12 18:19:14","3","66","I saw a fireball once and now every time I look at the night sky I wish it would happen again. So amazing. It had an insanely long tail, broke into pieces at the end, and I even heard it kind of hiss and sizzle while it was streaking across the sky. I just kind of stared with my mouth hanging open after, completely in awe.","ctzznsb","cu068wj","ctzzxlv"
"McDreads","PatyxEU","2015-08-12 16:33:58","2015-08-12 16:33:58","1","15","This is amazing! I hope to one day witness a meteor storm of this magnitude","cu04fs2","cu04fs2","3gn01b"
"BerserkerGreaves","Dewy_Wanna_Go_There","2015-08-12 19:24:34","2015-08-12 19:24:34","3","13","How would they know anything about the nature of meteors without any education?","ctzpjc2","cu078k1","cu069ud"
"TheSystem_IsDown","[deleted]","2015-08-12 12:27:02","2015-08-12 12:27:02","1","16","Unless you subscribe to string theory, then everything is a Plank-length wibbly-wobbly string with those properties!","ctzmqud","ctzxhgk","ctzvy8e"
"whoizz","jeffdrafttech","2015-08-12 13:19:19","2015-08-12 13:19:19","0","33","Well, not really, the solar system is very dynamic and the fragments from the comets are also in orbit, that's why we don't get them every year from all the comets. *Edited for clarity.","ctzufnp","ctzzail","ctzz2jh"
"poop_poops","Azwethinkweist","2015-08-12 20:32:41","2015-08-12 20:32:41","4","35","&gt; meteor storm If I search that, Google assumes I meant meteor shower. So I'll ask it here - can **meteor storms** be predicted? When is the next one? Any chance a list exists of future storms?","ctzxtq6","cu087lu","ctzxtq6"
"theonlycanvas","GODD_JACKSON","2015-08-12 16:07:00","2015-08-12 16:07:00","1","26","The storms out here in Grand Junction ruined my plans for the night. Star gazing in the desert out here is amazing on a cloudless night.","ctzpjc2","cu03w54","ctzzovk"
"mustnotthrowaway","thipp","2015-08-12 11:12:58","2015-08-12 11:12:58","2","13","Everyone relax, this is just a natural phenomena that we know nothing about.","ctzoq88","ctzuupz","ctzryql"
"asralyn","GODD_JACKSON","2015-08-12 16:17:32","2015-08-12 16:17:32","2","69","The first time I ever went to Shreveport was on my way north evacuating from Katrina. I was so, so very confused about the guys in cowboy hats and boots and I thought Kenner was the flattest thing in existence and BOY WAS I WRONG. Everything was weird and so, so, SO boring and people had these *accents* and I refused to believe that we were still in Louisiana.","ctzpjc2","cu0442z","cu02zos"
"SagebrushID","adsfsk","2015-08-12 13:45:08","2015-08-12 13:45:08","1","25","In ancient times, they most likely attributed it to the ""god"" of whatever being angry or happy or however the people viewed that particular god.","ctzvxsk","cu004jt","ctzvxsk"
"briaen","WiretapStudios","2015-08-13 00:43:25","2015-08-13 00:43:25","1","22","I saw that too. I was surprised by the different colors. Every shooting star I had seen before that was just white.","ctzp5h7","cu0eerf","ctztwtt"
"cantworkouttheugly","FlowstateFluid","2015-08-12 23:43:37","2015-08-12 23:43:37","0","12","RemindMe! 8am on October 8, 2015 ""Meteor shower tonight! Go on and get now!""","ctzp5h7","cu0cd9t","cu04p1w"
"Treebeezy","motorhead84","2015-08-13 00:50:30","2015-08-13 00:50:30","3","27","I'm not sure of the specifics, I just read an article that included that every so often because of the proximity to Jupiter it creates larger storms.","ctzrgok","cu0eo8s","ctzz67g"
"americanpegasus","PatyxEU","2015-08-12 15:07:31","2015-08-12 15:07:31","1","49","Of *course* they thought shit like this was an omen from Tiamat, Dragon God of the Stars. You can hardly blame them. Most of us would go running to the nearest ""wise man"" to find out what such a heavenly portent meant if we saw it today.","cu02hm7","cu02hm7","3gn01b"
"gurg2k1","flaim","2015-08-13 01:17:13","2015-08-13 01:17:13","10","21","He's like the guy who adds his name onto the gift you bought and then says it's from both of you.","ctzp5h7","cu0fp11","cu0795x"
"WanderingSkunk","obiterdictum","2015-08-12 13:45:19","2015-08-12 13:45:19","2","168","Here's a link to a story that references the picture from the OP and gives a bit more info. It was essentially arrived at based on the recorded testimonies of eyewitnesses. Without digging too much further, I'm sure there are lots of personal testimonies regarding the intensity of the shower. Obviously the 100,000/hour figure isn't 100% reliable given the inability to keep truly accurate regards or capture photographic evidence of the shower. http://earthsky.org/todays-image/leonid-meteor-shower-1833 Also this personal story -- ""On the night of November 12-13, 1833, a tempest of falling stars broke over the Earth... The sky was scored in every direction with shining tracks and illuminated with majestic fireballs. At Boston, the frequency of meteors was estimated to be about half that of flakes of snow in an average snowstorm. Their numbers... were quite beyond counting; but as it waned, a reckoning was attempted, from which it was computed, on the basis of that much-diminished rate, that 240,000 must have been visible during the nine hours they continued to fall."" - Agnes Clerke's, Victorian Astronomy Writer","ctzz6fh","cu004r8","ctzz6fh"
"Hollowprime","PatyxEU","2015-08-12 22:18:32","2015-08-12 22:18:32","0","13","RemindMe! 9am on october 8th, 2015 ""go outside and look at big meteor shower.""","cu0a41h","cu0a41h","3gn01b"
"GODD_JACKSON","asralyn","2015-08-12 15:27:40","2015-08-12 15:27:40","1","20","haha no I know, it's a joke we in southern Louisiana make about Shreveport for the exact reasons you described","ctzpjc2","cu02zos","cu02sl6"
"Fizzlefish","McMurphyCrazy","2015-08-12 15:06:12","2015-08-12 15:06:12","1","49","If you are near the central east coast Spruce Knob, WV is one of the darkest places on the east coast. Used to be a yearly trip there in our astronomy/astrophotography club. Just jaw dropping. Using binoculars and looking at the milky way is a very surreal experience there.","ctzpjc2","cu02ge5","ctzzhz2"
"iBlameBoobs","jacksalssome","2015-08-12 20:33:17","2015-08-12 20:33:17","0","7","RemindMe! 8pm on October 8th, 2015 ""Mitirioddzz man""","ctzp5h7","cu087x2","cu05mka"
"PatyxEU","Asilomar","2015-08-13 05:47:36","2015-08-13 05:47:36","1","48","Most of the meteor shower's particles are the size of a grain of sand to a small pebble. Even counting that millions of them strike the Earth in one night, their mass is just too small. It's basically like pouring a bucket of boiling water into a lake.","cu0n03j","cu0r1qa","cu0n03j"
"raptorbpw","scootymcpuff","2015-08-12 10:45:40","2015-08-12 10:45:40","6","16","Don't underestimate the intelligence of past peoples, but definitely don't overestimate the intelligence of present ones.","ctzoq88","ctztvrb","ctzp5u5"
"banana_tango","[deleted]","2015-08-12 13:14:32","2015-08-12 13:14:32","3","21","North East is where the radiant will be. You should be seeing meteors 'coming out' from that part of the sky.","ctzrgok","ctzz4ua","ctzyd97"
"asralyn","GODD_JACKSON","2015-08-12 15:12:32","2015-08-12 15:12:32","1","12","hey, I'm from NOLA and live in Lafayette! Louisiana crew gettin' together!","ctzpjc2","cu02m7c","ctzzovk"
"Beejsterb","enigmamonkey","2015-08-12 19:35:27","2015-08-12 19:35:27","20","43","The Dracnoids are usually really calm, but sometimes the ""Dragon awakes"" and the Dracnoids produce hundreds, maybe thousands of meteors per hour. This happened a few years ago (2010 or 2011?) when they produced around 1000 meteors per hour (sadly it was cloudy where I live).","ctzp5h7","cu07e5x","ctzu7xl"
"FlowstateFluid","three_hands_man","2015-08-12 16:47:17","2015-08-12 16:47:17","11","11","RemindMe! 8am on October 8, 2015 ""Meteor shower tonight! Go watch it fool!""","ctzp5h7","cu04p1w","cu03kum"
"godOmelet","SagebrushID","2015-08-12 14:43:53","2015-08-12 14:43:53","1","4","Don't you mean Perseid?","ctzx7ia","cu01uxd","cu00273"
"IoncehadafourLbPoop","0thatguy","2015-08-12 20:18:04","2015-08-12 20:18:04","1","8","That would make an awesome long exposure picture","ctzp5h7","cu07zw5","ctzqemc"
"DenebVegaAltair","darrellbear","2015-08-12 12:11:23","2015-08-12 12:11:23","0","83","Correction: the big meteor storm happened in 2001, and a bit in 2002. https://en.wikipedia.org/wiki/Leonids I was two, almost three, and the meteor storm is probably one of my earliest memories. My mom woke me up and took me outside to our deck where she laid me on her lap and I watched the meteor storm. It's hard for me to remember any specific image; I more remember what happened rather than what it looked like. It might have something to do with my current fascination with space.","ctzufnp","ctzwxla","ctzufnp"
"keirdre","UnimaginativeJuan","2015-08-12 12:38:33","2015-08-12 12:38:33","29","12","Just in case the Internet fails to notify you at the time!","ctzrgok","ctzxw2x","ctzrqe1"
"uniquely_average","tjlampe","2015-08-12 13:56:19","2015-08-12 13:56:19","2","21","My first thought when reading the title and the parent comment of this thread was that light pollution was the cause.","ctzp5h7","cu00h0s","ctzw79q"
"crazypond","Dimitri_the_Turtle","2015-08-12 16:16:01","2015-08-12 16:16:01","1","11","RemindMe! 4pm on October 8th, 2015 ""Go outside tonight and look up.""","ctzp5h7","cu042xg","cu03n8c"
"eigenvectorseven","Jarslow","2015-08-12 13:38:54","2015-08-12 13:38:54","12","6","Which book is this from again?","ctzuwm7","ctzzxke","ctzv44s"
"SagebrushID","godOmelet","2015-08-12 14:46:28","2015-08-12 14:46:28","1","22","No, Perseids are always in mid-August. I don't recall a Perseid storm in the past 20 years, but I could have missed it.","ctzx7ia","cu01xiz","cu01uxd"
"bcstoner","FellKnight","2015-08-12 11:29:48","2015-08-12 11:29:48","1","4","RemindMe! November 2032 ""Look up""","ctzrgok","ctzvgce","ctzrgok"
"BraulioG1","Lasseus","2015-08-13 02:40:02","2015-08-13 02:40:02","1","13","Yes, It was late at night and my brain wasn't properly working anymore","ctzmqud","cu0j1ez","cu0hcwp"
"FRIENDLY_CANADIAN","GODD_JACKSON","2015-08-12 20:27:28","2015-08-12 20:27:28","1","23","You should stay up tomorrow night until 2-4am and lay down on the ground....thr perseids are quite nice, and they are peaking tomorrow!!","ctzpjc2","cu084uf","ctzz0ky"
"untitled_redditor","PatyxEU","2015-08-12 12:55:00","2015-08-12 12:55:00","1","15","So this weekend, I'm planning on watching these. How many per hour on Saturday night?","ctzygrs","ctzygrs","3gn01b"
"shoots67","[deleted]","2015-08-12 13:36:52","2015-08-12 13:36:52","1","6","Oh that's right... $. EAT A DICK","ctzzju0","ctzzv8f","ctzztrv"
"TheSystem_IsDown","dar1n9","2015-08-12 13:02:18","2015-08-12 13:02:18","1","17","[He's the reason there is matter in the universe and not just a bunch of light particles.](https://en.wikipedia.org/wiki/CP_violation)","ctzmqud","ctzypw6","ctzyj65"
"purple_sage2","7fw","2015-08-13 21:58:37","2015-08-13 21:58:37","1","12","I guess it was sort of. Dark sky, bright streams of light.","ctzp5h7","cu1h9ov","cu0gnjv"
"CustosClavium","gtfomylawnplease","2015-08-12 13:29:37","2015-08-12 13:29:37","7","48","The first time I saw the band of the milky way was when I moved to a small town near the border of (southern) Indiana for school. It was amazing how clear the sky was. Between that and the fireflies, it was an all-around view of twinkling lights.","ctzp5h7","ctzzmq5","ctzxsix"
"[deleted]","[deleted]","2015-08-12 13:35:35","2015-08-12 13:35:35","1","1","[removed]","ctzzju0","ctzztrv","ctzzju0"
"neotropic9","PatyxEU","2015-08-12 12:03:02","2015-08-12 12:03:02","1","20","We should use NASA to do some next level fireworks but just tossing a bunch of shit into the atmosphere.","ctzwmyj","ctzwmyj","3gn01b"
"MysticMoteToter","neonflannel","2015-08-12 11:34:27","2015-08-12 11:34:27","5","9","That's gotta be good for the atmosphere, burning trash?","ctzr0s0","ctzvmb9","ctzuwgf"
"udiniad","greatunknownpub","2015-08-12 21:44:36","2015-08-12 21:44:36","1","15","Unless the sky is constantly covered with clouds to cover the sun from the machines!","ctzrgok","cu09f6u","cu03lgg"
"DickCheesePussyJuice","PatyxEU","2015-08-12 15:49:54","2015-08-12 15:49:54","0","12","It's so beautiful, like Peter North just cumming all over the Earth :)","cu03ioj","cu03ioj","3gn01b"
"adsfsk","PatyxEU","2015-08-12 11:43:17","2015-08-12 11:43:17","3","23","I could not imagine how surprising something like that was to older civilizations. Everybody wondering what the hell was going on up there.","ctzvxsk","ctzvxsk","3gn01b"
"Wertyujh1","TheSystem_IsDown","2015-08-12 17:43:56","2015-08-12 17:43:56","1","32","""Matter won"" - could you just flip the perspective, and say antimatter won and we are all antimatter? It sounds like a naming thing to me, like what we call plus or minus","ctzmqud","cu05ovb","ctzxl3w"
"daresign666","PatyxEU","2015-08-12 23:15:26","2015-08-12 23:15:26","1","20","It would be neat for something on this grand of a scale to happen today, during a world wide blackout.","cu0bjag","cu0bjag","3gn01b"
"Keif_Stones_0-o","enigmamonkey","2015-08-12 18:29:54","2015-08-12 18:29:54","1","11","RemindMe! 9am on October 8th, 2015 ""Go outside tonight and look up.""","ctzp5h7","cu06ex7","ctzu7xl"
"idontknowwhattosay-","GODD_JACKSON","2015-08-13 10:39:15","2015-08-13 10:39:15","1","12","Whoooooooo shit that's a pretty penny! Maybe someday I can get one! â¤ï¸","ctzpjc2","cu11vgr","cu0yvtm"
"HFXGeo","PatyxEU","2015-08-12 10:33:09","2015-08-12 10:33:09","-7","11","It's human nature to over estimate... 100k / hr seems practically impossible....","ctztfm8","ctztfm8","3gn01b"
"thipp","MajorLazy","2015-08-12 10:55:15","2015-08-12 10:55:15","2","39","I understand the physics behind space phenomena better than the average layman population, and I would still shit myself. I imagine even an experienced astrophysicist would be a little terrified, too, unless you observed what caused that particular incident.","ctzoq88","ctzu86p","ctzu5zb"
"Silverlight42","0thatguy","2015-08-12 11:33:29","2015-08-12 11:33:29","17","29","so can this sort of thing happen still? Or have too many of them burned up already? Also I think it's more than once in a decade... more like generation?","ctzp5h7","ctzvl0f","ctzqemc"
"epic676","pdxsean","2015-08-12 12:38:02","2015-08-12 12:38:02","4","26","Pretty sure I saw it as well in upstate New York. It was unreal how many meteors there were. It is something I will never forget.","ctzrgok","ctzxvfq","ctzsex2"
"turtlevader","poop_poops","2015-08-14 04:16:43","2015-08-14 04:16:43","1","5","poop_poops asking the real questions.","ctzxtq6","cu1uf71","cu087lu"
