"source", "destination", "startingTime", "finishingTime", "score", "size", "message", "thread", "href", "parent"
"darrellbear","PatyxEU","2015-08-12 11:01:11","2015-08-12 11:01:11","160","190","The Leonids tend to peak every 33 years. The last big one was in 1966, so 1999 was expected to be the big one. As I recall, in 1998 there were lots of big, colorful fireballs, but no storm. I was driving east on a dirt road far out in eastern Colorado, heading for the observing site I'd picked. The head of Leo rose right at midnight, with the radiant point inside it. It was amazing, it looked like Roman candles spiraling out of the head in all directions. In 1999 it was quite a shower, with lots of fireballs, but still no storm. In 2000 the storm happened. There were several thousand per hour, nothing like the 1833 storm, but VERY impressive. Everywhere one looked in the sky, there were meteors pretty much constantly. The head of Leo was well up by 2 in the morning or so; facing into the radiant was like looking at the viewscreen of the Enterprise on Star Trek while at warp speed, or like watching the Microsoft flowing stars screen saver--meteors constantly streaming out of the radiant in all directions. It was amazing, one of the greatest natural sights I've ever seen.","ctzufnp","ctzufnp","3gn01b"
"Piovertau","GODD_JACKSON","2015-11-16 01:21:06","2015-11-16 01:21:06","1","45","So I was browsing through top posts on /r/space and I saw your comment. I too was vacationing in Buena Vista when you posted your comment. I too saw the milky way for the first time. Like you said, unbelievable. Haha random but crazy coincidence. :)","ctzpjc2","cx0x68c","ctzz0ky"
"powercow","7fw","2015-08-12 16:54:49","2015-08-12 16:54:49","0","6","and probably wont with these lights","ctzp5h7","cu04u5m","ctzp5h7"
"imanAholebutimfunny","PatyxEU","2015-08-12 21:38:39","2015-08-12 21:38:39","2","13","events like these are probably what bred a decent amount of nut jobs","cu09b21","cu09b21","3gn01b"
"Block_Generation","enigmamonkey","2015-08-12 22:16:04","2015-08-12 22:16:04","1","8","RemindMe! 7pm on October 8th, 2015 ""Draconid Meteor Shower""","ctzp5h7","cu0a24t","ctzu7xl"
"Mudbutt7","three_hands_man","2015-08-13 01:22:49","2015-08-13 01:22:49","0","17","RemindMe! 9am on October 8th, 2015 ""Go outside tonight and look up. Don't get hit in the face.""","ctzp5h7","cu0fwwx","cu03kum"
"SexyMrSkeltal","PatyxEU","2015-08-12 17:27:02","2015-08-12 17:27:02","1","22","Will this be visible in the Southern Nevada region? I had no idea there was even a meteor shower until just now!","cu05eqs","cu05eqs","3gn01b"
"indyK1ng","tyranicalteabagger","2015-08-12 13:08:02","2015-08-12 13:08:02","10","14","Clearly that attempt at demonstrating Cunningham's Law is getting me a lot of downvotes.","ctzp5h7","ctzywv5","ctzyqfd"
"Captainbuckle","EdwardBola","2015-08-13 00:44:17","2015-08-13 00:44:17","2","14","RemindMe! 8am on October 8, ""don't go outside, too many people stood around looking up""","ctzp5h7","cu0efx8","cu05wqe"
"rupturedprostate","Goliath_Gamer","2015-08-12 16:47:58","2015-08-12 16:47:58","1","7","Type Remind Me! And then the date","ctzp5h7","cu04pi6","cu03n3k"
"ClintonHarvey","[deleted]","2015-08-12 12:13:34","2015-08-12 12:13:34","11","1","W^o^o^s^hie^w^o^o^shie^w^^o^^^o^^^^o^^^^^o^^^^^^o","ctzpjc2","ctzx0ap","ctzwv88"
"Quetzal_Pretzel","PatyxEU","2015-08-12 15:41:48","2015-08-12 15:41:48","1","33","I know this is off topic, but tonight I saw some meteors while sitting outside. It was about 5-6 per hour that I saw. Is this another shower or just the beginning of Perseids?","cu03bz1","cu03bz1","3gn01b"
"The_Debtor","PatyxEU","2015-08-12 13:59:52","2015-08-12 13:59:52","2","16","The sketch is based on Joseph Harvey Waggoner's description to Karl Jauslin - 54 years after the event. http://articles.adsabs.harvard.edu//full/1995EM%26P...68..311H/0000313.000.html","cu00kvl","cu00kvl","3gn01b"
"m0r31d","ehkodiak","2015-08-12 21:56:46","2015-08-12 21:56:46","1","8","RemindMe! 11am on October 7th, 2015 ""Meteor Shower tonight""","ctzp5h7","cu09nox","cu074g8"
"pdxsean","Corumain_Duvantar","2015-08-12 12:01:36","2015-08-12 12:01:36","10","55","There's an interesting story about after a blackout in the nineties, [Los Angeles] (http://www.pbs.org/seeinginthedark/astronomy-topics/light-pollution.html) 911 was flooded with phone calls asking about the mysterious new lights in the sky that turned out to be the Milky Way. I imagine the same thing happened in NYC/Philly etc. when they had their blackout issues after the big Hurricane.","ctzu0cv","ctzwl65","ctzu0cv"
"nevergetssarcasm","GODD_JACKSON","2015-08-13 00:13:51","2015-08-13 00:13:51","1","30","Visiting a dark sky area should be on everyone's bucket list. I was also in CO when I saw what it really looked like at night for the first time.","ctzpjc2","cu0dcs8","ctzz0ky"
"7fw","FappeningHero","2015-08-13 02:42:36","2015-08-13 02:42:36","1","7","Don't forget etching things in stone tablets.","ctzp5h7","cu0j5bx","cu0fnxl"
"ChellyTown","enigmamonkey","2015-08-12 22:27:20","2015-08-12 22:27:20","1","16","RemindMe! 7am on October 8, 2015 ""Look up the stars Eltanin and Rastaban for Draconids meteor shower tonight""","ctzp5h7","cu0ab3e","ctzu7xl"
"Randyraycyrus","reynardthafox","2015-08-12 15:43:15","2015-08-12 15:43:15","8","14","100,000 meteors per hour? That would be breathtaking now even with all the light pollution","ctzmqud","cu03d6u","ctzmqud"
"sheepinabowl","onFilm","2015-08-13 02:27:29","2015-08-13 02:27:29","2","23","Same for me, as far as every time it comes around it's cloudy. I've seen ONE in my life though, so that's cool.","ctzp5h7","cu0iiva","cu0g3q4"
"cassie1992","PatyxEU","2015-08-12 15:02:32","2015-08-12 15:02:32","1","17","By 1833 did anyone have an idea of what was happening? Or were they all just shitting themselves?","cu02cyo","cu02cyo","3gn01b"
"gangsta_baby","FatGecko5","2015-08-12 14:11:52","2015-08-12 14:11:52","2","8","Light flight is creating ghettos full of darkness!","ctzmqud","cu00y3q","ctzpmzb"
"obiterdictum","SuperSMT","2015-08-13 06:13:48","2015-08-13 06:13:48","1","11","Any sources for these astronomers any their methodology? I'm genuinely interested.","ctzz6fh","cu0s50u","cu01v17"
"idontknowwhattosay-","GODD_JACKSON","2015-08-12 15:19:09","2015-08-12 15:19:09","3","20","Went to maricopa, az in 2013, same thing. I actually cried because it was something I thought I would never see.","ctzpjc2","cu02s1l","ctzz0ky"
"enigmamonkey","0thatguy","2015-08-12 10:55:02","2015-08-12 10:55:02","150","31","&gt; October 9th, 1946 Found a bit more information about it here (link for the lazy): http://meteorshowersonline.com/showers/draconids.html **Edit:** Turns out the Daconids are due for another visit this October, check it out, http://www.timeanddate.com/astronomy/meteor-shower/draconid.html","ctzp5h7","ctzu7xl","ctzqemc"
"SQUID_FUCKER","duckvimes_","2015-08-12 13:31:50","2015-08-12 13:31:50","17","50","Damn...you're probably right. I wonder what other major events have noticeable population spikes following them? That'd make a cool book. Some Indiana Jones-type tracking down some uncovered world event based not on any evidence other than a huge population spike. One ten times larger than any spike in recorded history.","ctzmqud","ctzzpdl","ctzwt5w"
"Thatsnotwhatthatsfor","PatyxEU","2015-08-12 11:39:58","2015-08-12 11:39:58","2","18","Something of this nature is bound to happen again, wonder how much of our space infrastructure would survive.","ctzvthf","ctzvthf","3gn01b"
"Light_Horizon","obiterdictum","2015-08-12 13:41:45","2015-08-12 13:41:45","0","34","You're thinking too much. It's just an old drawing. Could be true, could be bullshit. The estimate is simply the rough number if the sky had that many shooting stars as the drawing suggests.","ctzz6fh","cu000qo","ctzz6fh"
"tonycomputerguy","christophurr","2015-08-12 14:00:17","2015-08-12 14:00:17","7","14","Ah yes I once took a class on the mathmatics of wantan burrito meals...","ctzmqud","cu00lbv","cu0026f"
"Brodins_Hammer","pdxsean","2015-08-12 11:00:55","2015-08-12 11:00:55","9","26","Would it be possible for people in the future to create meteor showers like this, kinda like fireworks for new years? But on a grand scale?","ctzr0s0","ctzufd5","ctzshbq"
"GoSox2525","GreenStrong","2015-08-13 07:20:54","2015-08-13 07:20:54","1","21","Or the same comet will leave a trail in the same place as before and the same meteor shower will return.","ctzp5h7","cu0ut61","ctzz91o"
"[deleted]","ClintonHarvey","2015-08-12 12:09:30","2015-08-12 12:09:30","-8","1","[deleted]","ctzpjc2","ctzwv88","ctzwrfd"
"imperabo","reynardthafox","2015-08-12 12:58:15","2015-08-12 12:58:15","32","22","Except you might have lived in a city where everyone burned coal for heat and you couldn't see through the air pollution.","ctzmqud","ctzykux","ctzmqud"
"Grunnakuba","reynardthafox","2015-08-12 21:50:01","2015-08-12 21:50:01","1","11","It must have been terrifying as hell back in that day","ctzmqud","cu09iv0","ctzmqud"
"sticklebat","christophurr","2015-08-13 00:43:58","2015-08-13 00:43:58","1","33","What do neutrinos have to do with this? Neutrinos barely interact with photons, are not visible to the eye, and are fermions and so *cannot* occupy the same quantum states as each other.","ctzmqud","cu0efhx","cu0026f"
"peteroh9","GODD_JACKSON","2015-08-12 14:34:48","2015-08-12 14:34:48","2","15","And then you heard how the locals pronounce Buena Vista and you saw the devil.","ctzpjc2","cu01m19","ctzz0ky"
"ducttapedude","McMurphyCrazy","2015-08-13 06:39:00","2015-08-13 06:39:00","1","16","http://www.jshine.net/astronomy/dark_sky/ I recently went camping in a blue area, it was incredible to see the Milky Way.","ctzpjc2","cu0t6po","ctzzhz2"
"pooroldedgar","PatyxEU","2015-08-12 13:27:30","2015-08-12 13:27:30","6","17","The night of your birth. 33. The Leonids they were called. My god how the stars did fall.","ctzzk8e","ctzzk8e","3gn01b"
"craigiest","FellKnight","2015-08-12 11:52:14","2015-08-12 11:52:14","13","111","I did trudge out to the country and set up lots of blankets to lie under in winter gear. It was spectacular. I estimated that I saw about 5000 meteors, close to one a second at the peak, with up to three in the sky at a time. And they were bright. The last one I saw shot behind a pink cloud just before the sun came up. One of the coolest things I've ever experienced, though as a result, I can't get too excited about the Perseids anymore. (I guess this must have been 2000. I do sort of remember being disappointed after hype the previous year, and that must have been 1999.)","ctzrgok","ctzw9gb","ctzrgok"
"yanman","PatyxEU","2015-08-12 13:42:20","2015-08-12 13:42:20","1","21","The first thing I think of is ""God how the stars did fall"" which marks the year of McCarthy's kid's birth .","cu001dn","cu001dn","3gn01b"
"greatunknownpub","HelenKellersBhole","2015-08-12 15:49:36","2015-08-12 15:49:36","1","8","McDonald Observatory is awesome and SO bloody dark.","ctzpjc2","cu03if2","cu009hz"
"GODD_JACKSON","McMurphyCrazy","2015-08-12 13:42:51","2015-08-12 13:42:51","4","135","I'm pretty sure Shreveport is part of Arkansas... okay okay sorry I didn't mean that. but get your ass to Buena Vista. go to the wolf preserve (pay a little extra and you get to take pics with some--it's fucking nerve wracking but your Facebook game will be ridiculous). go whitewater rafting because oh man it's fun as hell (we got a narcoleptic instructor). if you want to be a badass there are a few 14ers you can hike (your swamp lungs will hate you though). the women of Colorado are... fit, to say the least. obviously you know about the legal bud. but the night sky. jesus christ man. it's like there are more stars than sky. and to see the galaxy is a bucket list type thing. shit I think I might just stay here.","ctzpjc2","cu001z4","ctzzsrp"
"gtipwnz","enigmamonkey","2015-08-12 22:29:27","2015-08-12 22:29:27","1","11","RemindMe! 9am on October 8th, 2015 ""Go outside tonight and look up.""Ml","ctzp5h7","cu0acvs","ctzu7xl"
"dothrakipoe","GODD_JACKSON","2015-08-12 15:32:40","2015-08-12 15:32:40","20","36","Isn't it crazy that for thousands and thousands of years people have been having that connection with the sky, every night, until the past hundred years or so? Technology can also be kind of a bummer.","ctzpjc2","cu033yr","ctzz0ky"
"cortesoft","indyK1ng","2015-08-12 13:32:02","2015-08-12 13:32:02","8","8","It only works for one level of meta.","ctzp5h7","ctzzpmi","ctzywv5"
"PicopicoEMD","shimshimmaShanghai","2015-08-12 13:25:36","2015-08-12 13:25:36","13","21","&gt; Leonids peak If you look down and see meteors you're either in a lake or something has gone terribly wrong.","ctzrgok","ctzzi0e","ctzz824"
"joewaffle1","reynardthafox","2015-08-13 00:53:39","2015-08-13 00:53:39","1","17","I can't imagine seeing meteor showers even just a few hundred years ago. Shit would be crazy.","ctzmqud","cu0eskz","ctzmqud"
"PM_ME_CHEESEBURGERS","McMurphyCrazy","2015-08-13 01:38:38","2015-08-13 01:38:38","1","23","San lorenzo caynon in NM is about 20 mins from my house and when moon is full its so bright it ruins the view.","ctzpjc2","cu0gjht","ctzzhz2"
"GODD_JACKSON","[deleted]","2015-08-12 13:21:51","2015-08-12 13:21:51","3","7","you should definitely be publishing these findings","ctzpjc2","ctzzdk7","ctzzckz"
"_invoker","reynardthafox","2015-08-12 16:47:46","2015-08-12 16:47:46","1","18","I think this is a time I'd like to go back to if I had a time machine.","ctzmqud","cu04pdf","ctzmqud"
"cozmanian","FellKnight","2015-08-12 12:28:53","2015-08-12 12:28:53","2","39","I actually got myself up for that one! I was in high school and I lucked out and it was clear where I was at. Not to rub it in or anything but it was awesome! Don't hate me...","ctzrgok","ctzxjw0","ctzrgok"
"Keysuhdilluh","jawookie","2015-08-12 14:32:54","2015-08-12 14:32:54","2","34","I remember watching that one- it was spectacular!! I try to catch the Leonids every year in hopes of them being that grand, only to find slight disappointment. Still is a decent show though.","ctzp5h7","cu01k6h","cu000it"
"tyranicalteabagger","indyK1ng","2015-08-12 13:02:44","2015-08-12 13:02:44","7","10","You either get an answer or lots of down votes.","ctzp5h7","ctzyqfd","ctzyclw"
"7fw","0thatguy","2015-08-12 09:27:24","2015-08-12 09:27:24","269","24","Wow! Cool! I thought it was just some overblown memory that all kids have. Nice to know it was a major event. Thanks again.","ctzp5h7","ctzr4dm","ctzqemc"
"Relevant_Music","PatyxEU","2015-08-13 01:56:50","2015-08-13 01:56:50","1","11","RemindMe! 9am on October 8th, 2015 ""Go outside tonight and look up.""","cu0ha2c","cu0ha2c","3gn01b"
"TonyzTone","FellKnight","2015-08-12 13:38:40","2015-08-12 13:38:40","2","26","I remember that meteor shower. It wasn't too crazy (though I live in New York City) but I did end up seeing Jupiter on my telescope.","ctzrgok","ctzzxc3","ctzrgok"
"AnExoticLlama","[deleted]","2015-08-12 14:52:42","2015-08-12 14:52:42","2","49","I couldn't imagine there being any difference in a single photon of high or two photos of equal power occupying the same space that have equivalent overall energy when compared to the singular photon. At the very least, there'd be no way to observe said photons and determine otherwise.","ctzmqud","cu023kt","ctzvy8e"
"ThreesAMurder","PatyxEU","2015-08-13 05:27:36","2015-08-13 05:27:36","2","15","They looked up to the sky and thought, ""what a great time to be alive""","cu0q7pc","cu0q7pc","3gn01b"
"Azwethinkweist","PatyxEU","2015-08-12 12:36:42","2015-08-12 12:36:42","21","181","This is known as a ""meteor storm"" and they're really cool! A meteor shower occurs when Earth passes through the ""river of debris"" that is left behind by a comet that is expelling gas &amp;amp; dust as it nears the sun. Since this ""river of debris"" exists in the same position in our solar system (the orbit of the comet), our planet Earth passes through them at the same time every year (so as you're watching a meteor shower, you're watching as Earth 'runs into' this river of debris, piece by piece). This is how we know when meteor showers will happen during every year. A meteor storm occurs when Earth passes through a river of debris left behind by a new comet, one that hasn't passed through the solar system before. Since its that comet's first trip through the solar system, it leaves behind a more dense river of debris. And since Earth has never passed through this particular river of debris before, there's lots and lots to run into and create meteors! Hence: meteor storm. SPACE IS AWESOME. Source: Astronomy classes in college","ctzxtq6","ctzxtq6","3gn01b"
"reddittrees2","[deleted]","2015-08-12 19:22:10","2015-08-12 19:22:10","2","69","Is it also timey wimey? Do you have to talk like that? Like children? What are you pointing your screwdrivers at me for?! They're scientific instruments not water pistols! On a more serious note I live in NJ with a lot, a **lot** of light pollution. Does anyone have a suggestion where I should go? Anywhere inside of 2~ hours is fine, I've thought about Sussex County, near high point?","ctzmqud","cu077dl","ctzvy8e"
"Beejsterb","PatyxEU","2015-08-12 19:31:01","2015-08-12 19:31:01","1","59","A few years ago I think the Dracnoids in October produced a hundred meteors per hour. EDIT: Some info: There are two major meteor showers every year: The perseids in August and the geminids in December. Sometimes meteor showers, such as the Leonids and Dracnoids, can produce way more meteors than the perseids and the geminids every few years.","cu07bw7","cu07bw7","3gn01b"
"Grammar-Nazi007","CustosClavium","2015-08-12 15:01:22","2015-08-12 15:01:22","2","27","I didn't know there were so many people in Indiana star gazing. I'm northern Indiana and live in a decently small city. Light pollution isn't that bad.","ctzp5h7","cu02bul","ctzzmq5"
"WiretapStudios","jawookie","2015-08-12 14:25:50","2015-08-12 14:25:50","2","71","That was it! We were in the city and saw that many per hour, so I can only imagine if it was darker. A year or two ago we went up on a ridge and saw a great one, one flew literally over us and the ridge burning up. I'm going up to that ridge tomorrow with my camera and doing some long exposures to see if anything interesting turns out.","ctzp5h7","cu01cwx","cu000it"
"RedHaze","enigmamonkey","2015-08-12 21:41:36","2015-08-12 21:41:36","1","16","RemindMe! 8am on October 8, 2015 ""Meteor shower tonight! Go outside for once you lazy piece of shit""","ctzp5h7","cu09d2k","ctzu7xl"
"cerealbh","PatyxEU","2015-08-12 14:48:58","2015-08-12 14:48:58","1","14","It is not hard to romanticize this moment, man time travel take me there.","cu01zyu","cu01zyu","3gn01b"
"GardenLife","PatyxEU","2015-08-13 00:27:33","2015-08-13 00:27:33","1","47","Can you imagine how scary that must have been? Most people being uneducated, not understanding what they are seeing - going outside and seeing the goddamn sky falling in the middle of the night! They must have been confused when the stars came out again the next night. Awesome.","cu0du5v","cu0du5v","3gn01b"
"trentthecaptain","Viking_Lordbeast","2015-08-12 13:13:18","2015-08-12 13:13:18","2","5","Awww skeet skeet motha mary!","ctzpjc2","ctzz3ce","ctzun8m"
"MDC40","Silverlight42","2015-08-12 13:35:45","2015-08-12 13:35:45","26","183","Most meteor showers are caused by earth passing through a trail of dust and debris left behind from a comet. The comet passed near the sun and as it heats up it's leaving a trail of debris behind it. Earth will pass through these trails quite predictably which is how we can know exactly when a meteor shower will occur. Occasionally we can predict a bigger amount of dust and debris from a comet and this increase what type of ""show"" is expected, but every once in a while the trail we pass through for any certain shower could potentially be much thicker than expected resulting in an awesome display of meteors. Sometimes scientists can even know exactly how old the trail is and thus you can know that the meteor you just saw was caused by a piece of dust left by a comet something like 300 years ago. Pretty neat stuff. Moral is if you don't want to miss the big show then you better make sure you check out all the showers just in case the next one is the one!","ctzp5h7","ctzztxp","ctzxlre"
"neonflannel","MysticMoteToter","2015-08-12 13:03:39","2015-08-12 13:03:39","9","43","I'm not saying its good or bad but [they already have](http://mashable.com/2014/08/15/cygnus-space-station-departure-nasa/). I cant seem to find any environmental info on any of it. But its basically a high temp incinerator. We already blow up 60,000 tons of fireworks in USA annually. I'm just sayn..","ctzr0s0","ctzyrjm","ctzvmb9"
"McKlown","neotropic9","2015-08-12 18:01:32","2015-08-12 18:01:32","1","63","I remember them doing something similar back in the late 80's/early 90's. One night they had a satellite dump some chemical over Florida that caused a glowing green mist in the sky as some sort of experiement. I remember my family going outside to watch. I just wish I could remember more , I'd love to look up more details after all these years.","ctzwmyj","cu05z1d","ctzwmyj"
"alonjar","reddittrees2","2015-08-12 22:22:45","2015-08-12 22:22:45","2","45","I don't have the link handy since I'm on mobile, but just google for light pollution map, amateur astronomers have already made advanced google overlays with light pollution gradient system to show you exactly how good views of the night sky are at what locations.","ctzmqud","cu0a7dp","cu077dl"
"maxfortitude","three_hands_man","2015-08-12 21:56:59","2015-08-12 21:56:59","0","10","RemindMe! 8am on October 8, 2015 ""There's a great meteor shower tonight!!!""","ctzp5h7","cu09nux","cu03kum"
"Too_much_vodka","pdxsean","2015-08-12 22:30:06","2015-08-12 22:30:06","1","28","&gt; it's not like there's going to be anything burning flying toward them. Whether or not it's burning has no bearing on whether or not it's dangerous to satellites.","ctzr0s0","cu0adfi","ctzshbq"
"GODD_JACKSON","McMurphyCrazy","2015-08-12 13:31:25","2015-08-12 13:31:25","21","29","oh shit, I'm from Lafayette and live in NOLA! I'm about to spark one and hope the clouds part long enough to catch some of the Perseid meteor shower","ctzpjc2","ctzzovk","ctzzhz2"
"mikehipp","Corumain_Duvantar","2015-08-12 19:18:00","2015-08-12 19:18:00","1","49","Absolutely. I lived in a very small town growing up. I very fondly remember laying out in the back yard at night and marveling at the milky way. I have lived in a major city now for almost 20 years - that is one of the things that I miss the most.","ctzu0cv","cu0756v","ctzu0cv"
"iamaManBearPig","-kindakrazy-","2015-08-12 13:26:11","2015-08-12 13:26:11","1","37","With LEDs becoming more ubiquitous as a light source and cities starting to plan around reducing light pollution, maybe one day cities like NYC will have low enough light pollution to see more than a few stars.","ctzpjc2","ctzzioa","ctzws2k"
"AKnightAlone","FlowstateFluid","2015-08-12 22:51:09","2015-08-12 22:51:09","0","11","RemindMe! 8am on October 8, 2015 ""Meteor shower tonight! Go watch it fool!""","ctzp5h7","cu0avyi","cu04p1w"
"imnamenderbratwurst","furrypla94","2015-08-12 16:52:08","2015-08-12 16:52:08","1","33","Stars != Meteors. Yes, you'd probably be able to see more stars. But you most likely wouldn't be able to see more meteors. They are bright enough anyway. There simple aren't more of them.","cu04k4i","cu04sbn","cu04k4i"
"thecmfg","McMurphyCrazy","2015-08-12 15:15:21","2015-08-12 15:15:21","2","28","Oddly enough I'm in Longview, TX right now for work and driving to Shreveport tomorrow to fly back to to NOLA on Thursday, as I too live there.","ctzpjc2","cu02oqd","ctzzsrp"
"Viking_Lordbeast","quantumvote","2015-08-12 11:07:10","2015-08-12 11:07:10","387","10","I bet they thought it was God climaxing or something.","ctzpjc2","ctzun8m","ctzpjc2"
"Lazukin","PatyxEU","2015-08-12 21:11:43","2015-08-12 21:11:43","1","29","In case anyone is interested, there will be a very visible (but small, 1 meteor per minute) meteor shower tonight, August 12, at around midnight PST. A bit later I think.","cu08tnp","cu08tnp","3gn01b"
"shoots67","shoots67","2015-08-12 13:44:51","2015-08-12 13:44:51","1","34","Jesus might have dosed and pranked his apostles into believing that he could walk on water, but holy shit did he get it truly right when he overturned the money-changer's tables. Make that $!!","ctzzju0","cu0047j","ctzzv8f"
"pudles","darrellbear","2015-08-13 02:25:17","2015-08-13 02:25:17","1","25","Peak is considered between 11PM EDT 08/12/2015 and 3AM EDT 08/13/2015. Coming from the North East. Best to watch in a dark spot with little light polution.","cu00j4i","cu0ifnd","cu00j4i"
"reckoner15","mazu747","2015-08-12 16:00:37","2015-08-12 16:00:37","2","22","Let's assume that photons are the jelly, and the fabric of space and time is the bread- what would peanut butter be?","ctzmqud","cu03r85","cu0125c"
"bonkus","enigmamonkey","2015-08-12 23:02:03","2015-08-12 23:02:03","1","8","RemindMe! 9pm on October 7th, 2015 ""METEORS TONIGHT #YOLO.""","ctzp5h7","cu0b64l","ctzu7xl"
"three_hands_man","enigmamonkey","2015-08-12 15:52:38","2015-08-12 15:52:38","17","11","RemindMe! 9am on October 8th, 2015 ""Go outside tonight and look up.""","ctzp5h7","cu03kum","ctzu7xl"
"dar1n9","TheSystem_IsDown","2015-08-12 12:56:54","2015-08-12 12:56:54","1","9","What does Captain Picard have to do with this?","ctzmqud","ctzyj65","ctzxl3w"
"PeasantToPrince","PatyxEU","2015-08-12 15:09:36","2015-08-12 15:09:36","1","33","And to think I was freaking out at camp a few weeks ago because I saw a single shooting star. First one I've seen since I was a child and I loved it","cu02jk8","cu02jk8","3gn01b"
