"source", "destination", "startingTime", "finishingTime", "score", "size", "message", "thread", "href", "parent"
"OrginalCanadian","FlowstateFluid","2015-08-12 23:07:03","2015-08-12 23:07:03","0","17","RemindMe! 8am on October 7, 2015 ""Look at these scrubs only warning themselves the day of the meteor shower""","ctzp5h7","cu0bb0a","cu04p1w"
"2cone","PatyxEU","2015-08-12 12:41:48","2015-08-12 12:41:48","0","12","The leonids are always more impressive. I counted close to 500 one year.","ctzy08x","ctzy08x","3gn01b"
"ExtrudesCaca","wotrednuloot","2015-08-12 19:36:12","2015-08-12 19:36:12","1","5","Or one alphabet of photons","ctzmqud","cu07ekq","ctzxpy4"
"terrapin1203","PatyxEU","2015-08-12 10:44:53","2015-08-12 10:44:53","5","25","Check out the standard ""Stars Fell on Alabama"" which was a song written about this event. Very cool history. Edit: Julian Cannonball Adderley's version: https://www.youtube.com/watch?v=ddcWxY-K9vk","ctztuqs","ctztuqs","3gn01b"
"Rengee","FlowstateFluid","2015-08-12 19:05:30","2015-08-12 19:05:30","0","11","RemindMe! 8am on October 8, 2015 ""Meteor Shower[1] tonight! Go watch it fool!""","ctzp5h7","cu06yg7","cu04p1w"
"Levy_Wilson","scootymcpuff","2015-08-12 20:48:14","2015-08-12 20:48:14","1","52","I just got a sad realization. You looked into the past and saw accounts from scholars. What will the future generations read when they look up events during our time? Tweets and Facebook posts. Our future generations are going to think the average person was stupider now than they were 200 years ago.","ctzoq88","cu08fxv","ctzp5u5"
"Aixth","Viking_Lordbeast","2015-08-12 14:14:35","2015-08-12 14:14:35","6","10","the probably thought it was the end of the world","ctzpjc2","cu010za","ctzun8m"
"Xtrall","gonthrax","2015-08-12 16:34:24","2015-08-12 16:34:24","1","17","I'm so jealous :( I rather live In a quiet place rather than a city full of pollution.","ctzu0cv","cu04g36","ctzuxi7"
"lightinthedark","Beejsterb","2015-08-13 05:22:31","2015-08-13 05:22:31","1","17","I was out for that one, it was pretty cool. Can't find the photos I took, unfortunately.","ctzp5h7","cu0pzw0","cu07e5x"
"[deleted]","mustnotthrowaway","2015-08-12 11:58:42","2015-08-12 11:58:42","-1","1","[deleted]","ctztfm8","ctzwhlm","ctzuzs4"
"[deleted]","SovreignTripod","2015-08-12 13:14:37","2015-08-12 13:14:37","4","6","You really gonna poke that bear?","ctzmqud","ctzz4yl","ctzyw8i"
"alecn","SQUID_FUCKER","2015-08-12 14:21:14","2015-08-12 14:21:14","5","5","How about the [baby boomers](https://en.wikipedia.org/wiki/Baby_boomers)?","ctzmqud","cu0186s","ctzzpdl"
"thatdbeagoodbandname","PatyxEU","2015-08-13 03:26:17","2015-08-13 03:26:17","2","12","This should get cross-posted to /r/ASMR because that's what it feels like!","cu0l03r","cu0l03r","3gn01b"
"GODD_JACKSON","PeasantToPrince","2015-08-12 16:44:56","2015-08-12 16:44:56","13","16","i mean i can only stand in reverence for so long. plus my popcorn was ready","ctzpjc2","cu04ngj","cu040et"
"pdxsean","Ressotami","2015-08-12 10:06:06","2015-08-12 10:06:06","9","79","Most of these meteors are the size of a grain of sand, maybe as big as a pea. They only show up when they interact with our atmosphere. Satellites are way outside of our atmosphere, so it's not like there's going to be anything burning flying toward them. As for how satellites deal with day-to-day space dust I can't answer, but I imagine an event like this is no more than they'd face in a few years of day-to-day operation.","ctzr0s0","ctzshbq","ctzrp70"
"not_son_goku","charlietoday","2015-08-12 23:59:06","2015-08-12 23:59:06","0","178","It's a photon. You have no idea how incredibly small and (un)stable they are. They just move around all willy nilly and care not a bit about space because they do not have mass. Yes, they are particles. But a particle in this instance is better understood as the smallest amount of something; In our case light. Light has no mass. That's why it moves so damn fast. So no, you can never occupy a space with too many photons. Ever. Unless you're trying to be clever and what you really mean is that it's too bright outside. *EDIT* Oh my god guys. It's light. It doesn't have mass. It doesn't occupy space in the same sense as say...a brick...or literally ANYTHING ELSE. Light is special. Its raw energy. Fuck, there is even a thing called invisible light. You can have a photon of a radiowave. Its the smallest amount of that particular wave. Now, energy can be converted into mass but it ain't going to happen here on earth except maybe in a lab one day. Everyone go home.","ctzmqud","cu0cv3k","ctzvps4"
"alcontrast","imperabo","2015-08-12 13:31:03","2015-08-12 13:31:03","2","27","with our relatively limited history of astrological research isn't it entirely possible that we could have a completely unforeseen event that rivals or blows away past events???","ctzrgok","ctzzoex","ctzyo4f"
"rpeters","enigmamonkey","2015-08-12 20:33:11","2015-08-12 20:33:11","0","11","RemindMe! 8am on October 8, 2015 ""Meteor shower tonight! Go watch it fool!""","ctzp5h7","cu087v3","ctzu7xl"
"DongLongson","OrginalCanadian","2015-08-13 00:47:01","2015-08-13 00:47:01","0","17","RemindMe! 8am on October 7, 2015 ""Look at these scrubs only warning themselves the day of the meteor shower""","ctzp5h7","cu0ejji","cu0bb0a"
"Light_Horizon","SuperSMT","2015-08-12 14:51:19","2015-08-12 14:51:19","1","34","Thanks for the info Super. I'll have to research that. I did hear of a shower during the pre-industrial age where people were very scared for their lives. This might be the same one.","ctzz6fh","cu022a8","cu01v17"
"dCLCp","MysticMoteToter","2015-08-13 18:42:28","2015-08-13 18:42:28","1","20","Try hours or days. Americans tons and tons of trash indivually every year and there's *hundreds of millions of us*.","ctzr0s0","cu1e7ak","cu03yst"
"McMurphyCrazy","[deleted]","2015-08-12 14:02:06","2015-08-12 14:02:06","10","93","After coming down from a particularly heavy mushroom trip one time I went outside my friend's house, who lives in middle of nowhere, and saw the most glorious view of the stars ever. For the most part had sobered up but my pupils were still massive and it seemed like every star was a bit brighter, the weather was perfect, and not a cloud in the sky. I had some orchestral music playing on my phone at the time, and it was just fucking majestic. It's amazing we get to see this beauty.","ctzpjc2","cu00nd6","cu00fvu"
"idontknowwhattosay-","GODD_JACKSON","2015-08-13 02:02:41","2015-08-13 02:02:41","1","26","It's the most amazing thing isn't it? I mean sure having equipment would make it better but you can see it in some areas just yourself!","ctzpjc2","cu0hinu","cu0344a"
"thegr8rambino13","7fw","2015-08-12 15:09:05","2015-08-12 15:09:05","1","8","wish i can see something like that someday","ctzp5h7","cu02j3k","ctzp5h7"
"ExpLimited","PatyxEU","2015-08-12 14:07:00","2015-08-12 14:07:00","2","17","Just gonna take a hunch, but back in 1833 there were probably far fewer lights causing light pollution,","cu00ssr","cu00ssr","3gn01b"
"SuperSMT","Thatsnotwhatthatsfor","2015-08-12 14:42:37","2015-08-12 14:42:37","2","48","While 28 meteors per second sound like a lot, that's talking about 28 pea-size or smaller objects over an area of 64,000 square km (25,000 sq mi). Space is huge, it's highly unlikely anything will be hit - no other meteor shower has hit anything in orbit, including a few huge showers 1,000 meteors/hour+","ctzvthf","cu01tpa","ctzvthf"
"moeburn","PatyxEU","2015-08-12 12:19:18","2015-08-12 12:19:18","1","64","A decade or so ago, my dad drove me and my mom up north out of Toronto to see a meteor shower. I'm sure as hell glad he did, because I've never seen anything like it in my life. On average, there was one shooting star every 5 seconds. But at times, there was 1 every second. No idea if this meteor shower had a ""name"".","ctzx7ia","ctzx7ia","3gn01b"
"Delta-62","three_hands_man","2015-08-12 21:39:42","2015-08-12 21:39:42","0","7","RemindMe! 8am on October 8th, 2015 ""Meteor shower""","ctzp5h7","cu09bs9","cu03kum"
"zangor","Minomelo","2015-08-12 12:56:25","2015-08-12 12:56:25","-8","34","And make sure you press your shit right up to her as you cum and frenetically staple your scrotum to the sides of the labia in an effort to make an air tight seal.","ctzmqud","ctzyiip","ctzx8l4"
"neomagtyler","scootymcpuff","2015-08-12 10:01:10","2015-08-12 10:01:10","5","23","Do you know what lots of people would say today about that? You know rapture and stuff like that. People haven't stop being ignorant sadly.","ctzoq88","ctzsb5t","ctzp5u5"
"DeerKiller","greatunknownpub","2015-08-12 21:41:31","2015-08-12 21:41:31","1","18","Or, you know, you could move out of a big city and hopefully we won't need an apocalypse!","ctzrgok","cu09d0i","cu03lgg"
"whoizz","Frater_Petrichor","2015-08-12 13:22:41","2015-08-12 13:22:41","2","6","This is a great fucking point.","ctzoq88","ctzzejg","ctzsjjb"
"7fw","PatyxEU","2015-08-12 08:32:19","2015-08-12 08:32:19","867","46","My mother describes a time in the 1940s when she was a kid, her parents woke her up (she lived on a farm in Ohio) and she saw just a constant flow of meteors. She said she has never seen anything like it in videos since.","ctzp5h7","ctzp5h7","3gn01b"
"flaim","scrotalimplosion","2015-08-12 19:25:43","2015-08-12 19:25:43","29","1","\&gt;we [mfw](http://i.imgur.com/G6KigYF.jpg)","ctzp5h7","cu0795x","cu06ku1"
"7fw","purple_sage2","2015-08-13 01:41:25","2015-08-13 01:41:25","1","8","Yes. And it was in black and white.","ctzp5h7","cu0gnjv","cu07t84"
"Aegean","enigmamonkey","2015-08-12 18:38:28","2015-08-12 18:38:28","1","11","RemindMe! 9am on October 8th, 2015 ""Go outside tonight and look up.""","ctzp5h7","cu06jn8","ctzu7xl"
"AccioMotherfucker","FlipStik","2015-08-12 16:05:11","2015-08-12 16:05:11","6","82","I bet things are different than what we think they are. We've laid out a bunch of rules like light speed and how we think things work, but we've constantly proven other rules false. I bet there's some weird shit out there that we won't discover for a long time. Maybe we can actually go faster than light or there's something at the edge of the universe. There's probably something somewhere that will flip all the stuff we think we know. I love it.","ctzrgok","cu03upp","cu005np"
"BrentD22","PatyxEU","2015-08-12 17:00:14","2015-08-12 17:00:14","1","50","I can see it now... 2000 years from now a future society finds our old photo-shops and what not. Thinking we must have been too primitive to create much at all they take the photoshopped pictures as real. Can you imagine the conspiracy theorists of the future looking over this content...","cu04xtg","cu04xtg","3gn01b"
"Duodecimal","mbcarl","2015-08-13 02:45:55","2015-08-13 02:45:55","0","10","Or we get new ones we didn't know about before.","ctzrgok","cu0jach","ctzv9kv"
"Cruxion","Meuses","2015-08-13 16:03:44","2015-08-13 16:03:44","0","23","It's the term when there is a lot of light from cities and such, thus making farther/dimmer lights like stars hard to see.","ctzmqud","cu1benz","cu04z7r"
"ratsba1000","PatyxEU","2015-08-13 00:40:18","2015-08-13 00:40:18","0","12","It must have been a breathtaking show without all the light population","cu0eala","cu0eala","3gn01b"
"jacksalssome","barruu","2015-08-12 17:40:03","2015-08-12 17:40:03","1","16","RemindMe! 9pm on October 7th, 2015 ""Get a chair outside and direct your head towards the sky.""","ctzp5h7","cu05mka","cu05b3b"
"Beejsterb","Waywoah","2015-08-12 19:40:06","2015-08-12 19:40:06","1","14","Like I said in another comment, the Dracnoids produced over 1000 meteors per hour in 2012.","ctzp5h7","cu07gme","ctzvtqy"
"tdawg4rul","PatyxEU","2015-08-12 09:24:34","2015-08-12 09:24:34","19","21","Maybe I'm grossly misunderstanding this but... If such a meteor storm would happen now how dangerous would it be to satellites?","ctzr0s0","ctzr0s0","3gn01b"
"Xalteox","furrypla94","2015-08-12 18:33:21","2015-08-12 18:33:21","1","48","Fun fact: there was a massive blackout in LA during the 90s (forgot the actual date). Once power was restored, the LAPD received dozens of calls claiming an ""alien invasion"" and ""an alien fleet in the sky."" In reality they saw the milky way for the first time.","cu04k4i","cu06grr","cu04k4i"
"CloneSix","jawookie","2015-08-12 17:19:40","2015-08-12 17:19:40","1","53","That was the first meteor shower I had ever seen. I thought all showers were like this. I saw it in a mid-size city, too, with a good amount of light pollution. Every year, twice a year, I wait for the meteor shower. I am always disappointed! Now I know the reason why! :)","ctzp5h7","cu05a8a","cu000it"
"DontCallMeInTheAM","FellKnight","2015-08-12 11:57:14","2015-08-12 11:57:14","6","4","RemindMe! On November 1, 2032","ctzrgok","ctzwfqp","ctzrgok"
"Meuses","reynardthafox","2015-08-12 17:02:22","2015-08-12 17:02:22","13","2","Light pollution?","ctzmqud","cu04z7r","ctzmqud"
"[deleted]","enigmamonkey","2015-08-12 19:27:04","2015-08-12 19:27:04","7","1","[deleted]","ctzp5h7","cu079uz","ctzu7xl"
"Seeders","7fw","2015-08-12 14:57:32","2015-08-12 14:57:32","1","16","I got to see one like that once when I was a kid in the 90s.","ctzp5h7","cu0288f","ctzp5h7"
"diggleblop","McMurphyCrazy","2015-08-12 18:58:15","2015-08-12 18:58:15","1","13","Goddamnit man, get your priorities straight, weed first, neverending void of space later","ctzpjc2","cu06ugq","ctzzhz2"
"welding-_-guru","GODD_JACKSON","2015-08-13 01:41:47","2015-08-13 01:41:47","6","51","buildings, homes, and cars will still be pumping it out though. Having grown up in rural Kansas, the difference in the stars between ""rural areas"" and ""the middle of fucking nowhere"" is about as astonishing as going from ""inner city"" to ""small town"" Light pollution is bigger than most people think.","ctzpjc2","cu0go1u","cu036xk"
"shimshimmaShanghai","[deleted]","2015-08-12 13:17:11","2015-08-12 13:17:11","15","15","Im not a scientist, but, up would be your best bet (sorry, I couldnt resist...)","ctzrgok","ctzz824","ctzyd97"
"asralyn","GODD_JACKSON","2015-08-12 15:19:47","2015-08-12 15:19:47","1","34","Shreveport is from the state North Louisiana. It's an odd place up there, sort of like an East Texas. Seriously though, LA should be divided into two states. North and South are so radically different.","ctzpjc2","cu02sl6","cu001z4"
"StuckInaTriangle","flaim","2015-08-13 07:08:22","2015-08-13 07:08:22","1","8","He must have a mouse in his pocket","ctzp5h7","cu0ubp9","cu0795x"
"cordell507","HelenKellersBhole","2015-08-13 02:03:59","2015-08-13 02:03:59","1","28","Yes! I'm from Louisiana and I spend most of my summer in west Texas. The mountains and the stars make for a beautiful place to watch the sky.","ctzpjc2","cu0hkkt","cu009hz"
"krenshala","wotrednuloot","2015-08-13 04:03:10","2015-08-13 04:03:10","2","21","If we're going to be stuffing them into a small box, I say we stuff a googolplex of photons in, instead.","ctzmqud","cu0mlbv","ctzxpy4"
"Arthorius","scootymcpuff","2015-08-12 12:38:39","2015-08-12 12:38:39","1","36","Soooo... you're saying that just because I don't understand how magnets work doesn't mean that they are metal bits enchanted by the devil himself to destroy all of humanity? You're out of your mind, dude :&lt;","ctzoq88","ctzxw7k","ctzp5u5"
"Light_Horizon","godOmelet","2015-08-12 14:48:08","2015-08-12 14:48:08","1","108","That's amazing. I don't think I've ever heard of one turning night into day even if for just a moment. I've been lucky enough to have seen several fireballs in my life. The most recent was a year ago on a remote mountain highway. It was like a big fireball hit a brick wall and the sparks just started to fall straight down from the moment of impact with out atmosphere. I was actually scared for a few seconds. It appeared that the thing was going to hit the road in front of me but in actuality, it was probably quite a distance away, both laterally and vertically.","ctzznsb","cu01z5e","cu01q1u"
"[deleted]","thipp","2015-08-12 11:23:21","2015-08-12 11:23:21","1","27","Even now I would freak out about it until someone told me the scientific reason. I'm the ""the world is ending"" kind of guy in those scenarios.","ctzoq88","ctzv888","ctzryql"
"BitterCoffeeMan","AccioMotherfucker","2015-08-12 15:45:49","2015-08-12 15:45:49","1","19","Assuming the universe is infinite, we exist because we have to exist. Whatever could happen will happen. Murphy's law.","ctzrgok","cu03fd7","ctzyfjb"
"WiretapStudios","balathustrius","2015-08-12 16:44:20","2015-08-12 16:44:20","1","21","Ahh, I'm on a farm in the country basically, but tonight it was clouded over completely. Tomorrow should be clear though.","ctzp5h7","cu04n1n","cu04d3z"
"EdwardBola","FlowstateFluid","2015-08-12 17:57:33","2015-08-12 17:57:33","93","11","When you need reddit bots to remind you to go outside.","ctzp5h7","cu05wqe","cu04p1w"
"FappeningHero","7fw","2015-08-13 01:16:28","2015-08-13 01:16:28","1","13","Back when people had to remember things using their eyes and brains parts","ctzp5h7","cu0fnxl","ctzp5h7"
"SovreignTripod","[deleted]","2015-08-12 14:54:28","2015-08-12 14:54:28","1","27","I just have no idea what he's talking about and want to know. It sounds like he's spouting BS but I don't know enough to be sure.","ctzmqud","cu025ai","ctzz4yl"
"neonflannel","MysticMoteToter","2015-08-12 20:39:04","2015-08-12 20:39:04","1","17","Maybe we'll have a ""safe to burn"" plastic and such by that time. A boy can dream.","ctzr0s0","cu08ay3","cu03yst"
"ooKael6Z","PatyxEU","2015-08-12 15:18:22","2015-08-12 15:18:22","1","11","Apparently kickstarted some of the evangelist religious movements in the US.","cu02rd3","cu02rd3","3gn01b"
"bryan_rothwell","mbcarl","2015-08-13 10:21:52","2015-08-13 10:21:52","2","7","I remember watching it in 2000 as well!","ctzrgok","cu11ajv","ctzv9kv"
"FatGecko5","reynardthafox","2015-08-12 08:45:47","2015-08-12 08:45:47","686","9","Those damn photons taking up residence in my skies!","ctzmqud","ctzpmzb","ctzmqud"
"joshuralize","PatyxEU","2015-08-12 17:59:04","2015-08-12 17:59:04","2","20","I've had so many dreams where an event like this was happening. It would be crazy to see for real.","cu05xm6","cu05xm6","3gn01b"
"randomcoincidences","tonycomputerguy","2015-08-12 23:15:12","2015-08-12 23:15:12","2","15","If ecstasy made me hallucinate, I'd be very upset with whoever I got it from.","ctzrgok","cu0bj3f","cu00ds0"
"ClemClem510","Light_Horizon","2015-08-12 21:16:47","2015-08-12 21:16:47","0","25","Most likely scenario : fuck all happens to the ISS and satellites. Meteoroids are generally the size of a grain of sand, and space is big.","ctzzvu8","cu08wqp","ctzzvu8"
"squishybloo","[deleted]","2015-08-13 02:22:13","2015-08-13 02:22:13","2","5","So... light is like Jello?","ctzmqud","cu0ib4e","ctzvy8e"
"t3hPoundcake","neotropic9","2015-08-12 13:01:06","2015-08-12 13:01:06","1","29","Google that shit! I remember reading an article about a proposition of creating man-made meteor showers I forget the name of the article I wish I had it saved.","ctzwmyj","ctzyofk","ctzwmyj"
"UnimaginativeJuan","FellKnight","2015-08-12 09:44:41","2015-08-12 09:44:41","67","8","I have genuinely noted that in my calender.... :-)","ctzrgok","ctzrqe1","ctzrgok"
"kiq_ass","PatyxEU","2015-08-12 13:30:31","2015-08-12 13:30:31","12","84","The best meteor I have ever seen was while camping. I was dissapointed that I was the only one to witness this because they all had their backs to it while it passed. But it was massive, with blue and red flames, it stretched the whole length of the sky and broke into pieces near the end. It was so surreal, it was huge and lit up the sky but it made no sound at all. I was blessed with a rare phenomenon! :D","ctzznsb","ctzznsb","3gn01b"
"PMMeYourPokemonTeam","mbcarl","2015-08-12 13:20:34","2015-08-12 13:20:34","23","210","I remember getting misinformation for the 2000 Leonids. I was 12 at the time and I thought it ""was going to be like Star Trek"" (going into warp), hundreds of meteors per second. I thought I'd be able to see them fall to the ground and pick them up! I told my family about this and how big it was going to be. When we finally got to this hilltop to watch, it was ""barely anything"" according to my 12-yr old self. A meteor almost once per second is actually AMAZING, even if you don't get to pick it up and all that. But I was so disappointed, and so embarrassed that I told everyone it was going to be way better than it ended up being that I just wanted to go home. (It was one of the defining moments of my disillusionment in my childhood obsession with Outer Space; I mean, even if I did become an Astronaut, I wouldn't likely be able to visit any other planets, let alone any other star systems.) Thankfully, times have changed, and at halfway to the next possible Leonid storm, I'll be able to appreciate it for what it really is. My only fear is that I'll miss an unrelated meteor storm that happens before then!","ctzrgok","ctzzc06","ctzv9kv"
"Astrosomnia","PatyxEU","2015-08-12 13:01:30","2015-08-12 13:01:30","3","40","Wow. That would be right up there with the most memorable things in your entire life. It must have been spectacular. I can imagine everyone by their little windows in awe. I'd love to go back there and experience it.","ctzyow8","ctzyow8","3gn01b"
"jeff26554","kiq_ass","2015-08-12 14:10:39","2015-08-12 14:10:39","1","48","I had a similar experience. When I was a boy, I looked up on a clear winter night and saw the bright light, smoke trail and even the sound as a meteor burnt up. It all happened in 1 or maybe 2 seconds. It was a greenish yellow light though.","ctzznsb","cu00wsi","ctzznsb"
"seanbduff","darrellbear","2015-08-12 15:01:12","2015-08-12 15:01:12","5","8","I need a visual to understand this concept.","cu00j4i","cu02bp3","cu00j4i"
"Klagoda","peteroh9","2015-08-12 14:44:08","2015-08-12 14:44:08","1","46","God, THIS. Heard it on the radio and thought I was going mad. That said, the pronunciation of Salida also throws me off, but I'd been pronouncing it Sah-LEE-dah for a good week before I learned it basically sounds like ""saliva"" with a D. Sad day.","ctzpjc2","cu01v5v","cu01m19"
"LycanicAlex","paulmclaughlin","2015-08-13 04:56:28","2015-08-13 04:56:28","1","9","Use it on people who are causing light pollution?","ctzpjc2","cu0ow43","cu05w6f"
"PeasantToPrince","GODD_JACKSON","2015-08-12 15:02:59","2015-08-12 15:02:59","9","77","I think the first time I saw the Milky Way was in Utah. It's just absolutely beautiful. There's no way to really describe it, and pictures don't have the same feeling as sitting outside and letting your eyes adjust. Your see the bright stars and famous constellations and then you start noticing more. Millions upon millions more until you realize, holy crap, that's the galaxy we live in. And all of the sudden, you feel very small.","ctzpjc2","cu02ddt","ctzz0ky"
"Tagifras","three_hands_man","2015-08-12 23:26:52","2015-08-12 23:26:52","0","8","RemindMe! 9am on October 8th, 2015 ""meteor shower tonight"".","ctzp5h7","cu0buvz","cu03kum"
"PatyxEU","LollingTrolling","2015-08-13 00:46:45","2015-08-13 00:46:45","1","57","Yes, you will definitely be able to see it if the sky is clear. The meteor shower is visible throughout the entire night, but the best time to look is just before sunrise, ~3:00-4:00. It was also visible for the previous week and will be for the week after, but with much less meteors. Peak frequency is tonight :)","cu09bq4","cu0ej6d","cu09bq4"
"AReallyBigOne","enigmamonkey","2015-08-12 20:58:47","2015-08-12 20:58:47","0","11","RemindMe! 9am on October 8th, 2015 ""Go outside tonight and look up.""","ctzp5h7","cu08m0c","ctzu7xl"
"FellKnight","PatyxEU","2015-08-12 09:36:59","2015-08-12 09:36:59","272","118","I learned about the Leonid meteor shower in the early 90s, when I first became enraptured with Astronomy, and learned that Nov 17, 1999 was supposed to be a similar magnitude to the pictured shower. I spent my entire teenaged years looking forward to it... then we had a blizzard that night and I wasn't able to see anything. I was crushed. It's a fascinating comet, because its perihelion is very close to Earth's orbit, and its orbital period is 33 years, so the major storms of the past were actually meteroids from orbits of the past (1733 caused the 1866 storm, 1966 was due to the 1866 passage of the comet, etc. The next big one, if we are very lucky, will be in November 2032.","ctzrgok","ctzrgok","3gn01b"
"LSF604","CjStaal","2015-08-12 12:17:56","2015-08-12 12:17:56","1","5","what satellite would be pressurised?","ctzr0s0","ctzx5tz","ctzwh1k"
"barruu","FlowstateFluid","2015-08-12 17:21:00","2015-08-12 17:21:00","1","11","RemindMe! 9am on October 8th, 2015 ""Go outside tonight and look up.""","ctzp5h7","cu05b3b","cu04p1w"
"Beejsterb","onFilm","2015-08-13 07:34:09","2015-08-13 07:34:09","1","13","Vancouver is always cloudy. Not the best place to watch the solar eclipse.","ctzp5h7","cu0vbu0","cu0g3q4"
"Erionns","three_hands_man","2015-08-12 21:46:28","2015-08-12 21:46:28","0","11","RemindMe! 9am on October 8th, 2015 ""Go outside tonight and look up.""","ctzp5h7","cu09ggt","cu03kum"
"Wertyujh1","charlietoday","2015-08-12 12:11:02","2015-08-12 12:11:02","7","42","As a chemistry student, he is not *wrong* .you could pack an infinite amount of photons in an indestructible box - but our universe probably isn't that, so no idea what would happen if we suddenly spawned 10^100000 photons. The energy would be huge.","ctzmqud","ctzwx5f","ctzvps4"
"MysticMoteToter","neonflannel","2015-08-12 16:10:33","2015-08-12 16:10:33","2","45","I'd think burning plastics and such is much worse than setting off 60 tons of fireworks in America. I'd bet America makes more than 60 tons of trash altogether every week or so. Idk I think recycling and biodegradable trash is the only way with our population","ctzr0s0","cu03yst","ctzyrjm"
