"source", "destination", "startingTime", "finishingTime", "score", "size", "message", "thread", "href", "parent"
"[deleted]","Redditacious","2015-08-13 03:03:18","2015-08-13 03:03:18","2","1","[deleted]","ctzmqud","cu0k0u9","cu03zx9"
"CatsAreGods","PMMeYourPokemonTeam","2015-08-13 09:19:19","2015-08-13 09:19:19","0","26","&gt; I was 12 at the time and I thought it ""was going to be like Star Trek"" (going into warp) Er, you're thinking of Star Wars, dude.","ctzrgok","cu0z5vl","ctzzc06"
"NekoMimiMode","three_hands_man","2015-08-12 22:20:03","2015-08-12 22:20:03","0","11","RemindMe! 9am on October 8th, 2015 ""Go outside tonight and look up.""","ctzp5h7","cu0a58v","cu03kum"
"Diabloviro","jwaldo","2015-08-12 15:07:05","2015-08-12 15:07:05","3","18","I saw it too, from a peak of a mountain north of Santa Cruz. Life changing it was!","ctzyouq","cu02h83","ctzyouq"
"PICS_ND_SHIT","wrath_of_grunge","2015-08-13 00:35:06","2015-08-13 00:35:06","2","5","Pollution that hits the gym","ctzmqud","cu0e428","cu06dg1"
"sheepinabowl","three_hands_man","2015-08-12 23:30:37","2015-08-12 23:30:37","0","9","RemindMe! 9am on October 8th, 2015 ""draconoid meteor shower tonight!!""","ctzp5h7","cu0byvy","cu03kum"
"PM_ME_UR_FAPS","Quetzal_Pretzel","2015-08-12 15:56:41","2015-08-12 15:56:41","1","36","IIRC Perseids actually occur for a whole month. From mid July to mid August. It just happens that this week is the best chance to see them and the peak is this Thursday in the AM.","cu03bz1","cu03o5x","cu03bz1"
"[deleted]","GODD_JACKSON","2015-08-12 13:21:05","2015-08-12 13:21:05","-7","1","[deleted]","ctzpjc2","ctzzckz","ctzz0ky"
"pdxsean","CjStaal","2015-08-12 11:54:51","2015-08-12 11:54:51","2","108","Hmm, how is it that we don't have satellites being destroyed left and right? Considering that we are constantly passing through space dust, you'd think we'd lose a few a year. OTOH maybe we do and it's not really like it's newsworthy or anything. Trying to research the danger doesn't really give any reliable hits - plenty of speculation and Yahoo Answers but nothing I trust - although [this article] (http://news.stanford.edu/news/2013/february/space-dust-threat-022613.html) from Stanford University does indicate that the real answer is halfway between what each of us are saying. Space Dust doesn't destroy satellites, but over time it can have a cumulative effect that can damage and eventually incapacitate them.","ctzr0s0","ctzwcpy","ctzuz0p"
"Matt872000","green-bean-fiend","2015-08-13 15:00:12","2015-08-13 15:00:12","1","11","RemindMe! 8am on October 8, 2015 ""Meteor shower tonight! Go watch it fool!""","ctzp5h7","cu19y37","cu0764j"
"CreamOfTheClop","[deleted]","2015-08-12 14:36:43","2015-08-12 14:36:43","1","7","I've got a theoretical degree in physics.","ctzoq88","cu01nwh","ctzuism"
"AccioMotherfucker","FlipStik","2015-08-12 16:14:26","2015-08-12 16:14:26","1","130","I enjoy writing and I have been looking for a way to turn this idea into a short story. This is an idea I've had for a looooooong time and it's so cool to think about, but I really don't have a way to put it into words. Its something I enjoy working on because it's so challenging. Also, every particle has a u universe inside of it. Black holes shouldn't exist. But they do. They're gateways to other universes. You know how the big bang started from a singularity? There's a singularity at the center of every black hole. So what if inside every black hole a New universe is exploding, and inside those they are etc etc. The working title for my story is this, and I really like it. Infinite Recursion","ctzrgok","cu041pb","cu03w5t"
"0thatguy","SexyMrSkeltal","2015-08-12 20:59:45","2015-08-12 20:59:45","1","6","Yes, assuming there are clear skies.","cu05eqs","cu08ml7","cu05eqs"
"BigClifty","mbcarl","2015-08-12 14:07:30","2015-08-12 14:07:30","35","11","I hope Jupiter sees that super-sad emoticon. Look what he did.","ctzrgok","cu00tby","ctzv9kv"
"GODD_JACKSON","-kindakrazy-","2015-08-12 13:11:04","2015-08-12 13:11:04","191","31","currently on vacation in Buena Vista, CO--no light pollution. I saw the Milky Way for the first time in my life a few nights ago. I felt like I saw god","ctzpjc2","ctzz0ky","ctzws2k"
"Goliath_Gamer","enigmamonkey","2015-08-12 15:56:05","2015-08-12 15:56:05","1","5","Woah wait that's my birthday!","ctzp5h7","cu03no1","ctzu7xl"
"EnvidiaProductions","[deleted]","2015-08-12 11:57:25","2015-08-12 11:57:25","2","13","Same, except I still feel that way. I think it's beautiful, but terrifying.","ctzoq88","ctzwfy9","ctzuism"
"CjStaal","pdxsean","2015-08-12 11:58:16","2015-08-12 11:58:16","-1","60","Something the size of a grain of sand can in fact take out a satellite. http://www.sciencedirect.com/science/article/pii/S0273117709006838 ""Pressure vessels are especially susceptible to hypervelocity impacts when no protection is available from the satellite itself. Even small particles in the mm size range can lead to a fatal burst or rupture of a tank when impacting with a typical collision velocity of 10â€“20 km/s.""","ctzr0s0","ctzwh1k","ctzwcpy"
"PatyxEU","[deleted]","2015-08-12 23:34:26","2015-08-12 23:34:26","1","21","You're in luck - tonight the biggest meteor shower of 2015 will occur. Get a comfy chair and look up in the sky :)","cu07lz0","cu0c333","cu07lz0"
"FellKnight","AccioMotherfucker","2015-08-12 12:52:22","2015-08-12 12:52:22","8","36","Every 33 years is a large shower, but from what I've read, if the moon is in a certain part of its orbit, it will deflect a bunch of meteroids into the atmosphere, causing a full ""storm""","ctzrgok","ctzydjp","ctzxzad"
"scootymcpuff","passwordsarehard_3","2015-08-12 12:48:37","2015-08-12 12:48:37","16","17","Ok. I concede that point. Would indeed shit pants if confronted with 100,000 bolts of lightning an hour.","ctzoq88","ctzy8v5","ctzs6rb"
"McMurphyCrazy","GODD_JACKSON","2015-08-12 13:34:44","2015-08-12 13:34:44","1","32","WE WERE MEANT TO COMMENT ON THIS TOGETHER lol, I'm up north of you in Shreveport. But fuck yeah man, I'm gonna try to catch some of it myself here in a bit.","ctzpjc2","ctzzsrp","ctzzovk"
"asralyn","stunna006","2015-08-12 15:20:33","2015-08-12 15:20:33","1","6","where you at in LA boo?","ctzpjc2","cu02t9q","cu01lrf"
"ChrisAshtear","McMurphyCrazy","2015-08-12 14:12:10","2015-08-12 14:12:10","1","40","you can see it sailing off the coast as well. I saw some really nice night skies on my trip to nantucket and back. And theres bio-luminescent plankton that light up the water when you pass through it. Really cool.","ctzpjc2","cu00yfi","ctzzhz2"
"supercharv","FellKnight","2015-08-13 08:13:36","2015-08-13 08:13:36","1","79","&gt; It's a fascinating comet, because its perihelion is very close to Earth's orbit, and its orbital period is 33 years, so the major storms of the past were actually meteroids from orbits of the past (1733 caused the 1866 storm, 1966 was due to the 1866 passage of the comet, etc. storm as in meteors or storm as in it somehow affects weather... admittidly writing this out the answear seems to be obviously meteors..but hey, clarification? I don't quite get how 1733 causes the 1866 storm?","ctzrgok","cu0wtpg","ctzrgok"
"Lacey_Von_Stringer","BigClifty","2015-08-12 16:06:27","2015-08-12 16:06:27","14","12","He said he was sorry. He's just a poor, big, clumsy planet.","ctzrgok","cu03vqg","cu00tby"
"quantumvote","best_of_badgers","2015-08-12 21:01:32","2015-08-12 21:01:32","2","47","I guess information also spread very differently in the 1880s, and not many scientific information reached the public, besides education being very limited as well.. My statement was just jokishly, but now I'm actually quite curious as to what the people thought about this storm at that time!","ctzpjc2","cu08nlf","cu02245"
"benzabs","GODD_JACKSON","2015-08-12 21:37:48","2015-08-12 21:37:48","1","8","Top of Mt Massive is a magical place.","ctzpjc2","cu09ahs","cu02y4c"
"[deleted]","wakeupwill","2015-08-12 11:03:42","2015-08-12 11:03:42","5","45","As a kid the night sky used to terrify me since I had basic grasp on the idea that it was truly without end and I was a mere a quark in an entire universe. Talk about feeling insignificant. I should've been a theoretical physicist.","ctzoq88","ctzuism","ctzskxq"
"Newbsaccount","scootymcpuff","2015-08-12 10:31:51","2015-08-12 10:31:51","10","18","While I appreciate your faith in humanity, in this case you're incorrect. People freaked the fuck out. http://blog.al.com/birmingham-news-stories/2009/11/meteor_storm_muse_behind_stars.html","ctzoq88","ctztdyq","ctzp5u5"
"passwordsarehard_3","scootymcpuff","2015-08-12 09:57:41","2015-08-12 09:57:41","71","28","I understand that lightning is a naturally occurring phenomenon but if I seen 100,000 bolts an hour it would make me start wondering if I was seeing the end","ctzoq88","ctzs6rb","ctzp5u5"
"scrotalimplosion","gurg2k1","2015-08-13 07:06:15","2015-08-13 07:06:15","1","8","I always accept the thank you hugs too","ctzp5h7","cu0u8rc","cu0fp11"
"LCDXX","FlowstateFluid","2015-08-12 22:51:59","2015-08-12 22:51:59","0","9","RemindMe! 9pm on October 7, 2015 ""Meteor shower tonight, take cover!""","ctzp5h7","cu0awq8","cu04p1w"
"pizzahippie","FellKnight","2015-08-12 12:16:07","2015-08-12 12:16:07","7","4","November 17 is my birthday!","ctzrgok","ctzx3jh","ctzrgok"
"Redditacious","reckoner15","2015-08-12 16:08:38","2015-08-12 16:08:38","2","3","rather simple, antimatter. Maths: PB+J=NOM","ctzmqud","cu03xd1","cu03r85"
"Silverlight42","Smauler","2015-08-12 13:26:32","2015-08-12 13:26:32","3","58","no no, I just meant more like the ones in the belt that get pelted across our path every now and then causing these showers. I wasn't completely serious, as I know there's huge amounts up there. I just wanted to know what caused the crazy thousand/hr numbers as opposed to the regular 100/hr showers we usually get.","ctzp5h7","ctzzj3f","ctzybyw"
"TheonlyGirrafe","PatyxEU","2015-08-12 21:36:43","2015-08-12 21:36:43","0","12","RemindMe! 9am on october 8th, 2015 ""go outside and look at fucking riods.""","cu099rs","cu099rs","3gn01b"
"Irorak","-kindakrazy-","2015-08-12 15:07:57","2015-08-12 15:07:57","1","79","The air pollution during most of the 1800's was worse than it is today in most of America. We went through our industrial revolution then like China or India is today. There were a ridiculous amount of coal burning factories and 0 disregard for the environment (mostly because they didn't know the impact they were making). 1830's might be a little bit before the revolution but probably starting from the 1700's and back the pollution would be little to none.","ctzpjc2","cu02i14","ctzws2k"
"re-verse","FellKnight","2015-08-12 13:42:20","2015-08-12 13:42:20","3","25","I saw the 2000 ones, living in a tiny town at high altitude in the rocky mountains. One of the most amazing moments of my life.","ctzrgok","cu001dw","ctzrgok"
"GODD_JACKSON","peteroh9","2015-08-12 14:39:47","2015-08-12 14:39:47","2","16","hahaha. I'm pretty sure they're just all in on the joke to fuck with tourists. BYOONUH","ctzpjc2","cu01qvm","cu01m19"
"PhatNornangles","FlowstateFluid","2015-08-12 20:24:02","2015-08-12 20:24:02","6","16","RemindMe! 8am on October 8, 2015 ""Meteor shower tonight! Go outside for once you lazy piece of shit""","ctzp5h7","cu0831o","cu04p1w"
"PBRBeer","reynardthafox","2015-08-12 15:18:33","2015-08-12 15:18:33","6","28","Imagine how scary it would be for the average Joe public who didn't have a great understanding of the event. It would literally be the sky is falling.","ctzmqud","cu02rjb","ctzmqud"
"Lokabf3","mbcarl","2015-08-12 23:00:02","2015-08-12 23:00:02","1","42","It's only best because it happens in the summer months, so it's easy to be outside late and have good weather. The Leonids in November are often better, but it's cold and more often cloudy so you don't always get to see them.","ctzrgok","cu0b47c","ctzvdn3"
"Dawknight","PatyxEU","2015-08-13 01:43:42","2015-08-13 01:43:42","1","19","I heard that people said it was like if the sky was snowing... Must have been amazing to see.","cu0gqsy","cu0gqsy","3gn01b"
"SquirtleSpaceProgram","1ReviewReviewer1","2015-08-12 13:15:22","2015-08-12 13:15:22","17","14","This is, by a wide margin, the least likely thing that has ever happened.","ctzpjc2","ctzz5um","ctzy3am"
"TongueDartTheFartB0x","PatyxEU","2015-08-12 12:53:04","2015-08-12 12:53:04","3","18","guess I could see why people would freakout so much about it if it was really that intense","ctzyedy","ctzyedy","3gn01b"
"Fellhuhn","[deleted]","2015-08-12 14:41:07","2015-08-12 14:41:07","1","15","Painting? And I sit here and think they had shitty smartphone cameras back then. :D ;)","ctztfm8","cu01s7l","ctzwhlm"
"SagebrushID","moeburn","2015-08-12 13:43:03","2015-08-12 13:43:03","1","13","If was November (really cold), it might have been the Leonid Storm of 2001.","ctzx7ia","cu00273","ctzx7ia"
"gonthrax","Corumain_Duvantar","2015-08-12 11:15:05","2015-08-12 11:15:05","8","54","This is true. I grew up in Kentucky, USA where the Milky Way was very visible and we even saw aurora some winter nights. I was working in FL last year and we stayed in a B&amp;B where you could faintly see the Milky Way and one of my co-workers wondered what it was.","ctzu0cv","ctzuxi7","ctzu0cv"
"green-bean-fiend","enigmamonkey","2015-08-12 19:19:48","2015-08-12 19:19:48","1","22","&gt; RemindMe! 8am on October 8, 2015 ""Meteor shower tonight! Go watch it fool!"" RemindMe! 8am on October 8, 2015 ""Meteor shower tonight! Go watch it fool!""","ctzp5h7","cu0764j","ctzu7xl"
"SlowRollingBoil","PBRBeer","2015-08-12 23:42:58","2015-08-12 23:42:58","1","22","Depends on who they worshiped, I guess. I imagine that polytheists would just think it's a beautiful display from some sky/night God.","ctzmqud","cu0cciy","cu02rjb"
"[deleted]","PatyxEU","2015-08-12 19:50:52","2015-08-12 19:50:52","1","1","[removed]","cu07lz0","cu07lz0","3gn01b"
"twojaguars","eigenvectorseven","2015-08-12 13:53:31","2015-08-12 13:53:31","11","5","First page of Blood Meridian.","ctzuwm7","cu00dtm","ctzzxke"
"Ressotami","tdawg4rul","2015-08-12 09:43:45","2015-08-12 09:43:45","51","14","Significantly more dangerous. ....but still a pretty remote chance of impact. Space is big.","ctzr0s0","ctzrp70","ctzr0s0"
"Treebeezy","FellKnight","2015-08-12 12:06:28","2015-08-12 12:06:28","3","9","The Jupiter interaction should affect the Perseids next year","ctzrgok","ctzwrbc","ctzveg0"
"SpliffordTheDog","enigmamonkey","2015-08-12 16:10:32","2015-08-12 16:10:32","1","10","RemindMe! 12pm on October 8th, 2015 ""Go watch the meteor shower""","ctzp5h7","cu03ysb","ctzu7xl"
"Corumain_Duvantar","PatyxEU","2015-08-12 10:49:13","2015-08-12 10:49:13","7","41","Little easier to spot meteors in an age where light pollution isn't as out of control as it is now. Hell, I bet most people who have lived their whole lives in the big city have never seen ""The Backbone of Night"".","ctzu0cv","ctzu0cv","3gn01b"
"TheCurseOfEvilTim","reddittrees2","2015-08-13 13:38:05","2015-08-13 13:38:05","1","6","A screwdriver is a scientific instrument?","ctzmqud","cu17p5d","cu077dl"
"iammrsbug","PatyxEU","2015-11-20 08:07:52","2015-11-20 08:07:52","2","26","I watched the Perseids and I think I saw one burning up in the atmosphere. It left a bright orange fire trail behind it. So cool!","cx6538f","cx6538f","3gn01b"
"Dewy_Wanna_Go_There","WazWaz","2015-08-12 23:06:29","2015-08-12 23:06:29","2","9","You're saying they didn't know what stars were now?","ctzpjc2","cu0bah4","cu0b3kv"
"greatunknownpub","AnotherThroneAway","2015-08-12 15:53:24","2015-08-12 15:53:24","11","8","That's good; there shouldn't be any light pollution.","ctzrgok","cu03lgg","ctzzqfo"
"WazWaz","Dewy_Wanna_Go_There","2015-08-12 22:39:43","2015-08-12 22:39:43","1","27","Sure... since they fell to earth. They're a rock in the sky. Non-shooting stars on the other hand, took a little longer. Those nebulous ones even longer.","ctzpjc2","cu0allg","cu069ud"
"812many","-kindakrazy-","2015-08-12 18:33:32","2015-08-12 18:33:32","1","21","It's still out there, you just need to go far enough from you city. The Milky Way is still out there!","ctzpjc2","cu06guw","ctzws2k"
"grinkfloor","-kindakrazy-","2015-08-13 07:57:30","2015-08-13 07:57:30","1","39","I can see the milky way fairly often where I live, in the Netherlands. girlfriend is visiting from Florida and it surprised me to find out some people don't see this many stars when they look up at night.","ctzpjc2","cu0w858","ctzws2k"
"745_Gucci_Interior","Goliath_Gamer","2015-08-12 20:13:43","2015-08-12 20:13:43","2","11","RemindMe! 9am on October 8th, 2015 ""Go outside tonight and look up.""","ctzp5h7","cu07xkl","cu03no1"
"IAmTheNight2014","PatyxEU","2015-08-12 15:21:07","2015-08-12 15:21:07","2","49","If it wasn't for all of the light pollution, we'd probably be able to see the same amount of stars as in this drawing. Maybe they should turn off all the power in a town or city for the meteor shower, but just for an hour or so, no more.","cu02tsk","cu02tsk","3gn01b"
"GODD_JACKSON","theonlycanvas","2015-08-12 16:47:46","2015-08-12 16:47:46","2","13","it'll be peaking for another two nights, hope it clears up for you","ctzpjc2","cu04pd5","cu03w54"
"AccioMotherfucker","FellKnight","2015-08-12 12:54:02","2015-08-12 12:54:02","8","16","Oh okay that makes more sense. The universe is crazy and we're lucky we even exist.","ctzrgok","ctzyfjb","ctzydjp"
"Aspy343","mmmkunz","2015-08-13 10:22:24","2015-08-13 10:22:24","1","28","In a perfect vacuum without worrying about edges nearby, could you have an infinite number of photons crossing the same point at the same time, and nothing happen?","ctzmqud","cu11b71","ctztqne"
"EroticBurrito","wrath_of_grunge","2015-08-17 02:45:07","2015-08-17 02:45:07","2","10","OP said 'light population', I only realised on second reading..","ctzmqud","cu4ymm1","cu06dg1"
"ParanoidDennis","Gylergin","2015-08-12 20:08:01","2015-08-12 20:08:01","2","8","I call dibs on the band name *Kugelblitz*","ctzmqud","cu07ujn","ctzydfw"
"Vinkarus","-kindakrazy-","2015-08-12 12:30:14","2015-08-12 12:30:14","15","22","It definitely feels like something is missing when you aren't able to witness many events in the night sky because of this.","ctzpjc2","ctzxljd","ctzws2k"
"Bullinger","bonkus","2015-08-13 02:08:54","2015-08-13 02:08:54","1","9","RemindMe! 8am on October 8, 2015 ""Meteor shower tonight! Go watch!""","ctzp5h7","cu0hrst","cu0b64l"
"COMPLIMENT-4-U","crazypond","2015-08-12 16:56:34","2015-08-12 16:56:34","2","11","RemindMe! 4pm on October 8th, 2015 ""Go outside tonight and look up.""","ctzp5h7","cu04vbw","cu042xg"
"SovreignTripod","TheSystem_IsDown","2015-08-12 13:07:32","2015-08-12 13:07:32","1","20","CP violation? What's CP in this context? And what so you mean about an advanced being creating the big bang?","ctzmqud","ctzyw8i","ctzxl3w"
"[deleted]","PatyxEU","2015-08-12 13:27:09","2015-08-12 13:27:09","1","1","[removed]","ctzzju0","ctzzju0","3gn01b"
"HookLogan","PatyxEU","2015-08-12 17:50:09","2015-08-12 17:50:09","2","14","Is light pollution a cause of why we don't have storms like this anymore?","cu05sh2","cu05sh2","3gn01b"
"JourneymanWelder","reynardthafox","2015-08-12 13:35:50","2015-08-12 13:35:50","0","19","i could easily imagine how they could be fooled to thinking they were aliens or angels. nope just rocks.","ctzmqud","ctzzu1d","ctzmqud"
"scootymcpuff","lonebrew","2015-08-12 08:32:37","2015-08-12 08:32:37","107","192","I think the opposite, actually. The idea that heavenly events were natural phenomena had already been well-established by the middle of the 19th century. Now, did they know that it was caused by comet debris? Probably not, but I feel like most people had a general understanding that what they were seeing every year was a natural and regular event, even if they had no solid scientific reason as to *why* it was happening. Never underestimate the intelligence of past peoples. We're every bit as intelligent as they were, we just have many more centuries of knowledge to build on. :) Edit: I managed to find some first-hand accounts [published in 1833](http://www.biodiversitylibrary.org/page/30964366#page/383/mode/1up) and indeed, Revelations was mentioned more than once. However, the general feeling I got was ""shaken and awestruck"" rather than ""freaking the fuck out"". Admittedly, a majority of the accounts in the paper were from academics, which means scientific thinking was more prominent. I can understand how people now may think that people in the past thought it was the end of the world, but I still like to hold onto the idea that human intelligence triumphs over fear in the end. :)","ctzoq88","ctzp5u5","ctzoq88"
"IoncehadafourLbPoop","Beejsterb","2015-08-13 00:00:25","2015-08-13 00:00:25","6","14","It's been cloudy all summer ever since I bought a telescope. Fuck me right?","ctzp5h7","cu0cwp7","cu07e5x"
"Light_Horizon","ClemClem510","2015-08-19 11:17:18","2015-08-19 11:17:18","1","63","The old space shuttles have been hit by micro meteoroids including the windows. They were built to withstand the odd strike, but they are often grouped together from previous collisions that made them so small to begin with. A grain of sand traveling 5 to 10 miles per second is nothing to scoff at. I don't care what the odds are. Collisions have happened before.","ctzzvu8","cu7qvqs","cu08wqp"
"Seesawkarma","three_hands_man","2015-08-12 18:59:40","2015-08-12 18:59:40","0","11","RemindMe! 9am on October 8th, 2015 ""Go outside tonight and look up.""","ctzp5h7","cu06v86","cu03kum"
"best_of_badgers","quantumvote","2015-08-12 22:17:57","2015-08-12 22:17:57","3","320","Edit: Reading comprehension is also important. I read this as 1883 and not 1833. Either way, read all of the below as ""about to happen"", which all requires some sort of education and knowledge of the world. 1833 wasn't quite the Victorian era, but it was close. I'm not sure what the literacy rate was at the time, but this is well into the era of widely distributed daily or twice-daily newspapers. London alone had like 12. There was a large middle class in 1880 (and had been for like 300 years), so it's not like the categories were still ""peasant"" and ""educated rich"". Remember, this was 40-50 years into the European industrial revolution and 200 years into the Enlightenment. Most farming was mechanized, steam power was everywhere all the time, and England was already running out of indigenous coal. On the American side, it was 20 years after the civil war. States were already passing laws against child labor and then mandating some amount of compulsory public education to do something with all those now-idle kids. This is only 15 years before Einstein developed the theory of relativity, and I believe Maxwell had already published his electromagnetic equations (which we still use). It's also half a decade before cars, and 15 years before practical flight. High quality, publicly accessible photography had been around for a decade or so at this point. Darwin published his theory in 1859, and geologists knew the world is many millions of years old for decades before that. They didn't know about radiation, which is what heats the core, so their model based on the cooling of a mass the size of the earth put it at ~80 million years. (Lord Kelvin was vehemently in favor of this age. You can guess what's named after him.) A few years later, the 1890s, pundits worried that everything scientific had been discovered and so there would be no further revolutionary advancement of society. How wrong they were! So yeah. Sense of time is important.","ctzpjc2","cu0a3ld","cu08nlf"
"GODD_JACKSON","idontknowwhattosay-","2015-08-12 15:32:52","2015-08-12 15:32:52","1","25","I didn't know you could see it with the naked eye until I walked out onto the deck 3 days ago. gonna stay with me forever","ctzpjc2","cu0344a","cu02s1l"
"1994bmw","dommu","2015-08-12 12:37:25","2015-08-12 12:37:25","6","7","I was hoping someone would mention this.","ctzuwm7","ctzxunt","ctzuwm7"
"neonflannel","Brodins_Hammer","2015-08-12 11:14:17","2015-08-12 11:14:17","8","42","You just blew my mind. I think you just predicted the future. This sounds like something that might happen in the next 50 years. I mean, why not? Space stations drop off trash or debris and it becomes a yearly observance. Fuck,,,who knows?","ctzr0s0","ctzuwgf","ctzufd5"
"imperabo","mbcarl","2015-08-12 13:00:52","2015-08-12 13:00:52","2","29","I remember it well. Almost a constant flow of small meteors with the occasional one so bright it lit up the ground. Never thought I see something like that.","ctzrgok","ctzyo4f","ctzv9kv"
"KuronX","Silverlight42","2015-08-12 18:06:08","2015-08-12 18:06:08","4","62","The meteorites in these showers actually don't come from the asteroid belt. It's actually debris from a comet. Earth is basically passing through a path that a comet took on its way toward the inner solar system. The showers get smaller over time simply because all that material spreads out or just gets incinerated in our atmosphere when we pass through it.","ctzp5h7","cu061ne","ctzzj3f"
"Robinisthemother","FlowstateFluid","2015-08-12 19:17:36","2015-08-12 19:17:36","0","11","RemindMe! 8am on October 8, 2015 ""Meteor shower tonight! Go watch it fool!""","ctzp5h7","cu074yz","cu04p1w"
"jihadcw","tjlampe","2015-08-12 12:12:31","2015-08-12 12:12:31","-5","4","Seen? yes. Existing? no.","ctzp5h7","ctzwz21","ctzw79q"
