"source", "destination", "startingTime", "finishingTime", "score", "size", "message", "thread", "href", "parent"
"sportsziggy","sand500","2015-08-14 14:01:24","2015-08-14 14:01:24","1","9","It is native on the LG G4 stock camera.","cu1u6tg","cu2fju3","cu2fg2l"
"troyaner","Pravus_Belua","2015-08-14 09:30:24","2015-08-14 09:30:24","3","15","OMG! is the Milky Way ok, where was he hit? did they catch the shooter?","cu25vn7","cu26jvf","cu25vn7"
"hueythecat","Colonel_Swaggot","2015-08-14 18:56:35","2015-08-14 18:56:35","8","14","Not to the human eye. These are always good optics with 30ish seconds exposures.","cu1uaaz","cu2lfbq","cu2ko65"
"CARmakazie","cityterrace","2015-08-14 12:44:35","2015-08-14 12:44:35","1","29","That's what I'm using. It's fine. ISO to 1600, 20-30 seconds, stock lens. Works great. It's not idea but don't drop a couple hundred bucks thinking what you have won't work.","cu1u6tg","cu2d4re","cu238pw"
"DrColdReality","lasercat13","2015-08-14 11:17:54","2015-08-14 11:17:54","3","47","&gt; That looks like a meteor, not an airplane track. Nope. Look at the full-size image. See the line of little dots threaded along the track? That's the aircraft's strobe light. I've had more than enough airplanes fly through my shots, I knows em when I sees em.","cu1u6tg","cu2a6mm","cu28px9"
"fenton7","boyyouguysaredumb","2015-08-14 13:00:02","2015-08-14 13:00:02","29","18","You would have to wait about 60,000 years for a photon to bounce back and make the round trip","cu1waxc","cu2dn3d","cu2bpuj"
"rcallen7957","fenton7","2015-08-14 13:14:38","2015-08-14 13:14:38","5","5","Thanks for the assisted epiphany...","cu1waxc","cu2e4jx","cu2dn3d"
"neilson241","Bbsloths","2015-08-14 18:53:59","2015-08-14 18:53:59","2","6","Not this colorful/vibrant, but yes, absolutely.","cu28ma2","cu2le1l","cu28ma2"
"nitramlondon","Akriax","2015-08-14 21:41:44","2015-08-14 21:41:44","1","20","Still remember the first time I saw the Milky Way a few years back in Northern Ireland, just mind blowing.","cu2nyri","cu2nyri","3gvgnb"
"Twizzler____","neilson241","2015-08-15 03:11:24","2015-08-15 03:11:24","1","29","So the way i'm thinking of it happening is....instead of the shutter blinking, it takes 10-90s for it to close?, i understand know. thank you for the information man.","cu2i2ai","cu2yrub","cu2ljhn"
"KaptainCapture","flamebird3","2015-08-14 09:25:35","2015-08-14 09:25:35","3","10","On iOS SkyGuide is my personal favorite. Works without service.","cu1xzuk","cu26e4h","cu245rk"
"[deleted]","Dsiroon37","2015-08-14 09:31:02","2015-08-14 09:31:02","13","41","I think it was a joke as in... You're always looking at the milky way, you're in it. But yes I know what you mean, I love in London and I'm lucky to see 2 stars on a clear night, it's depressing","cu1uaaz","cu26kkh","cu2558g"
"salgat","GameBreak","2015-08-14 11:57:47","2015-08-14 11:57:47","8","10","Sadly nothing this bright exists without exposure on a camera/film.","cu1waxc","cu2bjyh","cu295mg"
"MelissaKat","wmlloydfloyd","2015-08-14 07:14:10","2015-08-14 07:14:10","0","8","Yes ant to know where this is too!!","cu1waxc","cu21pe6","cu1waxc"
"gentlemanlife","Akriax","2015-08-14 11:21:26","2015-08-14 11:21:26","1","23","Probably one of the nicest pictures that I've seen in a long time. It gives you the urge to reflect back on life.","cu2aaur","cu2aaur","3gvgnb"
"a15yearold","Akriax","2015-08-15 01:16:39","2015-08-15 01:16:39","1","21","I hope you don't mind but this is now my phones lock screen and overall everything background. Thank you so much.","cu2u8om","cu2u8om","3gvgnb"
"jjhooch","Akriax","2015-08-14 09:22:49","2015-08-14 09:22:49","1","28","Would you be willing to share your setup that you used to do this? I have a Canon SL1 and would love to know what else I need.","cu26arg","cu26arg","3gvgnb"
"bphase","camnez1","2015-08-14 13:49:34","2015-08-14 13:49:34","2","22","Yes, but not this amazingly. No light pollution, right conditions and letting your eyes adjust will allow you to see it though.","cu1uaaz","cu2f7ap","cu2d7x2"
"AtomicSkylark","GiantMTMilo","2015-08-14 04:14:12","2015-08-14 04:14:12","9","28","Cause you need a camera that can do a long exposure and not an instant shot from a phone. Even pro cameras can't get this from a snapshot.","cu1u6tg","cu1ubgq","cu1u6tg"
"subtech7","Akriax","2015-08-14 23:40:59","2015-08-14 23:40:59","1","13","I dunno. I feel like it is missing something...like wolves or laser cats.","cu2qwkt","cu2qwkt","3gvgnb"
"SomeGuyInNewZealand","[deleted]","2015-08-14 11:25:51","2015-08-14 11:25:51","4","30","I had some friends from Brighton here in January. Took them out sightseeing one evening, once it got dark they were astounded at the night sky here in new zealand","cu1uaaz","cu2ag71","cu26kkh"
"anonymates","Akriax","2015-08-14 19:10:18","2015-08-14 19:10:18","1","30","So beautiful. A sudden jolt to the reality of the polluted city I live in. The only thing I see when I look up at the sky are smoky clouds.","cu2lmps","cu2lmps","3gvgnb"
"vlttt420","DrColdReality","2015-08-15 01:01:00","2015-08-15 01:01:00","1","37","The focal length has more to do with the stars moving, if it's at 18mm you can get away with a good 40 second exposure, but at 55mm it's going to look like the stars moved a lot.","cu1u6tg","cu2tnkh","cu1x3rb"
"Akriax","SammyYO","2015-08-14 14:04:10","2015-08-14 14:04:10","1","19","Right on I'm over that way quite a bit photographing. Have you seen my Cannon Beach Milky Shot? [Here](http://imgur.com/a8deGzU)","cu1waxc","cu2fmu2","cu2fj3k"
"DenebVegaAltair","GiantMTMilo","2015-08-14 04:34:12","2015-08-14 04:34:12","3","17","Almost any DSLR would work. Popular ones seem to be the Nikon D5100 and the Canon T3i.","cu1u6tg","cu1v5hu","cu1v2sj"
"OmitsWordsByAccident","greywindow","2015-08-17 03:15:50","2015-08-17 03:15:50","2","72","&gt; NASA estimates that the Milky Way is between 100,000 – 120,000 light-years in diameter – though some information suggests it may be as much as 150,000 – 180,000 light-years across. &gt; &gt; When it is dark enough, and conditions are clear, the dusty ring of the Milky Way can certainly be discerned in the night sky. However, we can still only see **about 6,000 light years** into the disk with the naked eye, and relying on the visible spectrum. -- http://www.universetoday.com/120006/why-cant-we-see-the-center-of-the-milky-way/","cu24pn2","cu4zn8l","cu24pn2"
"neihuffda","cmperry51","2015-08-15 19:38:49","2015-08-15 19:38:49","1","64","In other words: Each flash is still exposed for the same amount of time. Now, if a flashing point of light is stationary, the point will seem to be as bright as the sum of each flash, up until the point has burned itself out on the image. If a flashing point is moving, however, you'll end up with a trail of light points.","cu2ivw6","cu3rl7q","cu2ympi"
"phils53","Akriax","2015-08-15 00:50:57","2015-08-15 00:50:57","1","20","awesome of all the things I have learned to like about reddit , it is the photography I look at earthporn every day","cu2tadv","cu2tadv","3gvgnb"
"KaptainCapture","OhnOshieDidnt77","2015-08-14 07:13:59","2015-08-14 07:13:59","1","14","Not necessarily but definitely helps. Most milky shots that you see DONT use trackers.","cu217n5","cu21p4h","cu217n5"
"loosenho666","Akriax","2015-08-14 21:20:35","2015-08-14 21:20:35","1","22","Would love to do one of these one day. How did you know where you needed to compose to get this shot??","cu2nl4a","cu2nl4a","3gvgnb"
"Kikariska","Manavj36","2015-08-14 10:05:20","2015-08-14 10:05:20","1","18","Must be long exposure. Theres what seems to be lights of a plane or something on the left.","cu2783h","cu27qkk","cu2783h"
"[deleted]","SomeGuyInNewZealand","2015-08-14 19:57:55","2015-08-14 19:57:55","2","29","Yeah a few of my friends went to New Zealand and couldn't believe it. It's really pretty sad nobody gets to see what the sky really looks like anymore","cu1uaaz","cu2mbjx","cu2ag71"
"careless25","[deleted]","2015-08-14 15:30:39","2015-08-14 15:30:39","1","71","Yeah, I had to replace my Nexus4 which crapped out on me and got the G4. Hadn't looked at any reviews or anything since I was planning to get the new flagships being released by Google(Alphabet?) soon. But now, I might just keep the G4. Love the screen size and the camera is just awesome (I have an old DSLR Canon XTi and the G4 is basically on par with it).","cu1u6tg","cu2hu9a","cu2hqjr"
"flamebird3","oh_lord","2015-08-14 22:25:29","2015-08-14 22:25:29","1","11","Thank you so much! I'll be sure to try it out :)","cu1xzuk","cu2ovec","cu29xcv"
"iplaygaem","DrColdReality","2015-08-14 10:30:04","2015-08-14 10:30:04","2","118","I took a nightlapse with my GoPro night before last for the Perseid Meteor Shower. I used automatic settings, but did force it to a 30 second exposure time. The only metadata I can find for the photos it took is: Shot: 30000000/1000000 f/2.8 3mm I've done a bit of Googling and can recognize the aperture, but what is the 3mm measurement? I suppose the first number is the number of microsecords for the exposure? Does the second value relate to the ISO? [Video link](https://www.youtube.com/watch?v=YilEW6bl_mo), if you're curious. Actually turned out okay, I suppose - considering the GoPro won't shoot in RAW, so I lost quality taking the photo, stitching the timelapse, and on the final edit as well. https://www.youtube.com/watch?v=YilEW6bl_mo","cu1u6tg","cu28koo","cu1x3rb"
"texacolives","Akriax","2015-08-15 01:43:49","2015-08-15 01:43:49","1","25","This is literally one of the prettiest pictures I've ever seen. If I had a bigger copy, I would set it as my background haha.","cu2va9a","cu2va9a","3gvgnb"
"careless25","iplaygaem","2015-08-14 13:47:31","2015-08-14 13:47:31","3","98","Second number is the [f-stop](https://en.wikipedia.org/wiki/F-number). It controls the depth of field and also how much light the sensor is exposed to. f/2.8 will focus on one object (in your video, the focus is on the sky/stars) and blur out all the closer items. Fun experiment to try, make a pinhole with your fist. Look through it and try to focus on two objects, one closer and one farther. See how one of them blurs out when you look at the other one? Same concept. Make the pinhole bigger, try again, both items will be sharper and in focus.","cu1u6tg","cu2f524","cu28koo"
"Pizzage","oh_lord","2015-08-14 20:21:40","2015-08-14 20:21:40","1","34","Might be a stupid question. But do you have any recommendations for a camera able to do this? I'm new to this, but sooo interested and excited to do this myself. Thanks in advance !","cu1u6tg","cu2mnwx","cu2bck6"
"Nifty_Nugget","Akriax","2015-08-14 14:57:20","2015-08-14 14:57:20","1","14","I live in Portland and have no car. Take me with you next time.","cu1waxc","cu2h1wt","cu22wgb"
"xiccit","Akriax","2015-08-14 19:26:43","2015-08-14 19:26:43","1","13","Funk that blows my mind. Every time. 27 years in, don't matter. Still blown.","cu2lvlu","cu2lvlu","3gvgnb"
