"source", "destination", "startingTime", "finishingTime", "score", "size", "message", "thread", "href", "parent"
"GameBreak","boyyouguysaredumb","2015-08-14 13:36:21","2015-08-14 13:36:21","3","11","Sorry I didnt mean to say flash XD but thank you.","cu1waxc","cu2esv4","cu2bpuj"
"B0rtch","Akriax","2015-08-14 21:00:25","2015-08-14 21:00:25","1","51","I have to know, how do you take a picture like this? Do you use a special camera or lighting? It doesn't seem to matter if I am in the city or in the complete country side with no lights on for miles, I have never seen the sky look like this.","cu2n8y4","cu2n8y4","3gvgnb"
"Artificial-Insanity","Akriax","2015-08-14 13:19:57","2015-08-14 13:19:57","1","14","looking at this, and not a second later did [this song](https://www.youtube.com/watch?v=ytBR7ET_6uU) come to mind. =)","cu2eaij","cu2eaij","3gvgnb"
"skybrd","oh_lord","2015-08-15 02:58:26","2015-08-15 02:58:26","1","24","I might have to take you up on that offer for sending RAW night sky photos. Hoping to get some attempts in this weekend.","cu1u6tg","cu2y903","cu22dpx"
"juliancolton","nhawkl1","2015-08-14 12:43:23","2015-08-14 12:43:23","1","14","Hot pixel on the camera's sensor. Very common when shooting digital at high ISOs.","cu2cgid","cu2d3cy","cu2cgid"
"Chikenofthecave","Akriax","2015-08-14 13:52:18","2015-08-14 13:52:18","1","30","How can I take pictures like this? I live in Florida and have ZERO light Pollution but I don't have the slightest idea how to get a shot like this.","cu2fa7g","cu2fa7g","3gvgnb"
"CharmingDagger","Akriax","2015-08-14 16:19:38","2015-08-14 16:19:38","1","17","Someday, hopefully before I'm too blind to see it, I want to look up and see this.","cu2iv2v","cu2iv2v","3gvgnb"
"W4terb0y","oh_lord","2015-08-14 10:40:23","2015-08-14 10:40:23","1","44","Hey, quick question. I was planning on trying to take some pictures tonight of the sky tonight with my crappy canon sx510hs, its a bridge camera, terrible in low lighting. Should I even try? Or is this something that you NEED a DSLR for?","cu1u6tg","cu28x0x","cu22dpx"
"cityterrace","DrColdReality","2015-08-14 07:54:19","2015-08-14 07:54:19","1","20","What's a wide angle lenses for an cropped sensor camera? Is the stock 18-55mm lens with the Canon rebel sufficient?","cu1u6tg","cu238pw","cu1x3rb"
"drgreen818","Akriax","2015-08-14 14:12:01","2015-08-14 14:12:01","1","27","It's hard for me to believe this is real and you are fortunate enough to see something this miraculous. I would love to see this one day","cu2fuzh","cu2fuzh","3gvgnb"
"salgat","[deleted]","2015-08-14 12:00:21","2015-08-14 12:00:21","1","14","Yeah, nowhere in the world will get this bright without exposure on a camera.","cu1xzuk","cu2bmxh","cu28ru2"
"Calculus08","DrColdReality","2015-08-14 13:21:15","2015-08-14 13:21:15","1","10","This needs to be the top comment. Well done, sir.","cu1u6tg","cu2ebzk","cu1x3rb"
"relationship_tom","DrColdReality","2015-08-14 11:22:45","2015-08-14 11:22:45","1","45","I can get shots like this (After post-processing) with my RX100. I'm not as good at the processing but I think I can set it at 15-30 seconds and it's fine. When I put it to bulb for longer, that's when it starts to get trailed.","cu1u6tg","cu2acg8","cu1x3rb"
"relationship_tom","DrColdReality","2015-08-14 11:57:55","2015-08-14 11:57:55","1","14","You're right, that's about what I get, but it's not enough to distract me.","cu1u6tg","cu2bk4l","cu2art7"
"not_castor_pollux","Akriax","2015-08-14 13:19:47","2015-08-14 13:19:47","1","19","this is a fucking amazing photo. thanks for sharing. i don't think i'll ever see enough milky way photos.","cu2eabt","cu2eabt","3gvgnb"
"LittleBastard","Dr4Green2Thumb0","2015-08-14 23:45:14","2015-08-14 23:45:14","3","16","I mean all those people who aren't the dude playin' a dude, disguised as a dude.","cu1uaaz","cu2r1hd","cu2nsfi"
"careless25","DrColdReality","2015-08-14 13:38:31","2015-08-14 13:38:31","1","39","New phones are now able to do this. E.g. LG G4 has all the basic manual controls except f-stops. [Grainy but still a good pic](https://www.flickr.com/photos/poodz/20407941182/in/dateposted/) [Another awesome shot](https://www.flickr.com/photos/128286375@N08/20187265099/in/pool-2817972@N21/) But yes generally most phones will not be able to take such pictures.","cu1u6tg","cu2eva6","cu1x3rb"
"julienthegoblin","Akriax","2015-08-14 13:48:20","2015-08-14 13:48:20","2","21","how do you do the focus ? mine was to infity (biggest i can ) but it is still really blurry .Help please !","cu2f5xi","cu2f5xi","3gvgnb"
"rjcarr","DrColdReality","2015-08-15 02:49:32","2015-08-15 02:49:32","1","43","Thanks for the info, I wasn't trying to be a dick, honestly! Unfortunately I don't have anything that wide *and* fast. The best I have is a 40mm (64mm equiv) f/2.8. Time to go shopping, I guess, as I'd like to get into astrophotography.","cu1u6tg","cu2xvzs","cu2sb83"
"[deleted]","Dsiroon37","2015-08-14 10:17:08","2015-08-14 10:17:08","-6","1","[deleted]","cu1uaaz","cu284wu","cu2558g"
"DenyingEverything","Akriax","2015-08-14 12:32:03","2015-08-14 12:32:03","1","27","I've been seeing a bunch of these types of photos lately and I'm extremely saddened that I may never be able to see the sky this clearly.","cu2cpni","cu2cpni","3gvgnb"
"neilson241","daresi1000","2015-08-14 18:50:42","2015-08-14 18:50:42","2","21","A long exposure will bring out many more stars than are visible to the eye, but yes, it's been post-processed too.","cu27eqn","cu2lcad","cu27eqn"
"Akriax","wmlloydfloyd","2015-08-14 07:45:13","2015-08-14 07:45:13","132","14","This was about an hour from Portland, Oregon towards Astoria up on Nicolai Mountain.","cu1waxc","cu22wgb","cu1waxc"
"eXo5","Akriax","2015-08-14 13:05:09","2015-08-14 13:05:09","1","19","I don't typically use pictures as wallpaper, but this is spectacular. Anyway to get this into a 1920x1080 configuration?","cu2dtkj","cu2dtkj","3gvgnb"
"dorondoron","briefpu6969","2015-08-14 11:33:58","2015-08-14 11:33:58","1","29","flashlight + long exposure. notice the super bright part of the grass, that's most likely from a flashlight. it's a great technique to use to get some awesome night photos.","cu2affl","cu2aqi6","cu2affl"
"flamebird3","oh_lord","2015-08-14 08:19:27","2015-08-14 08:19:27","2","10","Could you give me an example please? This sounds awesome","cu1xzuk","cu245rk","cu22i93"
"ultimate555","Akriax","2015-08-14 08:08:56","2015-08-14 08:08:56","1","24","Are pictures like that one edited or enhanced somehow? Because I have never seen a sky with that amount of stars with my bare eyes.","cu23ryw","cu23ryw","3gvgnb"
"mastawingman","titsonalog","2015-08-15 00:54:01","2015-08-15 00:54:01","1","8","He didn't answer because he didn't take it.","cu1waxc","cu2tedf","cu26ovv"
"calebsfreakingsick","Akriax","2015-08-14 08:41:46","2015-08-14 08:41:46","1","20","How is it possible to get a picture with all those stars and all those colors? Is it photo shop?","cu24xvo","cu24xvo","3gvgnb"
"rustygee","Akriax","2015-08-14 11:43:34","2015-08-14 11:43:34","2","14","Man that Rokinon is Supreme. Nothing like it. And the Metal build quality, unreal!","cu26arg","cu2b2g7","cu26pje"
"DrColdReality","Nereo5","2015-08-15 00:42:00","2015-08-15 00:42:00","1","221","Digital sensors are subject to electronic ""noise"" in long exposures, it's just an intrinsic property of the device. Better, more expensive sensors experience *less* noise. When you get up into the scientific level of imaging, noise is eliminated by cooling the sensor, either electronically or literally by bathing the thing in liquid nitrogen or something. Some serious amateur astrophotographers use electronically-cooled cameras, and I *think* I just read somewhere that Canon or somebody was coming out with a prosumer 35mm camera that had cooling. None of that is cheap, however. For the casual amateur, you either need to get a camera with a good *enough* sensor that doesn't go overboard on the noise (the ""serious amateur"" to prosumer level cameras from Nikon and Canon are all decent), or you can try reducing the noise in post production with Photoshop or whatever. Most digital cameras have some degree of control over the in-camera manipulation of the image that might reduce noise. For example, cameras like the Nikon D90 and above have the ability to set the level of noise reduction. This doesn't *physically* reduce the noise, but rather it's an in-camera Photoshop kinda thing. You might actually get *better* results by turning noise reduction OFF. I keep mine off because I can do a better job of it in Photoshop, the camera's algorithms are weak.","cu1u6tg","cu2syjx","cu2jisy"
"elementalshakra","Akriax","2015-08-14 08:44:18","2015-08-14 08:44:18","0","26","What a great photo. It's photos/experience's like this that really make you wonder what is out there, and how small we truly are. Thank you for sharing.","cu250xv","cu250xv","3gvgnb"
"Charlesyes","Akriax","2015-08-14 12:42:24","2015-08-14 12:42:24","2","39","The emotion images like this give me are almost overwhelming, I feel like a kid again. I really want to see this with my own eyes one day. Where I live the sky is just too polluted by light.","cu2d26x","cu2d26x","3gvgnb"
"sand500","sportsziggy","2015-08-14 13:57:44","2015-08-14 13:57:44","2","13","What camera app did you use that let you control all these things?","cu1u6tg","cu2fg2l","cu2fe7y"
"LeeryLucifer","Akriax","2015-08-14 20:25:33","2015-08-14 20:25:33","1","12","Beautiful :) What exposure intervals do you use? And what's the ISO values?","cu2mpzg","cu2mpzg","3gvgnb"
"machanari","were-worm","2015-08-14 16:45:55","2015-08-14 16:45:55","1","5","how beatyfull place.I m so jealous","cu1waxc","cu2jd8t","cu2ixhj"
"ura_walrus","DrColdReality","2015-08-14 07:18:21","2015-08-14 07:18:21","18","55","Great breakdown. I did my first shot last weekend but over exposed the hell out of it. Excited for more. For OP's picture is it stacked? How is the foreground bright and colorful as is the sky? Even with high ISO and 30 second exposure everything in front of me was black but the sky was overexposed.","cu1u6tg","cu21vdx","cu1x3rb"
"[deleted]","DrColdReality","2015-08-14 11:47:17","2015-08-14 11:47:17","1","28","i have 18-55 IS and a 50mm prime on a 1100d body, what else do i need to buy.. also i have my dad's old tripod which is really heavy.","cu1u6tg","cu2b6zv","cu1x3rb"
"Bonewaltz","Fawers","2015-08-15 06:45:36","2015-08-15 06:45:36","1","18","I hope to see something like this too someday. But it'll be impossible here in São Paulo, unfortunately.","cu1uaaz","cu37fc2","cu2nxk1"
"zilfondel","DrColdReality","2015-08-15 05:44:21","2015-08-15 05:44:21","1","24","Thanks, I just got a new camera and wanted to do some night shots. Apparently I need a faster/wider lens to do so now...","cu1u6tg","cu34zmm","cu1x3rb"
"KnottedBear","DerpsMcGeeOnDowns","2015-08-14 13:34:32","2015-08-14 13:34:32","1","20","In Oregon? I've only visited once but recent and it was cold and cloudy. I feel like I missed out","cu1waxc","cu2eqvz","cu26ap4"
"Frugal_Octopus","GiantMTMilo","2015-08-14 10:08:22","2015-08-14 10:08:22","5","31","It's fun to learn! I have a Nikon d3200, the kit lens, and a tripod. I can't get these type of shots but I still have a blast. Examples below. http://imgur.com/5OvhrkW http://imgur.com/dsw9Lge","cu1u6tg","cu27u7l","cu1y0j7"
"[deleted]","Akriax","2015-08-14 15:47:25","2015-08-14 15:47:25","1","17","Man I'd kill for a view like that. All I got is urban decay and light pollution. :\","cu2i7fv","cu2i7fv","3gvgnb"
"PerroDog","DrColdReality","2015-08-14 15:43:29","2015-08-14 15:43:29","1","20","LG G4 on manual mode will work perfect. The iso and shutter speed is customizable plus more. Check it out","cu1u6tg","cu2i4f8","cu1x3rb"
"SammyYO","Akriax","2015-08-14 14:00:43","2015-08-14 14:00:43","3","6","Dude I live in Seasiide!. Cheers!","cu1waxc","cu2fj3k","cu22wgb"
"DrColdReality","colourfulsynesthete","2015-08-14 11:20:16","2015-08-14 11:20:16","4","19","Yup, can't shoot a 15-30 second exposure without a tripod. I don't care *how* steady you fancy your hands are.","cu1u6tg","cu2a9fd","cu2a210"
"TaylorS1986","Dsiroon37","2015-08-17 04:44:19","2015-08-17 04:44:19","1","49","Light pollution makes me sad. I grew up in a rural area were the only significant light pollution was around the SW horizon from Fargo's city lights and on a moonless night I could see things all the way down to magnitude 6. The Milky Way was always pretty obvious.","cu1uaaz","cu52m8y","cu2558g"
"Benentono","LittleBastard","2015-08-15 00:18:40","2015-08-15 00:18:40","1","20","Are you a dude who has no idea what dude he is and claims to know what dude he is?","cu1uaaz","cu2s51v","cu2r1hd"
"jamesspal","Akriax","2015-08-14 19:16:55","2015-08-14 19:16:55","1","15","Beautiful shot! Why have I never seen Milky Way the same way you do guys?","cu2lqei","cu2lqei","3gvgnb"
"[deleted]","Akriax","2015-08-14 16:04:00","2015-08-14 16:04:00","1","1","[deleted]","cu2ijst","cu2ijst","3gvgnb"
"lonely_rurouni","Akriax","2015-08-14 14:30:37","2015-08-14 14:30:37","1","36","Just wondering is it possible to take a shot like this with a Nikon P530? I've been looking for a camera to take shots like this but I don't know where to start. Thanks in advance!","cu2gdhh","cu2gdhh","3gvgnb"
"[deleted]","SomeGuyInNewZealand","2015-08-14 11:34:58","2015-08-14 11:34:58","-7","1","[removed]","cu1uaaz","cu2arrx","cu2ag71"
"Akriax","Akriax","2015-08-14 03:39:24","2015-08-14 03:39:24","7080","0","","3gvgnb","3gvgnb","3gvgnb"
"alpha_squared","OhnOshieDidnt77","2015-08-14 07:45:31","2015-08-14 07:45:31","8","37","That focal length is what's hurting you. For photography like this, you'd want to follow the [500 rule](http://petapixel.com/2015/01/06/avoid-star-trails-following-500-rule/). I recommend renting a wide angle lens for a weekend and try it to see the difference. Edit: formatting because mobile","cu217n5","cu22wud","cu217n5"
"_bar","GiantMTMilo","2015-08-14 05:04:49","2015-08-14 05:04:49","7","28","Do you have an experience in photography and post processing? Even with good equipment, you'll need to learn a lot of technical stuff before you start taking comparable photos.","cu1u6tg","cu1wg5f","cu1v2sj"
"Grey_Kit","Akriax","2015-08-14 09:44:09","2015-08-14 09:44:09","3","22","Amzing! I've never seen anything like this in person yet, I await that day. What camera did you use to capture this?","cu270m9","cu270m9","3gvgnb"
"BUTT_GETTER","AtomicSkylark","2015-08-14 15:51:13","2015-08-14 15:51:13","57","22","I find it so sad that I have yet to see it and live on the same planet as all you people","cu1uaaz","cu2iab9","cu1uaaz"
"neihuffda","EVOSexyBeast","2015-08-14 17:05:54","2015-08-14 17:05:54","1","7","It's either a plane or a meteor.","cu2ivw6","cu2jq0n","cu2ivw6"
"Astrosherpa","W4terb0y","2015-08-14 11:51:28","2015-08-14 11:51:28","5","86","Give it a go. The darker the skies the better no matter what camera you use. I looked up the specs on your camera. Max out the iso to 1600 and pull back the zoom all the way to 24mm at F3.8. After that, assuming you can do a long exposure, try to set the shutter open for 15 seconds. Any longer and you'll get star trails. You'll need a tripod for this, obviously. For the most part the lens is what really matters most for night shots.","cu1u6tg","cu2bca9","cu28x0x"
"HolyGhost123","Akriax","2015-08-14 10:23:36","2015-08-14 10:23:36","-6","13","Another generic amateur shot of the milkway on reddit that makes the frontpage.","cu28cu7","cu28cu7","3gvgnb"
"Green4Jesus20","Manavj36","2015-08-15 01:22:15","2015-08-15 01:22:15","1","21","You can definitely see the milky way with just your eye. But its not that vivid or bright without a camera.","cu2783h","cu2ugdw","cu2783h"
"StoopidFlexin","Akriax","2015-08-15 01:17:43","2015-08-15 01:17:43","0","37","I always wanted to do this? When is the best time to see the Milky Way? I found a place a few hours away from the city and would love to see this with my own eyes.","cu2ua6e","cu2ua6e","3gvgnb"
"Hello-Universe","pentahiggs","2015-08-15 11:10:51","2015-08-15 11:10:51","1","55","No... an anecdote is a short story about something that happened to someone. I said it was a good story, I was glad to hear about his experience, but also wanted to point out that it really wouldn't provide the perspective he seemed to think it did.... its really not that difficult to understand man.","cu1uaaz","cu3ga0x","cu3eim4"
"DrColdReality","ura_walrus","2015-08-14 07:58:17","2015-08-14 07:58:17","7","146","&gt;For OP's picture is it stacked? I doubt it, because of the airplane track on the left. That suggests it's a single shot. &gt;Even with high ISO and 30 second I normally shoot at ISO 1600, 15-25 seconds at F1.4 - F2.8. You can crank up the ISO more, but the image starts getting noisy. &gt;How is the foreground bright and colorful as is the sky Because there was a teensy amount of light on the foreground. I assume it is light spill from some nearby source, but it probably looked nearly black to the naked eye. Some astro shooters will intentionally paint nearby foreground objects with a flashlight or strobe to light them up. Doesn't take a whole lotta light when you're exposing that long. And that bit on the left that looks like sunrise is probably the light pollution from a distant town, which would be just barely visible to your eye.","cu1u6tg","cu23e0x","cu21vdx"
"DerpsMcGeeOnDowns","Akriax","2015-08-14 09:22:46","2015-08-14 09:22:46","14","28","I was in Astoria two years ago. It's one of the most beautiful places I've been on the planet. Short Sands is one of the dopest beaches ever.","cu1waxc","cu26ap4","cu22wgb"
"f10101","camnez1","2015-08-14 14:05:44","2015-08-14 14:05:44","4","58","Not as vivid/tangible (it's at the limit of your vision - you're literally talking about handfuls of protons being the difference between ""milkyway"" and pitch black) but feels immensely more vast and is mind-bendingly detailed. You're looking at a tiny screen here. Seeing it reality means having it sweep overhead from horizon to horizon. No photograph captures that feeling.","cu1uaaz","cu2fohe","cu2d7x2"
"zenminds","Akriax","2015-08-14 18:17:57","2015-08-14 18:17:57","1","32","I have a question, since I am living in a light polluted city, do you actually see this with your own eyes? Or you can see The Milky Way only through camera?","cu2kuy8","cu2kuy8","3gvgnb"
"DrColdReality","HaplessDiglett","2015-08-15 00:28:03","2015-08-15 00:28:03","1","45","You wouldn't see nearly as many stars or detail in the Milky Way. It's the long exposure (mostly) that brings out all this detail. Have you truly never been to a decent dark-sky location and looked up? You're missing out on a helluva view, photography aside.","cu1u6tg","cu2sgr3","cu2kecc"
"zilfondel","Akriax","2015-08-15 05:43:09","2015-08-15 05:43:09","1","5","Figured it was another Oregonian...","cu1waxc","cu34xwv","cu22wgb"
"lasercat13","DrColdReality","2015-08-14 10:34:30","2015-08-14 10:34:30","1","33","That looks like a meteor, not an airplane track. The meteor shower last night was amazing! My husband and I laid out in the yard on a blanket and watched them for hours!","cu1u6tg","cu28px9","cu23e0x"
"hakuna_masquata","Akriax","2015-08-14 14:43:08","2015-08-14 14:43:08","1","20","How the hell do people take pictures like this?! Really! I can't even take a decent picture on my iPhone","cu2gp99","cu2gp99","3gvgnb"
"rambambobandy","AtomicSkylark","2015-08-14 07:53:07","2015-08-14 07:53:07","-26","17","How have you managed to avoid seeing the galaxy your entire life? I mean... you live there.","cu1uaaz","cu2373l","cu1uaaz"
"KaptainCapture","josephvuuu","2015-08-14 07:16:08","2015-08-14 07:16:08","11","25","If you get far enough away from light pollution you can actually see the Milky Way with your naked eyes (once adjusted to the dark)","cu1xzuk","cu21s7p","cu1xzuk"
"kairon156","Akriax","2015-08-14 10:12:05","2015-08-14 10:12:05","1","27","Awesome picture. can you do wide screen next time? :) man, I really need to move somewhere that isn't cloudy every time we have a good meteor showers.","cu27yte","cu27yte","3gvgnb"
"RPapa_P","Akriax","2015-08-14 11:25:25","2015-08-14 11:25:25","1","33","I can't wait until I have the opportunity to travel and see things like this with my own eyes...pictures are great, but I can't imagine how incredible this must have been in person.","cu2afoc","cu2afoc","3gvgnb"
"TaylorS1986","AtomicSkylark","2015-08-17 04:38:43","2015-08-17 04:38:43","1","16","Blows my mind that the brighter, wider, redder area near the horizon is the galactic center.","cu1uaaz","cu52fma","cu1uaaz"
"DrColdReality","leapinglynx","2015-08-15 01:04:53","2015-08-15 01:04:53","1","48","If your existing lens works, use it. Otherwise, you might consider finding a cheap, used older wide-angle lens, a manual-focus F2.8 28mm or something. And there are lots of places on the net where people post these kind of pictures and talk about them, ask folks there what they use. http://petapixel.com/2014/01/29/picking-great-lens-milky-way-photography/ http://www.lonelyspeck.com/best-lenses-for-milky-way-photography-canon/ etc.","cu1u6tg","cu2tssu","cu2i9xa"
"[deleted]","Akriax","2015-08-14 10:40:44","2015-08-14 10:40:44","1","16","Hope this isn't a daft question but how often do you get this kind of view?","cu28xgu","cu28xgu","3gvgnb"
"titsonalog","Akriax","2015-08-14 09:34:35","2015-08-14 09:34:35","17","5","What was your shutter speed?","cu1waxc","cu26ovv","cu22wgb"
"3ric15","Akriax","2015-08-15 00:40:22","2015-08-15 00:40:22","1","2","Camera specs?","cu1waxc","cu2swgc","cu22wgb"
"RL1180","lasercat13","2015-08-14 11:00:21","2015-08-14 11:00:21","4","17","It's definitely an airplane track. You can see the pulses from the strobe lights on the wings/belly.","cu1u6tg","cu29lav","cu28px9"
"oh_lord","flamebird3","2015-08-14 11:10:19","2015-08-14 11:10:19","2","37","Hey! I use [Star Walk](https://play.google.com/store/apps/details?id=com.vitotechnology.StarWalk), but it costs money. I've seen [this one](https://play.google.com/store/apps/details?id=com.t11.skyviewfree) recommended here, though, and it looks pretty cool! Edit: It looks like there's a free version of Star Walk 2, apparently. Never tried it though. Cheers!","cu1xzuk","cu29xcv","cu245rk"
"diaZBackwards","Akriax","2015-08-15 01:03:29","2015-08-15 01:03:29","1","48","Amazing shot. I tried to do one of these for the first time last night but couldn't get that much of the Milky Way in. I was using a standard kit lens at 18 mm. What kind of lens/focal length did you use if you don't mind me asking?","cu2tqw4","cu2tqw4","3gvgnb"
"EEKman","Akriax","2015-08-14 09:25:35","2015-08-14 09:25:35","8","26","Wow this stopped me in my tracks at work and put a smile on my face. Fantastic shot. Thanks for posting, it really made my day.","cu26e4n","cu26e4n","3gvgnb"
"saruhtoninhoops","Akriax","2015-08-14 06:17:57","2015-08-14 06:17:57","0","13","Woah this is beautiful. So this is considered the perseids meteror shower or ? :)","cu1zgi8","cu1zgi8","3gvgnb"
"bucho80","Colonel_Swaggot","2015-08-14 21:24:51","2015-08-14 21:24:51","11","50","On a really dark, moonless night you can see it. It looks like a faint cloud stretching across the sky. Not nearly as vivid as the photo, but still quite awesome! I went out the other night to watch the meteor shower and enjoyed watching the galaxy just as much.","cu1uaaz","cu2nnrp","cu2ko65"
"smyth1214","Akriax","2015-08-14 11:11:25","2015-08-14 11:11:25","1","13","Absoloutely stunning, hope I will get to see something like this IRL sometime!","cu29ypr","cu29ypr","3gvgnb"
"DrColdReality","tyb0b","2015-08-14 12:32:56","2015-08-14 12:32:56","3","20","Because of the airplane, I'm thinking one shot. OP might have run it through Photoshop, I do with all mine.","cu1u6tg","cu2cqpw","cu2bufe"
"modeslips","DrColdReality","2015-08-14 18:52:43","2015-08-14 18:52:43","1","4","Isn't 30 seconds quite long?","cu1u6tg","cu2ldeg","cu1x3rb"
"josephvuuu","Akriax","2015-08-14 05:42:14","2015-08-14 05:42:14","4","22","Would love to do one of these one day. How did you know where you needed to compose to get this shot??","cu1xzuk","cu1xzuk","3gvgnb"
"DrColdReality","GiantMTMilo","2015-08-14 05:20:27","2015-08-14 05:20:27","166","116","The trick to doing shots like this is a camera that can take at least 15-30 second exposures, can be set to around ISO 1600 or higher, and a fast wide angle lens. A phone ain't gonna cut it. The wide angle lens is necessary because with a ~30 second exposure, the Earth turns more than enough to make the stars show up as streaks, and the more magnification you use, the more that streaking becomes obvious. The less magnification (ie, a wide angle lens), the less obvious it is. So what you do is set the camera to ISO 1600 or faster, set about a 15-30 second exposure with the lens at F2.8 or wider. Bonafides: former pro photographer, amateur astronomer and astrophotographer.","cu1u6tg","cu1x3rb","cu1u6tg"
"evilkim","BasaltFormation","2015-08-14 15:01:39","2015-08-14 15:01:39","1","8","Actually that looks likes an airplane to me","cu28nrh","cu2h5s6","cu28nrh"
"1foundsock","DrColdReality","2015-08-14 13:12:41","2015-08-14 13:12:41","1","50","Great response and will have to keep those tips in mind. I went out last night and still failed using a DSLR, point and shoot and phone but really didn't take the time to getting my settings right. You might dig this post on atrophotography using the OnePlus phone. http://www.lonelyspeck.com/photographing-the-milky-way-with-a-smartphone/","cu1u6tg","cu2e2de","cu1x3rb"
"colourfulsynesthete","DrColdReality","2015-08-14 11:14:09","2015-08-14 11:14:09","3","20","Another thing to add for GiantMTMilo: a tripod will be your new best friend for taking night time sky photos.","cu1u6tg","cu2a210","cu1x3rb"
"bunchofbollucks","flamebird3","2015-08-14 08:48:55","2015-08-14 08:48:55","1","7","GoSkyWatch is my favorite. Amazing little app","cu1xzuk","cu256kq","cu245rk"
