"source", "destination", "startingTime", "finishingTime", "score", "size", "message", "thread", "href", "parent"
"PsyHusky","Akriax","2015-08-14 12:39:57","2015-08-14 12:39:57","1","20","Did anyone else read the title of this post as though it were a news article regarding armed assault? :P","cu2czaw","cu2czaw","3gvgnb"
"jpastore","ura_walrus","2015-08-14 08:50:21","2015-08-14 08:50:21","5","9","3M is founded on accidents. That's a cool one","cu222cn","cu258ai","cu23c3m"
"karantza","projekt3","2015-08-14 09:02:16","2015-08-14 09:02:16","4","76","I've never seen it that bright in person, but I've also never been really in the middle of nowhere. If you can get to a rural area, the Milky Way looks a about as bright as the very top of this image - a little fuzzy bluish band. You don't see much color without a camera. Cities and towns definitely glow on the horizon like that though. To find a good nearby place to stargaze, check out http://www.lightpollutionmap.info .","cu24rl5","cu25mmf","cu24rl5"
"SSDD_P2K","nyyankees1237","2015-08-15 01:23:56","2015-08-15 01:23:56","2","6","Our Astoria has dope, not beaches","cu1waxc","cu2uip9","cu297n4"
"camnez1","Dsiroon37","2015-08-14 12:47:09","2015-08-14 12:47:09","3","18","So this is actually visible to the naked eye? I need to add this to my bucket list","cu1uaaz","cu2d7x2","cu2558g"
"juliancolton","esskay04","2015-08-14 12:41:12","2015-08-14 12:41:12","2","54","Well, in a manner of speaking, sure... but as the Milky Way is around 1,000 light years thick, you still have to look through quite a bit of our own empty space before you start thinking about intergalactic emptiness. On clear nights in dark places, the Andromeda Galaxy is easily visible to the naked eye.","cu24pn2","cu2d0s2","cu28m84"
"RedBitterSoda","Akriax","2015-08-14 17:53:40","2015-08-14 17:53:40","1","18","Really breath taking shot. Which camera did you use and what are the camera settings for this shot?","cu2khnr","cu2khnr","3gvgnb"
"ParticleSpinClass","ura_walrus","2015-08-14 12:05:26","2015-08-14 12:05:26","1","25","As long as you didn't clip the whites (blown out), over exposing is actually preferred. More light is better. Look up ""expose to the right"".","cu1u6tg","cu2bt4h","cu23fa7"
"tyb0b","DrColdReality","2015-08-14 12:35:36","2015-08-14 12:35:36","1","23","Are you able to get the milky way like that with only one shot? Maybe I need to work on my PS skills.","cu1u6tg","cu2ctyp","cu2cqpw"
"aweyeahdawg","DrColdReality","2015-08-14 13:08:16","2015-08-14 13:08:16","1","6","Commenting to save for later. Thanks!","cu1u6tg","cu2dx7z","cu1x3rb"
"ura_walrus","Akriax","2015-08-14 07:56:51","2015-08-14 07:56:51","12","38","Shut.Up. So you shined a bit of light to bring it up and then kept on taking the picture? Wow. Im impressed. Edit: note that I'm serious. I can't believe such a simple idea brings such a great picture.","cu222cn","cu23c3m","cu22xln"
"tyb0b","DrColdReality","2015-08-14 12:06:33","2015-08-14 12:06:33","1","18","Do you think this photo has any stacking going on or do you think 1 single shot got this?","cu1u6tg","cu2bufe","cu1x3rb"
"phreaminz","Akriax","2015-08-14 10:53:17","2015-08-14 10:53:17","1","13","Great photo! I live in so cal, great sunsets but missing the stars...","cu29cq0","cu29cq0","3gvgnb"
"EVOSexyBeast","Akriax","2015-08-14 16:20:45","2015-08-14 16:20:45","1","8","[Can someone please tell me what this is?](http://prntscr.com/84g4az)","cu2ivw6","cu2ivw6","3gvgnb"
"oh_lord","skybrd","2015-08-17 23:34:36","2015-08-17 23:34:36","1","43","Sure thing! Just shoot upload them somewhere or shoot me a PM and we can exchange email info if that's easier. I'd love to take a stab at them for you. I can't promise any amazing results, but it never hurts to try!","cu1u6tg","cu5uebd","cu2y903"
"AtomicSkylark","Akriax","2015-08-14 04:13:23","2015-08-14 04:13:23","110","24","Amazing shot. Just saw the milky way for the first time in my life last night. Puts into perspective how enormous the cosmos is.","cu1uaaz","cu1uaaz","3gvgnb"
"sportsziggy","sand500","2015-08-14 13:56:04","2015-08-14 13:56:04","1","13","Not mine ([mine](https://i.imgur.com/0Sfbp1D.jpg)), but it is max ISO, 30 sec exposure and infinite focus.","cu1u6tg","cu2fe7y","cu2fcsw"
"Nereo5","DrColdReality","2015-08-14 16:54:13","2015-08-14 16:54:13","1","38","I've got a Canon EOS 500D/EOS Rebel T1i. I can't make a 30 sec exposure on IOS 1600 without it gets full of artifacts. (The red dots) Is there some trick to avoid this out do I just need a better camera?","cu1u6tg","cu2jisy","cu1x3rb"
"neilson241","hakuna_masquata","2015-08-14 18:58:52","2015-08-14 18:58:52","1","24","Briefly: wide angle lens, as long of an exposure you can handle with that lens, high ISO, slightly less than infinite focus, post processing.","cu2gp99","cu2lgk3","cu2gp99"
"Colombiana239","Akriax","2015-08-14 14:24:29","2015-08-14 14:24:29","1","15","Amazing picture! Totally using it as my wallpaper. What kind of camera do you use?","cu2g7id","cu2g7id","3gvgnb"
"SomeGuyInNewZealand","[deleted]","2015-08-14 20:31:32","2015-08-14 20:31:32","1","17","Yeah. When I was in London I looked up one night and saw maybe two stars. Disappointed.","cu1uaaz","cu2mt6l","cu2mbjx"
"boulder0311","esskay04","2015-08-14 12:47:19","2015-08-14 12:47:19","1","72","http://imgur.com/WBmRsOn Here Is an image of where exactly we are in the Milky Way galaxy. Every star we can see with the naked eye or in this Wide field image are within the milky way galaxy. Although you are partially right as some of those stars are not really stars but galaxies such as M31 Andromeda (our nearest galactic neighbor). So from what you are seeing technically no but beyond that yes.","cu24pn2","cu2d83y","cu28m84"
"neilson241","Isolder","2015-08-14 19:00:21","2015-08-14 19:00:21","1","16","Exaggerated since it's a long exposure, but in dark places, the milky way is absolutely visible.","cu2hk35","cu2lhby","cu2hk35"
"Triggur121","Ryanimf","2015-08-15 02:46:33","2015-08-15 02:46:33","1","66","How do we obtain these far out photographs of our galaxy? Isn't new horizons the farthest any man made object has ventured into space? Or are these renditions of what our galaxy looks like from that far out based on research etc.? And how certain are we of our location within our galaxy? So many questions!!! Anywho, this is fascinating to see. Thank you for sharing!","cu1uaaz","cu2xrtg","cu2hp1q"
"rjcarr","DrColdReality","2015-08-14 18:36:47","2015-08-14 18:36:47","1","26","&gt; F2.8 or wider I think you meant *faster* here. And for ""wide"" I assume you mean something wider than 30 mm on a full frame or equivalent?","cu1u6tg","cu2l515","cu1x3rb"
"neilson241","Charlesyes","2015-08-14 18:52:04","2015-08-14 18:52:04","1","28","You're probably only a couple hours away max from seeing it, I'd think. At least in the western half of the US, not too sure about other places.","cu2d26x","cu2ld12","cu2d26x"
"mastawingman","Akriax","2015-08-15 00:53:42","2015-08-15 00:53:42","1","37","Did you look that up from the person that originally took it or just making shit up? Because searching for this image through google I can find it in a few other websites other than this one...","cu1waxc","cu2tdy9","cu22wgb"
"idoescompooters","OPs_Moms_Fuck_Toy","2015-08-14 08:20:51","2015-08-14 08:20:51","6","7","And a hefty price with it too!","cu1u6tg","cu247iy","cu21scd"
"rebelwax","Artificial-Insanity","2015-08-14 22:26:46","2015-08-14 22:26:46","1","10","This is the song that popped in my head https://www.youtube.com/watch?v=pWxJEIz7sSA","cu2eaij","cu2owi2","cu2eaij"
"Sepiroth89","AtomicSkylark","2015-08-14 13:24:35","2015-08-14 13:24:35","3","6","Or how incredibly small we are.","cu1uaaz","cu2efvl","cu1uaaz"
"GiantMTMilo","Akriax","2015-08-14 04:11:05","2015-08-14 04:11:05","42","28","How do you get pics like this? Because I try to take pictures with my phone and it's just a black screen. Hope that's not a stupid question.","cu1u6tg","cu1u6tg","3gvgnb"
"whittery27","EVOSexyBeast","2015-08-14 17:34:34","2015-08-14 17:34:34","1","21","could be a meteor, theres a meteor shower going on right now and last night and tonight are the peak nights.","cu2ivw6","cu2k6yj","cu2ivw6"
"Arrivall","rambambobandy","2015-08-14 08:27:19","2015-08-14 08:27:19","2","1","https://en.wikipedia.org/wiki/Light_pollution","cu1uaaz","cu24fp8","cu2373l"
"leapinglynx","DrColdReality","2015-08-14 15:50:41","2015-08-14 15:50:41","1","33","So what kind of lens would you suggest? I'm new to it and have been taking pics of auroras in my area but my current lens only has an aperture as low as 4.","cu1u6tg","cu2i9xa","cu1x3rb"
"speedota","Akriax","2015-08-14 12:13:18","2015-08-14 12:13:18","1","16","Am I the only one who sees the red spy satellite at the upper left corner?","cu2c2op","cu2c2op","3gvgnb"
"Twizzler____","Akriax","2015-08-14 15:40:39","2015-08-14 15:40:39","1","29","Photography noob here, what exactly is a long exposure photo?. My understanding of it is...like it's taking a video of something, but keeping everything in place throughout the exposure time?","cu2i2ai","cu2i2ai","3gvgnb"
"ura_walrus","Akriax","2015-08-14 07:23:19","2015-08-14 07:23:19","17","47","I did my first shot last weekend but over exposed the hell out of it. Excited for more. How is the foreground bright and colorful as is the sky? Even with high ISO and 30 second exposure everything in front of me was black but the sky was overexposed.","cu222cn","cu222cn","3gvgnb"
"gabezermeno","GiantMTMilo","2015-08-14 06:28:17","2015-08-14 06:28:17","5","22","What you need 1. A camera with a large sensor 2. A camera with manual controls 3. A lens with a large aperture/low f-stop number","cu1u6tg","cu1zvpe","cu1u6tg"
"[deleted]","KaptainCapture","2015-08-14 10:36:07","2015-08-14 10:36:07","3","17","I used to live in one of the most remote places in the USA, never saw it :'(","cu1xzuk","cu28ru2","cu21s7p"
"DrColdReality","[deleted]","2015-08-14 12:37:36","2015-08-14 12:37:36","1","48","Depends on the maximum aperture of the lens. You might have enough to get started (I'd add a cable release, so you don't bump the camera when you trip the shutter). You need dark skies, of course. Try this in the city, and all you'll record is light pollution.","cu1u6tg","cu2cwfy","cu2b6zv"
"Hello-Universe","AtomicSkylark","2015-08-14 12:22:52","2015-08-14 12:22:52","-10","23","No, no....it really doesn't.... Actually there isn't even a perspective available to you to represent the enormity of the cosmos... But great anecdote!","cu1uaaz","cu2ceh4","cu1uaaz"
"TheGoose","DrColdReality","2015-08-16 08:09:06","2015-08-16 08:09:06","1","12","August 9th, 2015 over Cape Cod http://i.imgur.com/LZsqoB1.jpg Setting | Value ---|--- ISO | 220 Focal Length | 50mm Aperture | f/4 Exposure Time | 25s","cu1u6tg","cu49skb","cu1x3rb"
"LL-beansandrice","sportsziggy","2015-08-14 14:12:30","2015-08-14 14:12:30","1","10","That pic is so noisy I can't hear myself think","cu1u6tg","cu2fvib","cu2ccji"
"LionIV","AtomicSkylark","2015-08-14 19:38:58","2015-08-14 19:38:58","1","16","I'm guessing its not really as colorful as this photograph right? Does it still look amazing?","cu1uaaz","cu2m1xr","cu1uaaz"
"vandnasahni","Akriax","2015-08-14 18:56:26","2015-08-14 18:56:26","1","15","Yippy! This scene is too awesome.The photoshooter has to be rewarded for his amazing effort:P","cu2lf91","cu2lf91","3gvgnb"
"esskay04","boulder0311","2015-08-16 02:28:09","2015-08-16 02:28:09","1","6","Awesome, thanks for clarifying. Fascinating stuff!","cu24pn2","cu3zmkq","cu2et44"
"[deleted]","careless25","2015-08-14 15:26:01","2015-08-14 15:26:01","1","28","I got the g4 and it handles stars/northern lights just fine at 15/30 exposure and ISO 1500/2000. Video won't be fixed till update, but for stills it crushes other flagships.","cu1u6tg","cu2hqjr","cu2eva6"
"ThisIsTheAssman","Akriax","2015-08-14 23:47:56","2015-08-14 23:47:56","1","22","Im trying to learn how to take shots like this. What camera and settings did you use? Great shot btw. Edit: spelling","cu2r4n8","cu2r4n8","3gvgnb"
"edgemenger","Akriax","2015-08-14 08:08:28","2015-08-14 08:08:28","0","26","For me this picture is so amazing because the grass .. I don't know but it just looks so nice and I want to sit there now :(","cu23rcz","cu23rcz","3gvgnb"
"camnez1","f10101","2015-08-14 14:52:50","2015-08-14 14:52:50","2","15","That is amazing. Thanks for the explanation. Gotta find a good spot for viewing this","cu1uaaz","cu2gy02","cu2fohe"
"BeansOnPumpernickel","ultimate555","2015-08-14 08:21:39","2015-08-14 08:21:39","1","35","thats what nighttime looks like, its light pollution that disturbs the natural sky. This picture was probably taken with a longer exposure for some added brightness, but just being away from city lights helps greatly.","cu23ryw","cu248lp","cu23ryw"
"Akriax","jjhooch","2015-08-14 09:35:08","2015-08-14 09:35:08","5","29","I shot this with my Canon 6D and a Rokinon 14mm f/2.8 lens for 30 seconds at ISO 4000. A fast wide angle lens is key for a milky way shot.","cu26arg","cu26pje","cu26arg"
"cmperry51","Akriax","2015-08-15 03:10:38","2015-08-15 03:10:38","1","37","Great shot. I live in a good dark-sky area where I can lie out in my zero-G lawn chair and have comparable views of the Milky Way, but without camera skills, nothing like the detail this reveals.","cu2yqqi","cu2yqqi","3gvgnb"
"machanari","Akriax","2015-08-14 14:59:55","2015-08-14 14:59:55","1","17","exucuse me my english is bad. Do you live in America Oregon ? what is Astoria ? Astoria is Place name?","cu1waxc","cu2h48b","cu22wgb"
"projekt3","Akriax","2015-08-14 08:36:42","2015-08-14 08:36:42","1","62","I keep seeing all these amazing and I mean amazing space pictures. do they actually look like that with the naked eye?!? and if so does anyone know a site where there is a consolidated map of the best place to view stuff like that. I'm in VA and would love to see something like this with my naked eyes. anyone know?","cu24rl5","cu24rl5","3gvgnb"
"HaplessDiglett","DrColdReality","2015-08-14 17:47:43","2015-08-14 17:47:43","1","54","I absolutely love shots of the milky way like this... but how much of this is camera magic? If I were to standing next to OP when he/she took this photo, would I be seeing the exact same thing as in the picture? Or would it be slightly less defined, less bright, etc etc?","cu1u6tg","cu2kecc","cu1x3rb"
"pentahiggs","Hello-Universe","2015-08-15 10:13:04","2015-08-15 10:13:04","1","32","So him seeing the Milky Way helped him comprehend how small we are. But seeing the Milky Way isn't enough to make us comprehend how small we are? Gr8 logic there m8","cu1uaaz","cu3eim4","cu32crj"
"Dr4Green2Thumb0","jamesbiff","2015-08-14 21:32:00","2015-08-14 21:32:00","22","6","What do YOU mean ""you people""","cu1uaaz","cu2nsfi","cu2lr4f"
"mutandi","Akriax","2015-08-15 04:46:09","2015-08-15 04:46:09","1","19","Just wanted to say thanks for providing this beautiful shot. It makes for an amazing background on my phone.","cu32msv","cu32msv","3gvgnb"
"thewireseason4","S_H_A_Z_A_M","2015-08-14 12:19:03","2015-08-14 12:19:03","2","10","There's a save button right below OP (original poster) name.","cu2boan","cu2c9uc","cu2boan"
"sand500","DrColdReality","2015-08-14 13:54:05","2015-08-14 13:54:05","1","18","&gt; fast wide angle lens What does 'fast' mean in this context? How fast the lens can auto focus?","cu1u6tg","cu2fc3t","cu1x3rb"
"Manavj36","Akriax","2015-08-14 09:50:12","2015-08-14 09:50:12","3","28","This may be a dumb question but is that actually what it looks like with your naked eye or is it with special camera settings like long exposure??","cu2783h","cu2783h","3gvgnb"
"rex_you_knew","Akriax","2015-08-14 20:20:49","2015-08-14 20:20:49","1","18","This is inspiring, I'll be putting some late night photographic experiments up over the weekend thanks to this ^_^","cu2mngc","cu2mngc","3gvgnb"
"iplaygaem","DrColdReality","2015-08-14 13:49:59","2015-08-14 13:49:59","1","26","Yes! Even just this month they pushed a firmware update to the HERO 4 Black adding new options. I'm fairly impressed, it's better than I expected! https://www.youtube.com/watch?v=rbXiFVVYm-s","cu1u6tg","cu2f7re","cu2ansl"
"Isolder","Akriax","2015-08-14 15:18:12","2015-08-14 15:18:12","1","19","So uh how close is this to naked eye vision? All I see are stars when I look up...","cu2hk35","cu2hk35","3gvgnb"
"Pravus_Belua","troyaner","2015-08-15 05:30:18","2015-08-15 05:30:18","2","24","As there are still shots being taken, I believe it to be an ongoing active-shooter situation. We really need to get some control over this!","cu25vn7","cu34fev","cu26jvf"
"DrColdReality","modeslips","2015-08-15 00:20:56","2015-08-15 00:20:56","2","46","Depends on the focal length of the lens, but yeah, it's up at the upper end of what most people use. I generally use 15-25 seconds. The wider the focal length, the more exposure time you can get away with, that's why star shooters use wide angle lenses.","cu1u6tg","cu2s7va","cu2ldeg"
"DrClaudeLedbetter","Akriax","2015-08-14 14:07:18","2015-08-14 14:07:18","1","14","You live on a mountaintop above the clouds?... May I come live with you?","cu2fq3g","cu2fq3g","3gvgnb"
"AtomicSkylark","LionIV","2015-08-15 01:15:12","2015-08-15 01:15:12","2","25","It stretched across the whole sky in a band of what looked like faint clouds. Amazing to see when you know what you're looking at.","cu1uaaz","cu2u6pd","cu2m1xr"
"Ol0O01100lO1O1O1","cityterrace","2015-08-14 09:23:38","2015-08-14 09:23:38","1","41","Ideally you're going to want something between 8-12mm for really expansive shots like this. Something sharp and fast. If you're looking to buy a lens consider the Rokinon primes; they're inexpensive and really high quality, although not the most versatile lenses.","cu1u6tg","cu26br4","cu238pw"
"IWasBilbo","speedota","2015-08-14 23:30:28","2015-08-14 23:30:28","1","19","it's called an airplane... satellites would have a longer trail at this exposure considering the brightness of the trail.","cu2c2op","cu2qkxu","cu2c2op"
"iamlamont","salgat","2015-08-14 18:02:50","2015-08-14 18:02:50","1","78","I'm not sure. If you go out to the coast on the Peninsula up from Astoria past Long Beach you'll see virtually no light on the beach and on a clear bright night the Milky Way looks similar, not this bright but then it's not even classified as a Dark Park much less a Dark Reserve much less a Dark Sanctuary (only one in North America). The stars are amazing when there is no light around for miles.","cu1waxc","cu2kmq1","cu2bjyh"
"viperrules24","wmlloydfloyd","2015-08-14 10:45:02","2015-08-14 10:45:02","1","3","Just try nova.astrometry.net","cu1waxc","cu292mz","cu1waxc"
"S_H_A_Z_A_M","Akriax","2015-08-14 12:01:26","2015-08-14 12:01:26","-1","31","New to Reddit, How do I save a thread so I can come back to it later? This is a great picture and has a lot of useful photography tidbits. Thanks!","cu2boan","cu2boan","3gvgnb"
"Ecahn","Akriax","2015-08-14 11:30:03","2015-08-14 11:30:03","1","25","I was wondering if the photo is edited at all? It's such a beautiful picture I must know if the original picture has been modified?","cu2allz","cu2allz","3gvgnb"
"relationship_tom","DrColdReality","2015-08-14 11:57:55","2015-08-14 11:57:55","1","14","Your right, that's about what I get, but it's not enough to distract me.","cu1u6tg","cu2bk4k","cu2art7"
"[deleted]","DrColdReality","2015-08-14 14:28:31","2015-08-14 14:28:31","1","1","[deleted]","cu1u6tg","cu2gbh7","cu1x3rb"
"Ryanimf","AtomicSkylark","2015-08-14 15:24:10","2015-08-14 15:24:10","3","32","just by looking at it it's hard to understand just how far away everything is. http://www.planetary.org/blogs/emily-lakdawalla/2012/3390.html?referrer=https://www.google.com/ This is just our galaxy and how little light speed radio have traveled in 70 years.","cu1uaaz","cu2hp1q","cu1uaaz"
"Chillysteezepheak","Akriax","2015-08-14 14:54:20","2015-08-14 14:54:20","1","25","Wish I had friends that were into this kind of stuff. I used to have a passion for space stuffs when I was a kid.","cu2gzaa","cu2gzaa","3gvgnb"
"Colonel_Swaggot","AtomicSkylark","2015-08-14 18:05:27","2015-08-14 18:05:27","14","23","Does the milky way actually look like it does in the picture? I dont know if pictures are exaggerated or if they accurate.","cu1uaaz","cu2ko65","cu1uaaz"
"mjolnirthunder","Akriax","2015-08-15 01:57:52","2015-08-15 01:57:52","1","36","This may seem like a really dumb question but how exactly are we able to see the Milky Way when we're in it? Or are we just seeing the edge of the galaxy closest to us?","cu2vtx4","cu2vtx4","3gvgnb"
"notnoah179","Akriax","2015-08-14 10:56:20","2015-08-14 10:56:20","0","54","It is really a shame that pictures like this only exist in certain places now because of polution etc. This picture is really amazing and I want it for my desktop background but it is taken vertically so It doesn't fit. You are one lucky person to be able to live next to this!","cu29gfw","cu29gfw","3gvgnb"
"UrbanDEV","Akriax","2015-08-14 14:45:29","2015-08-14 14:45:29","2","12","Awesome shot! I ran it through [Nik Tools](https://www.google.com/nikcollection/) Dfine 2 for noise reduction: https://i.imgur.com/bMaYI4j.jpg","cu2grcj","cu2grcj","3gvgnb"
"BasaltFormation","Akriax","2015-08-14 10:32:40","2015-08-14 10:32:40","3","17","You only got one shooting star during the perseids?!?! J/K great shot. Twas up by Mt Adams myself.","cu28nrh","cu28nrh","3gvgnb"
"1UP__VOTE","Akriax","2015-08-14 15:33:49","2015-08-14 15:33:49","2","16","This makes me crave a chocolate bar...I just can't think of what kind... Oh yeah a snickers.","cu2hwus","cu2hwus","3gvgnb"
"DrColdReality","[deleted]","2015-08-14 15:01:49","2015-08-14 15:01:49","1","113","No. Everything changes when you make long exposure. Human eyes suck at dark seeing. If you've ever been a a decent dark-sky area on a Moonless night, you might have seen the Milky Way. It can look pretty impressive if the sky is truly dark and the air is clear, but when you do a long-exposure photo, that brings out much more detail and lots more faint stars. Foreground objects (like the grass in OP's photo) might look completely dark. Fiddling with image in Photoshop can bring out even more detail, and some people take several shots of the same scene and then use software to ""stack"" the images, which gives you even more fine detail.","cu1u6tg","cu2h5xl","cu2gbh7"
"OPs_Moms_Fuck_Toy","DenebVegaAltair","2015-08-14 07:16:14","2015-08-14 07:16:14","3","11","Nikon has a new D810A that is supposedly specific to astrophotography!","cu1u6tg","cu21scd","cu1v5hu"
"neilson241","Manavj36","2015-08-14 18:49:12","2015-08-14 18:49:12","1","43","Virtually all photos of the MW are long exposures to bring out the most detail, so no, it doesn't look like this to your eye. But, in a dark enough place you can absolutely see the structure of it, just much fainter/less vibrant.","cu2783h","cu2lbgz","cu2783h"
"frankreddit5","Akriax","2015-08-15 02:45:01","2015-08-15 02:45:01","1","13","that's incredible. And I'm super jealous that you get to live near here.","cu2xpmh","cu2xpmh","3gvgnb"
"pawnmarcher","BUTT_GETTER","2015-08-14 21:21:21","2015-08-14 21:21:21","1","31","I feel the same way. Every time I see a pic like this, it makes me want to plan a vacation to a place where i can experience a view like this.","cu1uaaz","cu2nlks","cu2iab9"
"kuthedk","saruhtoninhoops","2015-08-14 08:36:53","2015-08-14 08:36:53","1","12","no thats one of the bands from our galaxy, the milky way","cu1zgi8","cu24rsw","cu1zgi8"
"KaptainCapture","GiantMTMilo","2015-08-14 07:10:56","2015-08-14 07:10:56","2","15","400 (or 300 works with a more sensitive camera) rule. 400 / *focal length* = appropriate shutter speed estimate","cu1u6tg","cu21kx1","cu1u6tg"
"Wesker405","Akriax","2015-08-14 14:55:07","2015-08-14 14:55:07","1","35","Ok so these types of pictures are like...long exposures or something right? Idk how photography works but I know I never can see this type of thing with my eyes. Even in the dark country","cu2gzyn","cu2gzyn","3gvgnb"
"Bbsloths","Akriax","2015-08-14 10:31:26","2015-08-14 10:31:26","1","21","This may sound ignorant, but can you see this with the naked eye? I barely see any stars in the city :(","cu28ma2","cu28ma2","3gvgnb"
"esskay04","juliancolton","2015-08-14 13:12:12","2015-08-14 13:12:12","0","28","Thats what i figured also, galaxys too thick for us to see intergalactic space. So is that white band just a particular dense area of the galaxy then?","cu24pn2","cu2e1tr","cu2d0s2"
"Gigidyy","Akriax","2015-08-14 11:44:53","2015-08-14 11:44:53","0","20","Im going to UO next year for school! Will I be able to get sweet pics like this near Eugene?","cu1waxc","cu2b41m","cu22wgb"
"Fawers","BUTT_GETTER","2015-08-14 21:39:53","2015-08-14 21:39:53","2","34","I feel you. Here where I live - *São Paulo*, Brazil -, I can't see the night sky because there's so much light pollution. I really wish I can see something like the picture some day!","cu1uaaz","cu2nxk1","cu2iab9"
"Hello-Universe","pentahiggs","2015-08-15 04:39:12","2015-08-15 04:39:12","1","44","the story of you seeing the milky way and obtaining some sort of philosophical view was good, just pointing out that seeing **only** the milky way provides no proper perspective on the actual size. tl;Dr the actual size is impossible for us to comprehend","cu1uaaz","cu32crj","cu2h8ag"
"DrColdReality","TheGoose","2015-08-16 09:17:28","2015-08-16 09:17:28","1","21","You've got quite a bit of streaking, though. Use a wider angle lens and a higher ISO, you can reduce that.","cu1u6tg","cu4brrx","cu49skb"
"ultimate555","BeansOnPumpernickel","2015-08-15 08:17:22","2015-08-15 08:17:22","1","15","I shall go into the wild and witness the glory of the sky at night","cu23ryw","cu3ar89","cu248lp"
"Tooplis","Akriax","2015-08-14 09:09:51","2015-08-14 09:09:51","1","15","If this doesn't make you feel small and insignificant, then I don't know what will...","cu25vdu","cu25vdu","3gvgnb"
