"source", "destination", "startingTime", "finishingTime", "score", "size", "message", "thread", "href", "parent"
"DenebVegaAltair","OPs_Moms_Fuck_Toy","2015-08-14 08:22:18","2015-08-14 08:22:18","1","16","I wonder what makes it an AP camera, given that it still has a CMOS sensor.","cu1u6tg","cu249fy","cu21scd"
"briefpu6969","Akriax","2015-08-14 11:25:12","2015-08-14 11:25:12","1","20","How is it possible to get a picture with all those stars and all those colors? Is it photo shop?","cu2affl","cu2affl","3gvgnb"
"daresi1000","Akriax","2015-08-14 09:55:31","2015-08-14 09:55:31","2","20","How is it possible to get a picture with all those stars and all those colors? Is it photo shop?","cu27eqn","cu27eqn","3gvgnb"
"nervousnedflanders","Akriax","2015-08-15 02:15:24","2015-08-15 02:15:24","1","19","Is there a full resolution of this photo you can share? I want to make it my phone background","cu2f5xi","cu2wiws","cu2fbxu"
"Dsiroon37","rambambobandy","2015-08-14 08:47:47","2015-08-14 08:47:47","57","39","In most urban places you can't see this at all. The best you get is scattered stars here and there. You really have to be in a place with not as much light pollution to see it like this.","cu1uaaz","cu2558g","cu2373l"
"OhnOshieDidnt77","Akriax","2015-08-14 07:01:26","2015-08-14 07:01:26","7","46","Is a tracker necessary for a photo like this? Where I shoot, I can JUST BARELY make out the milky way with my eyes, and can never get it as vivid in post processing. (Shooting with Nikon D90, 35mm lens...I really need to get a wider lens)","cu217n5","cu217n5","3gvgnb"
"DrColdReality","tyb0b","2015-08-14 12:53:54","2015-08-14 12:53:54","3","34","Oh sure, if the skies are clear enough. Yeah, you need to juice it up a bit in PS, but I never bother stacking. Might try it one of these days, just for grins.","cu1u6tg","cu2dfy1","cu2ctyp"
"nhawkl1","Akriax","2015-08-14 12:24:32","2015-08-14 12:24:32","1","21","Great photo. Can anyone tell me what the red dot is towards the upper top left of the image? A plane?","cu2cgid","cu2cgid","3gvgnb"
"Akriax","julienthegoblin","2015-08-14 13:53:56","2015-08-14 13:53:56","2","10","Have the focus marker between infinite and 10ft [Like this](http://imgur.com/0CvWfh4)","cu2f5xi","cu2fbxu","cu2f5xi"
"pentahiggs","Hello-Universe","2015-08-14 15:04:28","2015-08-14 15:04:28","1","12","How can the anecdote be great, if you just said it wasn't?","cu1uaaz","cu2h8ag","cu2ceh4"
"scrotalimplosion","Akriax","2015-08-14 09:15:10","2015-08-14 09:15:10","1","29","Lovely photo. I was at Rooster Rock and the sights were great (for me). First time I've witnessed the distant glow of the Milky Way with my own eyes.","cu1waxc","cu261op","cu22wgb"
"oh_lord","W4terb0y","2015-08-14 11:51:42","2015-08-14 11:51:42","3","182","Sure! It's always worth a shot. I can't quite find specifics on your camera in particular, but, here are some things to increase your chances: * Find **the darkest** place you can. Especially if your camera struggles in low light. The darker, the better! Use something like [this](http://darksitefinder.com/maps/unitedstates-15color.html) if you don't know where to look. * Set your camera to manual mode that lets you control shutter speed, aperture, and ISO. Turn the dial on top to the ""M"" mode. * Set your shutter speed to something like 30s. You'll need a tripod to help hold it still. * Open your aperture as much as you possibly can. All the way to f3.4. * Set your ISO to the highest, 3200 on your camera I think * Enable manual focus and try and focus to infinity. You might need to point it at a light far away to nail it. * shoot raw files if your camera supports it. It'll help in post. * Patience! It takes months sometimes to get the shot. A dSLR will certainlyl help, but it's by no means necessary. Try your cam! It might work out!","cu1u6tg","cu2bck6","cu28x0x"
"DrColdReality","relationship_tom","2015-08-14 11:35:00","2015-08-14 11:35:00","1","45","You're getting trails at 15-30 seconds, too. It's just that with a wide-enough angle lens, they are less noticeable. Look at the full-size of OPs shot, you'll see a little streaking. You really can't avoid them without ludicrously short exposures on seriously-wide lenses. Or a polar mount.","cu1u6tg","cu2art7","cu2acg8"
"whittery27","Akriax","2015-08-14 17:34:59","2015-08-14 17:34:59","1","15","This is AMAZING. thank you for this picture! i am very jealous of your view!!","cu2k77b","cu2k77b","3gvgnb"
"nealio1000","[deleted]","2015-08-14 11:26:56","2015-08-14 11:26:56","1","21","Well if you live in England you probably can't see the stars because it's cloudy as fuck almost all the time.","cu1uaaz","cu2ahlt","cu284wu"
"tomdan","Akriax","2015-08-14 21:49:56","2015-08-14 21:49:56","1","16","This is incredible. So you can actually take this shots with what equipment? It seems surreal.","cu2o4le","cu2o4le","3gvgnb"
"SammyYO","Akriax","2015-08-14 14:07:45","2015-08-14 14:07:45","1","17","Yes... https://www.reddit.com/r/space/comments/3fono6/got_up_at_3am_to_take_this_shot_of_the_milky_way/ctr4fzg I say the same thing about this one! Hah, Whats the best time to catch these???","cu1waxc","cu2fqj8","cu2fmu2"
"oh_lord","KaptainCapture","2015-08-14 07:34:39","2015-08-14 07:34:39","6","26","There are also great apps that let you point your phone up to the sky and ""look through"" them to what stars / constellations are behind them.","cu1xzuk","cu22i93","cu21s7p"
"Njoy32","Akriax","2015-08-14 19:02:07","2015-08-14 19:02:07","1","24","Ive always wanted to travel somewhere where i can see the milkyway as clear as this, any advcies? :D i live in Finland :D","cu2li8w","cu2li8w","3gvgnb"
"Ryanimf","Triggur121","2015-08-15 02:57:05","2015-08-15 02:57:05","1","54","It's an artist rendition.but it's truly mind blowing how big everything is. Radio waves are going 671 million miles an hour and have been traveling for 70 years and have only ventured out to a tiny bubble in our local galaxy, and even this scale is basically next door In the grand scheme of the universe.","cu1uaaz","cu2y73q","cu2xrtg"
"___ElJefe___","PizzaPlanet95","2015-08-14 12:42:40","2015-08-14 12:42:40","10","8","Highway 30 will take you right to this spot","cu1waxc","cu2d2h3","cu25r15"
"naughty_jesus","Akriax","2015-08-14 13:35:22","2015-08-14 13:35:22","2","76","My daughter and I took a walk around the park next to our house last night. We are in a valley, in a town of 2500, in the plains of North Dakota. On our 45 minute walk, we could clearly see the Milky Way and at least 15 good shooting stars. Some left green trails, some left red. Some were so small, all you could see were brief clouds of light, floating for a quarter second. It was amazing.","cu2ers8","cu2ers8","3gvgnb"
"TaylorS1986","Colonel_Swaggot","2015-08-17 04:35:59","2015-08-17 04:35:59","1","67","I grew up in a rural area so I thought seeing the Milky Way every clear, moonless night was a completely normal thing. Then I moved to Fargo and all you can see is the visible planets and the brightest stars. Fuck light pollution! And yes, it actually looks like that, though not as bright to the eye because cameras can take in more light through long exposures.","cu1uaaz","cu52cfo","cu2ko65"
"OPs_Moms_Fuck_Toy","DenebVegaAltair","2015-08-14 10:19:08","2015-08-14 10:19:08","1","16","They say they have enhanced a specific color sensitivity to enhance astro. It's an interesting concept.","cu1u6tg","cu287ac","cu249fy"
"DrColdReality","rjcarr","2015-08-15 00:23:38","2015-08-15 00:23:38","1","52","I was referring to the physical diameter of the aperture. The lower the F number the wider the aperture is. Faster is kind of a synonym for that. &gt;And for ""wide"" I assume When I'm referring to focal length, yes. Most people use the equivalent of of a 28mm focal length or wider.","cu1u6tg","cu2sb83","cu2l515"
"KaptainCapture","GiantMTMilo","2015-08-14 07:12:13","2015-08-14 07:12:13","0","6","DSLR w/ wide and fast lens","cu1u6tg","cu21moy","cu1v2sj"
"PM_ME_UR_TRAINS","Akriax","2015-08-14 13:52:17","2015-08-14 13:52:17","1","21","Straight up, I envy you. To be able to see that with me own eyes would be a dream come true.","cu1waxc","cu2fa70","cu22wgb"
"SpartanSK117","jamesbiff","2015-08-14 21:59:15","2015-08-14 21:59:15","2","9","People who have been lucky enough to see it.","cu1uaaz","cu2ob74","cu2lr4f"
"Anheroed","cityterrace","2015-08-14 09:34:38","2015-08-14 09:34:38","2","30","You could shoot at 18mm and get decent results. Remember the 500 rule, 500 Divided By the Focal Length of Your Lens = The Longest Exposure (in Seconds) Before Stars Start to “Trail”.","cu1u6tg","cu26oxw","cu238pw"
"esskay04","boulder0311","2015-08-14 13:16:11","2015-08-14 13:16:11","0","38","Interesting thanks. So that white band in the sky, is that towards the center of the galaxy that we are seeing? And the rest of the sky is the rest of the less dense section of the galaxy?","cu24pn2","cu2e68v","cu2d83y"
"karowhat","Pravus_Belua","2015-08-14 09:45:26","2015-08-14 09:45:26","2","15","They are appropriating the culture from the Milky Way. It's like white girls with dreadlocks.","cu25vn7","cu2728d","cu25vn7"
"boulder0311","esskay04","2015-08-14 13:36:34","2015-08-14 13:36:34","1","46","There's a black hole in the center of our galaxy which pulls gas and so much galactic dust to the center due to its gravitational pull. That's why we see those white milky clouds. And you're right around that is the other arms of the Galaxy.","cu24pn2","cu2et44","cu2e68v"
"Xalteox","daresi1000","2015-08-14 10:03:16","2015-08-14 10:03:16","3","6","Stars aren't all the same color.","cu27eqn","cu27o5i","cu27eqn"
"Zlataniszlatan","Akriax","2015-08-14 19:06:40","2015-08-14 19:06:40","1","17","As an Oregonian, as soon as I opened that picture I knew it was an Oregon view.","cu2lkq2","cu2lkq2","3gvgnb"
"snoozinglion","Akriax","2015-08-14 20:11:07","2015-08-14 20:11:07","1","6","Under The Milky Way - The Church https://www.youtube.com/watch?v=Y9_7e1rQU_U","cu2miby","cu2miby","3gvgnb"
"neilson241","Chikenofthecave","2015-08-14 18:58:16","2015-08-14 18:58:16","2","24","Briefly: wide angle lens, as long of an exposure you can handle with that lens, high ISO, slightly less than infinite focus, post processing.","cu2fa7g","cu2lg82","cu2fa7g"
"Gryphon88","Akriax","2015-08-15 01:23:28","2015-08-15 01:23:28","1","22","Thank you for this picture it is beautiful I wish I could wake up and see that everyday I'm slightly jealous lol.","cu2ui1v","cu2ui1v","3gvgnb"
"GiantMTMilo","_bar","2015-08-14 05:42:41","2015-08-14 05:42:41","1","10","No I do not, but I wanna get into it.","cu1u6tg","cu1y0j7","cu1wg5f"
"iclimbnaked","Grey_Kit","2015-08-14 22:46:09","2015-08-14 22:46:09","1","49","It never looks as good as the photo in person. That said if it is a dark night and you are away from the city you can see the milky way with your naked eye. Its no where near as bright and vibrant as the photo but its there.","cu270m9","cu2pda2","cu270m9"
"esskay04","Kikariska","2015-08-14 10:31:23","2015-08-14 10:31:23","1","41","So that white band is us looking into the center of the spiral? If thats the case, is it safe to assume the dark sky to the left and right of the white band is intergalactic space outside the milky way?","cu24pn2","cu28m84","cu27rwr"
"tronpalmer","Akriax","2015-08-14 10:39:45","2015-08-14 10:39:45","2","61","Did you use a computer to frame it or control the shutter? What time was this taken at? What did you use for editing? Was the moon bright last night? Sorry for all the questions, seriously amazing shot, though. I tried to do a 5 minute exposure (10 30 second shots) and stack them and it did not come out nearly as clear as this.","cu26arg","cu28waa","cu26pje"
"acm","julienthegoblin","2015-08-14 15:36:49","2015-08-14 15:36:49","1","39","hit live view and the use the DSLR menu to zoom in on a bright star as much as you can. You should be able to tweak the focus and easily tell if it made it sharper or not.","cu2f5xi","cu2hza5","cu2f5xi"
"Hingl_McCringleberry","Akriax","2015-08-14 14:21:54","2015-08-14 14:21:54","1","33","Nice that you captured one of the Perseid meteors in the far ~~right~~ left of the frame. Adds to the ethereal quality of the picture Edit: guess I'm still learning my right from left","cu1waxc","cu2g4ys","cu22wgb"
"neilson241","Wesker405","2015-08-14 18:59:31","2015-08-14 18:59:31","2","11","Yes, they are. Collecting light for a longer period = more detail.","cu2gzyn","cu2lgwi","cu2gzyn"
"Akriax","ura_walrus","2015-08-14 07:46:03","2015-08-14 07:46:03","23","11","That was my headlamp on the foreground for a split second.","cu222cn","cu22xln","cu222cn"
"ura_walrus","oh_lord","2015-08-14 07:59:14","2015-08-14 07:59:14","5","38","Yes RAW! I will definitely play with it. This is such great information. I am so excited to get out there again! I was giggling like an idiot in the middle of the night it is so amazing.","cu1u6tg","cu23fa7","cu22dpx"
"neilson241","[deleted]","2015-08-14 19:05:56","2015-08-14 19:05:56","2","23","Yes, but typically people who shoot the MW are talking about the galactic center instead of the comparatively boring rest of the stars.","cu2ijst","cu2lkat","cu2ijst"
"neilson241","Twizzler____","2015-08-14 19:04:26","2015-08-14 19:04:26","2","63","A long exposure is simply leaving the shutter open for an extended period of time and allowing it to collect more light than normal. A photo of your friend during the day might require only 1/800 second to gather the light, but astrophotographers use 10-90s+ exposures since their subjects are so faint and the dark surroundings (ņight time) allow it without overexposing the shot.","cu2i2ai","cu2ljhn","cu2i2ai"
"jpastore","acm","2015-08-14 22:12:28","2015-08-14 22:12:28","2","21","Well I didn't get that from the thread. Clearly I have no experience with astrophotography. But I certainly love the images.","cu222cn","cu2ol61","cu2huqd"
"Green4Jesus20","Akriax","2015-08-15 01:19:23","2015-08-15 01:19:23","1","15","The milky way leaves behind a wife a 3 kids. It was several billion years old.","cu2ucgk","cu2ucgk","3gvgnb"
"were-worm","machanari","2015-08-14 16:22:58","2015-08-14 16:22:58","1","14","Astoria is a small city in north-west Oregon; Oregon is a state in America.","cu1waxc","cu2ixhj","cu2h48b"
"neilson241","whittery27","2015-08-14 19:06:48","2015-08-14 19:06:48","0","18","Most likely a plane since there's a pattern in the steak, i.e. a flashing light in the distance.","cu2ivw6","cu2lksq","cu2k6yj"
"sand500","sportsziggy","2015-08-14 13:54:44","2015-08-14 13:54:44","2","8","What settings did you use on your phone?","cu1u6tg","cu2fcsw","cu2ccji"
"DenebVegaAltair","GiantMTMilo","2015-08-14 04:31:01","2015-08-14 04:31:01","2","21","The camera is set to a long exposure length which lets in more light, amplifying the dim parts of the sky.","cu1u6tg","cu1v0oy","cu1u6tg"
"GameBreak","Akriax","2015-08-14 10:47:31","2015-08-14 10:47:31","5","25","Do you have to do an exposure shot or something? Or just flash and go. Its my dream to see something like this in person.","cu1waxc","cu295mg","cu22wgb"
"jamesbiff","BUTT_GETTER","2015-08-14 19:18:15","2015-08-14 19:18:15","41","6","What do you mean 'you people'?","cu1uaaz","cu2lr4f","cu2iab9"
"DrColdReality","iplaygaem","2015-08-14 11:31:50","2015-08-14 11:31:50","2","21","BTW, looks like they've *considerably* improved the low-light handling in the newer GoPros. My GP 2 can't handle dim light for beans.","cu1u6tg","cu2ansl","cu28koo"
"Makavelli_","Akriax","2015-08-14 16:30:57","2015-08-14 16:30:57","1","17","Could anyone give a tip on how to capture a long exposure using a Canon Rebel xTi?","cu2j34i","cu2j34i","3gvgnb"
"nyyankees1237","DerpsMcGeeOnDowns","2015-08-14 10:49:10","2015-08-14 10:49:10","20","6","Surely not the NYC Astoria, eh","cu1waxc","cu297n4","cu26ap4"
"negro_please","Akriax","2015-08-14 16:58:46","2015-08-14 16:58:46","1","8","Thank you for making my phone look awesome! http://imgur.com/ytotMh7","cu2jlod","cu2jlod","3gvgnb"
"PizzaPlanet95","Akriax","2015-08-14 09:06:12","2015-08-14 09:06:12","22","16","Is it hard to get to Nicolai mountain, I live near Portland and this looks awesome.","cu1waxc","cu25r15","cu22wgb"
"ura_walrus","Akriax","2015-08-14 09:37:58","2015-08-14 09:37:58","5","21","Edit: note that I'm serious in my reply above. I can't believe such a simple idea brings such a great picture.","cu222cn","cu26t1k","cu22xln"
"razztafarai","Akriax","2015-08-14 21:02:54","2015-08-14 21:02:54","1","23","is there place on earth where the milky way appears straight on the horizon? Or is the entire soalr system at an angle?","cu2naae","cu2naae","3gvgnb"
"intothechromosphere","Akriax","2015-08-14 18:37:48","2015-08-14 18:37:48","1","12","Can I ask what kit and settings you used please? Beautiful picture!","cu2l5k2","cu2l5k2","3gvgnb"
"Capn_Zerk","Akriax","2015-08-14 17:40:56","2015-08-14 17:40:56","1","16","""And on the left hand side of the photo we can see all of China exploding.""","cu2kaka","cu2kaka","3gvgnb"
"TheSupervoid","Akriax","2015-08-14 22:48:44","2015-08-14 22:48:44","1","10","Milky Way shot last night. Currently in critical condition. #blackgalaxiesmatter","cu2pfmn","cu2pfmn","3gvgnb"
"greywindow","Akriax","2015-08-14 08:35:06","2015-08-14 08:35:06","3","43","So what are we looking at in pics like this? We are in the Milky Way, so what are we seeing exactly? Are we looking towards the interior? Just part of a spiral arm? Towards open space and the interior is behind us?","cu24pn2","cu24pn2","3gvgnb"
"Pravus_Belua","Akriax","2015-08-14 09:10:04","2015-08-14 09:10:04","7","39","I really wish people would quit shooting the Milky Way. Galactic lives matter! In all seriousness, beautiful image. Thank you for sharing it with us, reminds me of the clarity of the night sky where I grew up (Death Valley).","cu25vn7","cu25vn7","3gvgnb"
"acm","jpastore","2015-08-14 15:31:12","2015-08-14 15:31:12","3","11","not an accident. a lot of milky way photographers do this.","cu222cn","cu2huqd","cu258ai"
"cmperry51","neihuffda","2015-08-15 03:07:49","2015-08-15 03:07:49","1","16","&gt; Can someone please tell me what this is? Aircraft: time exposure makes strobe flashes appear persistent.","cu2ivw6","cu2ympi","cu2jq0n"
"Kikariska","greywindow","2015-08-14 10:06:27","2015-08-14 10:06:27","1","22","The galaxy gets much more crowded towards the centre so much so that it is noticable from our position on the arm","cu24pn2","cu27rwr","cu24pn2"
"bryanpcox","Akriax","2015-08-14 08:46:34","2015-08-14 08:46:34","2","15","the milky way shot!?...boy, if thats the case then some weird shit is going down","cu253rg","cu253rg","3gvgnb"
"HaplessDiglett","DrColdReality","2015-08-15 02:43:31","2015-08-15 02:43:31","1","52","Ahh, I see. I've been out to the desert about an hour away from the city I live in and seen many stars and a faint white outline of the Milky Way. But never seen so many vivid colors or sheer number of stars as depicted in pictures like these. Thanks for explaining!","cu1u6tg","cu2xnek","cu2sgr3"
"Mad_Jukes","Bbsloths","2015-08-14 10:56:10","2015-08-14 10:56:10","1","19","Oh yes, out in the country you can see it for sure. It's really incredible and blows your mind.","cu28ma2","cu29g8h","cu28ma2"
"bunchofbollucks","projekt3","2015-08-14 10:00:21","2015-08-14 10:00:21","3","26","I don't think you'll get even close to this with the naked eye. The long exposure is what make that brightness possible. It is beautiful though!","cu24rl5","cu27kmf","cu24rl5"
"DrColdReality","iplaygaem","2015-08-14 11:30:26","2015-08-14 11:30:26","3","87","&gt;but what is the 3mm measurement? The GoPro uses a lens that has a focal length of ~3 mm. To equate that to a 35mm camera, that's ~16 mm, which is a serious wide angle. &gt;I suppose the first number is the number of microsecords for the exposure? I've never seen a consumer-grade camera that works in the microsecond range, but it might be. Try changing the exposure to something else, see if the number changes. &gt; Does the second value relate to the ISO? I don't recognize the second number at all.","cu1u6tg","cu2am3v","cu28koo"
"wthreye","Dr4Green2Thumb0","2015-08-15 00:23:29","2015-08-15 00:23:29","1","6","You people do mean... you what?","cu1uaaz","cu2sb13","cu2nsfi"
"AtomicSkylark","Colonel_Swaggot","2015-08-14 19:05:44","2015-08-14 19:05:44","3","41","It was a very clear night and the Milky Way looked like a faint cloudy band across the whole sky. No colours like in this photo though it mostly looks black and white. Wish our eyes could do a 30 second exposure!","cu1uaaz","cu2lk6k","cu2ko65"
"karantza","flamebird3","2015-08-14 08:56:08","2015-08-14 08:56:08","1","5","Stellarium Mobile is my favorite!","cu1xzuk","cu25faq","cu245rk"
"carljungfan","Akriax","2015-08-14 14:13:17","2015-08-14 14:13:17","1","19","I wish I had a sweet camera. I love space and these are the only pictures I would take.","cu2fwbx","cu2fwbx","3gvgnb"
"wmlloydfloyd","Akriax","2015-08-14 05:01:20","2015-08-14 05:01:20","124","80","Nice shot. Where was this taken from? [Here's a similar picture](http://www.macnmotion.com/temp/Sag_3937Labelled.jpg) with a lot of the stuff labeled. There are tons of clusters and gas clouds here, looking directly towards the center of the galaxy, and many of them are easily identifiable on your photo -- I can easily find the Lagoon and Trifid, M22, M24, etc. (You could also use Ciel or Stellarium to identify some -- not all the labels on the photo above are correct, but it's a good start.)","cu1waxc","cu1waxc","3gvgnb"
"Anheroed","GiantMTMilo","2015-08-14 09:34:09","2015-08-14 09:34:09","1","31","You could shoot at 18mm and get decent results. Remember the 500 rule, 500 Divided By the Focal Length of Your Lens = The Longest Exposure (in Seconds) Before Stars Start to “Trail”.","cu1u6tg","cu26ocp","cu1u6tg"
"Omnomnomnivor3","Akriax","2015-08-14 11:10:17","2015-08-14 11:10:17","1","18","Holy cow, you're like living in paradise! I can't imagine getting to see a night sky like that !","cu29xby","cu29xby","3gvgnb"
"money_run_things","Akriax","2015-08-14 12:43:21","2015-08-14 12:43:21","2","20","how nice of a camera do you need to get a shot like this? (I know very little about photography)","cu2d3bx","cu2d3bx","3gvgnb"
"oh_lord","ura_walrus","2015-08-14 07:31:23","2015-08-14 07:31:23","39","403","If you overexposed, you might still be alright. Did you shoot RAW? If so, try pulling the exposure down. If you're having trouble, post the file (or PM it to me!) and I'll try and help out. Cameras are much better at saving highlight detail versus shadow detail (since shadow details there's no information to begin with, and highlights is _too much_ information). Overexposing is actually a really common method of bringing out more detail in the sky when there's more light pollution. As for OP's photo, it doesn't look stacked, rather, he used a flashlight (note the blue-tinge of the light, I suspect an LED. Also, the strong focus of the light and the sharp cutoff on the surrounding area) to illuminate the grass in front of him. The stars do not emit a lot of light onto the ground and for you to be able to see the milky way this clearly, the moon cannot be bright enough to help out either, so, you could expose for many minutes and likely never get the ground properly lit. At that point, the sky will be way overexposed and blurry, too. Try splashing a little light onto a foreground object with your phone or a flashlight. Keep the source of the light (the LED) behind the camera or out of the frame to prevent flaring and a hotspot (you'll end up drawing a sharp line in the air a la light painting) on your image. Just shoot the light out from behind your camera like you're spray-painting it on the ground. Try and light every surface evenly to keep it natural looking, and don't hold the light too still for too long. You don't need to continuously light the surface throughout the photograph, just a quick pass here and there. If you need more light, make a second or third pass, or just go a little slower. It requires some practise, but you can get it easily! Lastly (since this post isn't long enough!), careful with those 30s exposures. In astrophotography, you need to adhere to the ""rule of 600"" that says your exposure shouldn't be longer than 600 / focal length of your lens. Else your stars will come out blurry. Hopefully this helps you or someone else passing through! Keep trying. I've been photographing the milky way for over a year and can say I've only just now started getting shots that weren't total and utter crap. :)","cu1u6tg","cu22dpx","cu21vdx"
"GiantMTMilo","AtomicSkylark","2015-08-14 04:32:26","2015-08-14 04:32:26","2","19","What kind of camera would I need to do this? Because I would love to do pictures like this","cu1u6tg","cu1v2sj","cu1ubgq"
"neilson241","Twizzler____","2015-08-15 04:05:27","2015-08-15 04:05:27","2","13","Yup! Just exposes the inner sensor to light for much longer. You're welcome!","cu2i2ai","cu30zgj","cu2yrub"
"Chevron","flamebird3","2015-08-14 09:30:09","2015-08-14 09:30:09","2","9","I use StarWalk on my iPhone and it's decent.","cu1xzuk","cu26jkk","cu245rk"
"boyyouguysaredumb","GameBreak","2015-08-14 12:02:46","2015-08-14 12:02:46","9","19","A flash would do nothing to see the milky way. He just left the shutter open for around 15s","cu1waxc","cu2bpuj","cu295mg"
"sportsziggy","DrColdReality","2015-08-14 12:21:17","2015-08-14 12:21:17","1","8","&gt;A phone ain't gonna cut it. http://imgur.com/a/T1Y8r - LG G4","cu1u6tg","cu2ccji","cu1x3rb"
"cogitoergosam","KaptainCapture","2015-08-14 09:59:01","2015-08-14 09:59:01","1","17","I used this one for the first time last night watching the perseids and it was fantastic.","cu1xzuk","cu27j0i","cu26e4h"
"marcustoic","Akriax","2015-09-06 21:36:44","2015-09-06 21:36:44","1","18","When /r/space makes it to the front page, if I'm not paying attention, I expect flying candy bars.","cusdwro","cusdwro","3gvgnb"
